(window.webpackJsonp=window.webpackJsonp||[]).push([[1],[function(t,e,l){"use strict";l.d(e,"e",(function(){return y})),l.d(e,"d",(function(){return b})),l.d(e,"c",(function(){return x})),l.d(e,"f",(function(){return k})),l.d(e,"a",(function(){return P})),l.d(e,"g",(function(){return _})),l.d(e,"b",(function(){return w})),l.d(e,"h",(function(){return T}));l(55),l(157);var s=l(3),r={Categories:()=>l.e(6).then(l.bind(null,323)),Category:()=>l.e(2).then(l.bind(null,324)),GlobalLayout:()=>Promise.resolve().then(l.bind(null,1)),Home:()=>l.e(5).then(l.bind(null,325)),Layout:()=>l.e(11).then(l.bind(null,320)),NotFound:()=>l.e(8).then(l.bind(null,326)),Page:()=>l.e(12).then(l.bind(null,327)),Post:()=>l.e(9).then(l.bind(null,322)),Posts:()=>l.e(3).then(l.bind(null,328)),Tag:()=>l.e(4).then(l.bind(null,329)),Tags:()=>l.e(7).then(l.bind(null,330))},a={"v-05aa5a72":()=>l.e(13).then(l.bind(null,332)),"v-47d11919":()=>l.e(15).then(l.bind(null,333)),"v-4d2c21d2":()=>l.e(20).then(l.bind(null,334)),"v-4cf30fb5":()=>l.e(18).then(l.bind(null,335)),"v-e63a3eca":()=>l.e(21).then(l.bind(null,336)),"v-659f2c17":()=>l.e(17).then(l.bind(null,337)),"v-5406ead7":()=>l.e(22).then(l.bind(null,338)),"v-90b06392":()=>l.e(23).then(l.bind(null,339)),"v-769abb97":()=>l.e(16).then(l.bind(null,340)),"v-479cd89b":()=>l.e(24).then(l.bind(null,341)),"v-1b2fc321":()=>l.e(26).then(l.bind(null,342)),"v-5ac843d2":()=>l.e(19).then(l.bind(null,343)),"v-451d4ef7":()=>l.e(27).then(l.bind(null,344)),"v-2ea06bd2":()=>l.e(14).then(l.bind(null,345)),"v-59dd9667":()=>l.e(25).then(l.bind(null,346)),"v-727bdcd7":()=>l.e(29).then(l.bind(null,347)),"v-c20a3d3a":()=>l.e(28).then(l.bind(null,348)),"v-82ef379e":()=>l.e(30).then(l.bind(null,349)),"v-3b2e133e":()=>l.e(32).then(l.bind(null,350)),"v-6c901c52":()=>l.e(31).then(l.bind(null,351)),"v-02b9bb49":()=>l.e(33).then(l.bind(null,352)),"v-5859a1d2":()=>l.e(34).then(l.bind(null,353)),"v-6a2fdcdd":()=>l.e(35).then(l.bind(null,354)),"v-5c8c14ad":()=>l.e(36).then(l.bind(null,355)),"v-40322b92":()=>l.e(38).then(l.bind(null,356)),"v-a5140402":()=>l.e(40).then(l.bind(null,357)),"v-4f270427":()=>l.e(39).then(l.bind(null,358)),"v-3c1a57b7":()=>l.e(41).then(l.bind(null,359)),"v-67bd99b7":()=>l.e(37).then(l.bind(null,360)),"v-66101e52":()=>l.e(42).then(l.bind(null,361)),"v-652145d2":()=>l.e(46).then(l.bind(null,362)),"v-67baae1e":()=>l.e(43).then(l.bind(null,363)),"v-242cbd57":()=>l.e(50).then(l.bind(null,364)),"v-483c3f97":()=>l.e(44).then(l.bind(null,365)),"v-53b0f14d":()=>l.e(45).then(l.bind(null,366)),"v-fb815392":()=>l.e(48).then(l.bind(null,367)),"v-448645d2":()=>l.e(47).then(l.bind(null,368)),"v-6f067db4":()=>l.e(53).then(l.bind(null,369)),"v-29605312":()=>l.e(52).then(l.bind(null,370)),"v-19e0cb92":()=>l.e(51).then(l.bind(null,371)),"v-55ece897":()=>l.e(49).then(l.bind(null,372))};function o(t){const e=Object.create(null);return function(l){return e[l]||(e[l]=t(l))}}const n=/-(\w)/g,i=o(t=>t.replace(n,(t,e)=>e?e.toUpperCase():"")),p=/\B([A-Z])/g,u=o(t=>t.replace(p,"-$1").toLowerCase()),c=o(t=>t.charAt(0).toUpperCase()+t.slice(1));function h(t,e){if(!e)return;if(t(e))return t(e);return e.includes("-")?t(c(i(e))):t(c(e))||t(u(e))}const d=Object.assign({},r,a),g=t=>d[t],v=t=>a[t],m=t=>r[t],f=t=>s.a.component(t);function y(t){return h(v,t)}function b(t){return h(m,t)}function x(t){return h(g,t)}function k(t){return h(f,t)}function P(...t){return Promise.all(t.filter(t=>t).map(async t=>{if(!k(t)&&x(t)){const e=await x(t)();s.a.component(t,e.default)}}))}function _(t,e,l){switch(e){case"components":t[e]||(t[e]={}),Object.assign(t[e],l);break;case"mixins":t[e]||(t[e]=[]),t[e].push(...l);break;default:throw new Error("Unknown option name.")}}function w(t,e){for(let l=0;l<t.length;l++){const s=t[l];if(s.key===e)return s}return{path:"",frontmatter:{}}}function T(t,e){"undefined"!=typeof window&&window.__VUEPRESS__&&(window.__VUEPRESS__[t]=e)}},,,,function(t,e,l){var s=l(63),r=s.all;t.exports=s.IS_HTMLDDA?function(t){return"function"==typeof t||t===r}:function(t){return"function"==typeof t}},function(t,e){t.exports=function(t){try{return!!t()}catch(t){return!0}}},function(t,e,l){var s=l(34),r=Function.prototype,a=r.call,o=s&&r.bind.bind(a,a);t.exports=s?o:function(t){return function(){return a.apply(t,arguments)}}},function(t,e){var l=function(t){return t&&t.Math==Math&&t};t.exports=l("object"==typeof globalThis&&globalThis)||l("object"==typeof window&&window)||l("object"==typeof self&&self)||l("object"==typeof global&&global)||function(){return this}()||Function("return this")()},,function(t,e,l){var s=l(5);t.exports=!s((function(){return 7!=Object.defineProperty({},1,{get:function(){return 7}})[1]}))},,,function(t,e,l){var s=l(6),r=l(42),a=s({}.hasOwnProperty);t.exports=Object.hasOwn||function(t,e){return a(r(t),e)}},function(t,e,l){var s=l(4),r=l(63),a=r.all;t.exports=r.IS_HTMLDDA?function(t){return"object"==typeof t?null!==t:s(t)||t===a}:function(t){return"object"==typeof t?null!==t:s(t)}},,,function(t,e,l){var s=l(9),r=l(22),a=l(35);t.exports=s?function(t,e,l){return r.f(t,e,a(1,l))}:function(t,e,l){return t[e]=l,t}},,,,,function(t,e,l){var s=l(6),r=s({}.toString),a=s("".slice);t.exports=function(t){return a(r(t),8,-1)}},function(t,e,l){var s=l(9),r=l(72),a=l(133),o=l(43),n=l(62),i=TypeError,p=Object.defineProperty,u=Object.getOwnPropertyDescriptor;e.f=s?a?function(t,e,l){if(o(t),e=n(e),o(l),"function"==typeof t&&"prototype"===e&&"value"in l&&"writable"in l&&!l.writable){var s=u(t,e);s&&s.writable&&(t[e]=l.value,l={configurable:"configurable"in l?l.configurable:s.configurable,enumerable:"enumerable"in l?l.enumerable:s.enumerable,writable:!1})}return p(t,e,l)}:p:function(t,e,l){if(o(t),e=n(e),o(l),r)try{return p(t,e,l)}catch(t){}if("get"in l||"set"in l)throw i("Accessors not supported");return"value"in l&&(t[e]=l.value),t}},,,,,,,,,,function(t,e,l){var s=l(7),r=l(58).f,a=l(16),o=l(134),n=l(41),i=l(74),p=l(150);t.exports=function(t,e){var l,u,c,h,d,g=t.target,v=t.global,m=t.stat;if(l=v?s:m?s[g]||n(g,{}):(s[g]||{}).prototype)for(u in e){if(h=e[u],c=t.dontCallGetSet?(d=r(l,u))&&d.value:l[u],!p(v?u:g+(m?".":"#")+u,t.forced)&&void 0!==c){if(typeof h==typeof c)continue;i(h,c)}(t.sham||c&&c.sham)&&a(h,"sham",!0),o(l,u,h,t)}}},function(t,e,l){var s=l(34),r=Function.prototype.call;t.exports=s?r.bind(r):function(){return r.apply(r,arguments)}},function(t,e,l){var s=l(5);t.exports=!s((function(){var t=function(){}.bind();return"function"!=typeof t||t.hasOwnProperty("prototype")}))},function(t,e){t.exports=function(t,e){return{enumerable:!(1&t),configurable:!(2&t),writable:!(4&t),value:e}}},function(t,e,l){var s=l(59),r=l(60);t.exports=function(t){return s(r(t))}},function(t,e,l){var s=l(7),r=l(4),a=function(t){return r(t)?t:void 0};t.exports=function(t,e){return arguments.length<2?a(s[t]):s[t]&&s[t][e]}},function(t,e,l){var s=l(4),r=l(130),a=TypeError;t.exports=function(t){if(s(t))return t;throw a(r(t)+" is not a function")}},function(t,e,l){var s=l(7),r=l(69),a=l(12),o=l(71),n=l(67),i=l(66),p=s.Symbol,u=r("wks"),c=i?p.for||p:p&&p.withoutSetter||o;t.exports=function(t){return a(u,t)||(u[t]=n&&a(p,t)?p[t]:c("Symbol."+t)),u[t]}},function(t,e,l){var s=l(7),r=l(41),a=s["__core-js_shared__"]||r("__core-js_shared__",{});t.exports=a},function(t,e,l){var s=l(7),r=Object.defineProperty;t.exports=function(t,e){try{r(s,t,{value:e,configurable:!0,writable:!0})}catch(l){s[t]=e}return e}},function(t,e,l){var s=l(60),r=Object;t.exports=function(t){return r(s(t))}},function(t,e,l){var s=l(13),r=String,a=TypeError;t.exports=function(t){if(s(t))return t;throw a(r(t)+" is not an object")}},function(t,e,l){var s=l(147);t.exports=function(t){return s(t.length)}},,,,,,,,,,,function(t,e,l){"use strict";var s=l(32),r=l(42),a=l(44),o=l(154),n=l(156);s({target:"Array",proto:!0,arity:1,forced:l(5)((function(){return 4294967297!==[].push.call({length:4294967296},1)}))||!function(){try{Object.defineProperty([],"length",{writable:!1}).push()}catch(t){return t instanceof TypeError}}()},{push:function(t){var e=r(this),l=a(e),s=arguments.length;n(l+s);for(var i=0;i<s;i++)e[l]=arguments[i],l++;return o(e,l),l}})},function(t,e,l){var s=l(286);t.exports=function(t,e){var l=s(t).getTime(),r=s(e).getTime();return l>r?-1:l<r?1:0}},,function(t,e,l){var s=l(9),r=l(33),a=l(126),o=l(35),n=l(36),i=l(62),p=l(12),u=l(72),c=Object.getOwnPropertyDescriptor;e.f=s?c:function(t,e){if(t=n(t),e=i(e),u)try{return c(t,e)}catch(t){}if(p(t,e))return o(!r(a.f,t,e),t[e])}},function(t,e,l){var s=l(6),r=l(5),a=l(21),o=Object,n=s("".split);t.exports=r((function(){return!o("z").propertyIsEnumerable(0)}))?function(t){return"String"==a(t)?n(t,""):o(t)}:o},function(t,e,l){var s=l(61),r=TypeError;t.exports=function(t){if(s(t))throw r("Can't call method on "+t);return t}},function(t,e){t.exports=function(t){return null==t}},function(t,e,l){var s=l(127),r=l(64);t.exports=function(t){var e=s(t,"string");return r(e)?e:e+""}},function(t,e){var l="object"==typeof document&&document.all,s=void 0===l&&void 0!==l;t.exports={all:l,IS_HTMLDDA:s}},function(t,e,l){var s=l(37),r=l(4),a=l(65),o=l(66),n=Object;t.exports=o?function(t){return"symbol"==typeof t}:function(t){var e=s("Symbol");return r(e)&&a(e.prototype,n(t))}},function(t,e,l){var s=l(6);t.exports=s({}.isPrototypeOf)},function(t,e,l){var s=l(67);t.exports=s&&!Symbol.sham&&"symbol"==typeof Symbol.iterator},function(t,e,l){var s=l(68),r=l(5);t.exports=!!Object.getOwnPropertySymbols&&!r((function(){var t=Symbol();return!String(t)||!(Object(t)instanceof Symbol)||!Symbol.sham&&s&&s<41}))},function(t,e,l){var s,r,a=l(7),o=l(128),n=a.process,i=a.Deno,p=n&&n.versions||i&&i.version,u=p&&p.v8;u&&(r=(s=u.split("."))[0]>0&&s[0]<4?1:+(s[0]+s[1])),!r&&o&&(!(s=o.match(/Edge\/(\d+)/))||s[1]>=74)&&(s=o.match(/Chrome\/(\d+)/))&&(r=+s[1]),t.exports=r},function(t,e,l){var s=l(70),r=l(40);(t.exports=function(t,e){return r[t]||(r[t]=void 0!==e?e:{})})("versions",[]).push({version:"3.30.1",mode:s?"pure":"global",copyright:"© 2014-2023 Denis Pushkarev (zloirock.ru)",license:"https://github.com/zloirock/core-js/blob/v3.30.1/LICENSE",source:"https://github.com/zloirock/core-js"})},function(t,e){t.exports=!1},function(t,e,l){var s=l(6),r=0,a=Math.random(),o=s(1..toString);t.exports=function(t){return"Symbol("+(void 0===t?"":t)+")_"+o(++r+a,36)}},function(t,e,l){var s=l(9),r=l(5),a=l(132);t.exports=!s&&!r((function(){return 7!=Object.defineProperty(a("div"),"a",{get:function(){return 7}}).a}))},function(t,e){t.exports={}},function(t,e,l){var s=l(12),r=l(141),a=l(58),o=l(22);t.exports=function(t,e,l){for(var n=r(e),i=o.f,p=a.f,u=0;u<n.length;u++){var c=n[u];s(t,c)||l&&s(l,c)||i(t,c,p(e,c))}}},function(t,e,l){var s=l(146);t.exports=function(t){var e=+t;return e!=e||0===e?0:s(e)}},function(t,e,l){var s=l(160),r=l(43),a=l(161);t.exports=Object.setPrototypeOf||("__proto__"in{}?function(){var t,e=!1,l={};try{(t=s(Object.prototype,"__proto__","set"))(l,[]),e=l instanceof Array}catch(t){}return function(l,s){return r(l),a(s),e?t(l,s):l.__proto__=s,l}}():void 0)},,,,,,,,,,,,,,,,,,,,,,,,,,function(t,e){var l=Object.prototype.hasOwnProperty,s=Object.prototype.toString;function r(t){if(!t||"[object Object]"!==s.call(t)||t.nodeType||t.setInterval)return!1;var e,r=l.call(t,"constructor"),a=l.call(t.constructor.prototype,"isPrototypeOf");if(t.constructor&&!r&&!a)return!1;for(e in t);return void 0===e||l.call(t,e)}t.exports=function t(){var e,l,s,a,o,n,i=arguments[0]||{},p=1,u=arguments.length,c=!1;for("boolean"==typeof i&&(c=i,i=arguments[1]||{},p=2),"object"!=typeof i&&"function"!=typeof i&&(i={});p<u;p++)if(null!=(e=arguments[p]))for(l in e)s=i[l],i!==(a=e[l])&&(c&&a&&(r(a)||(o=Array.isArray(a)))?(o?(o=!1,n=s&&Array.isArray(s)?s:[]):n=s&&r(s)?s:{},i[l]=t(c,n,a)):void 0!==a&&(i[l]=a));return i}},,,,,,,,,,,function(t,e,l){},,function(t,e,l){},function(t,e,l){},,function(t,e,l){"use strict";
/*!
 * escape-html
 * Copyright(c) 2012-2013 TJ Holowaychuk
 * Copyright(c) 2015 Andreas Lubbe
 * Copyright(c) 2015 Tiancheng "Timothy" Gu
 * MIT Licensed
 */var s=/["'&<>]/;t.exports=function(t){var e,l=""+t,r=s.exec(l);if(!r)return l;var a="",o=0,n=0;for(o=r.index;o<l.length;o++){switch(l.charCodeAt(o)){case 34:e="&quot;";break;case 38:e="&amp;";break;case 39:e="&#39;";break;case 60:e="&lt;";break;case 62:e="&gt;";break;default:continue}n!==o&&(a+=l.substring(n,o)),n=o+1,a+=e}return n!==o?a+l.substring(n,o):a}},,,,function(t,e,l){"use strict";e.a={}},function(t,e,l){"use strict";e.a={"技术文章":{path:"/posts/categories/技术文章.html",pageKeys:["v-05aa5a72","v-47d11919","v-4d2c21d2","v-4cf30fb5","v-e63a3eca","v-659f2c17","v-90b06392","v-769abb97","v-479cd89b","v-5ac843d2","v-2ea06bd2","v-59dd9667","v-29605312","v-19e0cb92"]},"工具收集":{path:"/posts/categories/工具收集.html",pageKeys:["v-5406ead7","v-727bdcd7"]},docs:{path:"/posts/categories/docs.html",pageKeys:["v-1b2fc321"]},"心情随笔":{path:"/posts/categories/心情随笔.html",pageKeys:["v-451d4ef7","v-c20a3d3a","v-82ef379e","v-3b2e133e","v-6c901c52","v-02b9bb49","v-5859a1d2","v-6a2fdcdd","v-5c8c14ad","v-40322b92","v-a5140402","v-4f270427","v-3c1a57b7","v-67bd99b7","v-66101e52","v-652145d2","v-67baae1e","v-242cbd57","v-483c3f97","v-53b0f14d","v-fb815392","v-448645d2","v-55ece897"]}}},,function(t,e,l){"use strict";var s=l(32),r=l(151).left,a=l(152),o=l(68);s({target:"Array",proto:!0,forced:!l(153)&&o>79&&o<83||!a("reduce")},{reduce:function(t){var e=arguments.length;return r(this,t,e,e>1?arguments[1]:void 0)}})},function(t,e,l){"use strict";var s={}.propertyIsEnumerable,r=Object.getOwnPropertyDescriptor,a=r&&!s.call({1:2},1);e.f=a?function(t){var e=r(this,t);return!!e&&e.enumerable}:s},function(t,e,l){var s=l(33),r=l(13),a=l(64),o=l(129),n=l(131),i=l(39),p=TypeError,u=i("toPrimitive");t.exports=function(t,e){if(!r(t)||a(t))return t;var l,i=o(t,u);if(i){if(void 0===e&&(e="default"),l=s(i,t,e),!r(l)||a(l))return l;throw p("Can't convert object to primitive value")}return void 0===e&&(e="number"),n(t,e)}},function(t,e){t.exports="undefined"!=typeof navigator&&String(navigator.userAgent)||""},function(t,e,l){var s=l(38),r=l(61);t.exports=function(t,e){var l=t[e];return r(l)?void 0:s(l)}},function(t,e){var l=String;t.exports=function(t){try{return l(t)}catch(t){return"Object"}}},function(t,e,l){var s=l(33),r=l(4),a=l(13),o=TypeError;t.exports=function(t,e){var l,n;if("string"===e&&r(l=t.toString)&&!a(n=s(l,t)))return n;if(r(l=t.valueOf)&&!a(n=s(l,t)))return n;if("string"!==e&&r(l=t.toString)&&!a(n=s(l,t)))return n;throw o("Can't convert object to primitive value")}},function(t,e,l){var s=l(7),r=l(13),a=s.document,o=r(a)&&r(a.createElement);t.exports=function(t){return o?a.createElement(t):{}}},function(t,e,l){var s=l(9),r=l(5);t.exports=s&&r((function(){return 42!=Object.defineProperty((function(){}),"prototype",{value:42,writable:!1}).prototype}))},function(t,e,l){var s=l(4),r=l(22),a=l(135),o=l(41);t.exports=function(t,e,l,n){n||(n={});var i=n.enumerable,p=void 0!==n.name?n.name:e;if(s(l)&&a(l,p,n),n.global)i?t[e]=l:o(e,l);else{try{n.unsafe?t[e]&&(i=!0):delete t[e]}catch(t){}i?t[e]=l:r.f(t,e,{value:l,enumerable:!1,configurable:!n.nonConfigurable,writable:!n.nonWritable})}return t}},function(t,e,l){var s=l(6),r=l(5),a=l(4),o=l(12),n=l(9),i=l(136).CONFIGURABLE,p=l(137),u=l(138),c=u.enforce,h=u.get,d=String,g=Object.defineProperty,v=s("".slice),m=s("".replace),f=s([].join),y=n&&!r((function(){return 8!==g((function(){}),"length",{value:8}).length})),b=String(String).split("String"),x=t.exports=function(t,e,l){"Symbol("===v(d(e),0,7)&&(e="["+m(d(e),/^Symbol\(([^)]*)\)/,"$1")+"]"),l&&l.getter&&(e="get "+e),l&&l.setter&&(e="set "+e),(!o(t,"name")||i&&t.name!==e)&&(n?g(t,"name",{value:e,configurable:!0}):t.name=e),y&&l&&o(l,"arity")&&t.length!==l.arity&&g(t,"length",{value:l.arity});try{l&&o(l,"constructor")&&l.constructor?n&&g(t,"prototype",{writable:!1}):t.prototype&&(t.prototype=void 0)}catch(t){}var s=c(t);return o(s,"source")||(s.source=f(b,"string"==typeof e?e:"")),t};Function.prototype.toString=x((function(){return a(this)&&h(this).source||p(this)}),"toString")},function(t,e,l){var s=l(9),r=l(12),a=Function.prototype,o=s&&Object.getOwnPropertyDescriptor,n=r(a,"name"),i=n&&"something"===function(){}.name,p=n&&(!s||s&&o(a,"name").configurable);t.exports={EXISTS:n,PROPER:i,CONFIGURABLE:p}},function(t,e,l){var s=l(6),r=l(4),a=l(40),o=s(Function.toString);r(a.inspectSource)||(a.inspectSource=function(t){return o(t)}),t.exports=a.inspectSource},function(t,e,l){var s,r,a,o=l(139),n=l(7),i=l(13),p=l(16),u=l(12),c=l(40),h=l(140),d=l(73),g=n.TypeError,v=n.WeakMap;if(o||c.state){var m=c.state||(c.state=new v);m.get=m.get,m.has=m.has,m.set=m.set,s=function(t,e){if(m.has(t))throw g("Object already initialized");return e.facade=t,m.set(t,e),e},r=function(t){return m.get(t)||{}},a=function(t){return m.has(t)}}else{var f=h("state");d[f]=!0,s=function(t,e){if(u(t,f))throw g("Object already initialized");return e.facade=t,p(t,f,e),e},r=function(t){return u(t,f)?t[f]:{}},a=function(t){return u(t,f)}}t.exports={set:s,get:r,has:a,enforce:function(t){return a(t)?r(t):s(t,{})},getterFor:function(t){return function(e){var l;if(!i(e)||(l=r(e)).type!==t)throw g("Incompatible receiver, "+t+" required");return l}}}},function(t,e,l){var s=l(7),r=l(4),a=s.WeakMap;t.exports=r(a)&&/native code/.test(String(a))},function(t,e,l){var s=l(69),r=l(71),a=s("keys");t.exports=function(t){return a[t]||(a[t]=r(t))}},function(t,e,l){var s=l(37),r=l(6),a=l(142),o=l(149),n=l(43),i=r([].concat);t.exports=s("Reflect","ownKeys")||function(t){var e=a.f(n(t)),l=o.f;return l?i(e,l(t)):e}},function(t,e,l){var s=l(143),r=l(148).concat("length","prototype");e.f=Object.getOwnPropertyNames||function(t){return s(t,r)}},function(t,e,l){var s=l(6),r=l(12),a=l(36),o=l(144).indexOf,n=l(73),i=s([].push);t.exports=function(t,e){var l,s=a(t),p=0,u=[];for(l in s)!r(n,l)&&r(s,l)&&i(u,l);for(;e.length>p;)r(s,l=e[p++])&&(~o(u,l)||i(u,l));return u}},function(t,e,l){var s=l(36),r=l(145),a=l(44),o=function(t){return function(e,l,o){var n,i=s(e),p=a(i),u=r(o,p);if(t&&l!=l){for(;p>u;)if((n=i[u++])!=n)return!0}else for(;p>u;u++)if((t||u in i)&&i[u]===l)return t||u||0;return!t&&-1}};t.exports={includes:o(!0),indexOf:o(!1)}},function(t,e,l){var s=l(75),r=Math.max,a=Math.min;t.exports=function(t,e){var l=s(t);return l<0?r(l+e,0):a(l,e)}},function(t,e){var l=Math.ceil,s=Math.floor;t.exports=Math.trunc||function(t){var e=+t;return(e>0?s:l)(e)}},function(t,e,l){var s=l(75),r=Math.min;t.exports=function(t){return t>0?r(s(t),9007199254740991):0}},function(t,e){t.exports=["constructor","hasOwnProperty","isPrototypeOf","propertyIsEnumerable","toLocaleString","toString","valueOf"]},function(t,e){e.f=Object.getOwnPropertySymbols},function(t,e,l){var s=l(5),r=l(4),a=/#|\.prototype\./,o=function(t,e){var l=i[n(t)];return l==u||l!=p&&(r(e)?s(e):!!e)},n=o.normalize=function(t){return String(t).replace(a,".").toLowerCase()},i=o.data={},p=o.NATIVE="N",u=o.POLYFILL="P";t.exports=o},function(t,e,l){var s=l(38),r=l(42),a=l(59),o=l(44),n=TypeError,i=function(t){return function(e,l,i,p){s(l);var u=r(e),c=a(u),h=o(u),d=t?h-1:0,g=t?-1:1;if(i<2)for(;;){if(d in c){p=c[d],d+=g;break}if(d+=g,t?d<0:h<=d)throw n("Reduce of empty array with no initial value")}for(;t?d>=0:h>d;d+=g)d in c&&(p=l(p,c[d],d,u));return p}};t.exports={left:i(!1),right:i(!0)}},function(t,e,l){"use strict";var s=l(5);t.exports=function(t,e){var l=[][t];return!!l&&s((function(){l.call(null,e||function(){return 1},1)}))}},function(t,e,l){var s=l(21);t.exports="undefined"!=typeof process&&"process"==s(process)},function(t,e,l){"use strict";var s=l(9),r=l(155),a=TypeError,o=Object.getOwnPropertyDescriptor,n=s&&!function(){if(void 0!==this)return!0;try{Object.defineProperty([],"length",{writable:!1}).length=1}catch(t){return t instanceof TypeError}}();t.exports=n?function(t,e){if(r(t)&&!o(t,"length").writable)throw a("Cannot set read only .length");return t.length=e}:function(t,e){return t.length=e}},function(t,e,l){var s=l(21);t.exports=Array.isArray||function(t){return"Array"==s(t)}},function(t,e){var l=TypeError;t.exports=function(t){if(t>9007199254740991)throw l("Maximum allowed index exceeded");return t}},function(t,e,l){var s=l(32),r=l(7),a=l(158),o=l(159),n=r.WebAssembly,i=7!==Error("e",{cause:7}).cause,p=function(t,e){var l={};l[t]=o(t,e,i),s({global:!0,constructor:!0,arity:1,forced:i},l)},u=function(t,e){if(n&&n[t]){var l={};l[t]=o("WebAssembly."+t,e,i),s({target:"WebAssembly",stat:!0,constructor:!0,arity:1,forced:i},l)}};p("Error",(function(t){return function(e){return a(t,this,arguments)}})),p("EvalError",(function(t){return function(e){return a(t,this,arguments)}})),p("RangeError",(function(t){return function(e){return a(t,this,arguments)}})),p("ReferenceError",(function(t){return function(e){return a(t,this,arguments)}})),p("SyntaxError",(function(t){return function(e){return a(t,this,arguments)}})),p("TypeError",(function(t){return function(e){return a(t,this,arguments)}})),p("URIError",(function(t){return function(e){return a(t,this,arguments)}})),u("CompileError",(function(t){return function(e){return a(t,this,arguments)}})),u("LinkError",(function(t){return function(e){return a(t,this,arguments)}})),u("RuntimeError",(function(t){return function(e){return a(t,this,arguments)}}))},function(t,e,l){var s=l(34),r=Function.prototype,a=r.apply,o=r.call;t.exports="object"==typeof Reflect&&Reflect.apply||(s?o.bind(a):function(){return o.apply(a,arguments)})},function(t,e,l){"use strict";var s=l(37),r=l(12),a=l(16),o=l(65),n=l(76),i=l(74),p=l(162),u=l(163),c=l(164),h=l(168),d=l(169),g=l(9),v=l(70);t.exports=function(t,e,l,m){var f=m?2:1,y=t.split("."),b=y[y.length-1],x=s.apply(null,y);if(x){var k=x.prototype;if(!v&&r(k,"cause")&&delete k.cause,!l)return x;var P=s("Error"),_=e((function(t,e){var l=c(m?e:t,void 0),s=m?new x(t):new x;return void 0!==l&&a(s,"message",l),d(s,_,s.stack,2),this&&o(k,this)&&u(s,this,_),arguments.length>f&&h(s,arguments[f]),s}));if(_.prototype=k,"Error"!==b?n?n(_,P):i(_,P,{name:!0}):g&&"stackTraceLimit"in x&&(p(_,x,"stackTraceLimit"),p(_,x,"prepareStackTrace")),i(_,x),!v)try{k.name!==b&&a(k,"name",b),k.constructor=_}catch(t){}return _}}},function(t,e,l){var s=l(6),r=l(38);t.exports=function(t,e,l){try{return s(r(Object.getOwnPropertyDescriptor(t,e)[l]))}catch(t){}}},function(t,e,l){var s=l(4),r=String,a=TypeError;t.exports=function(t){if("object"==typeof t||s(t))return t;throw a("Can't set "+r(t)+" as a prototype")}},function(t,e,l){var s=l(22).f;t.exports=function(t,e,l){l in t||s(t,l,{configurable:!0,get:function(){return e[l]},set:function(t){e[l]=t}})}},function(t,e,l){var s=l(4),r=l(13),a=l(76);t.exports=function(t,e,l){var o,n;return a&&s(o=e.constructor)&&o!==l&&r(n=o.prototype)&&n!==l.prototype&&a(t,n),t}},function(t,e,l){var s=l(165);t.exports=function(t,e){return void 0===t?arguments.length<2?"":e:s(t)}},function(t,e,l){var s=l(166),r=String;t.exports=function(t){if("Symbol"===s(t))throw TypeError("Cannot convert a Symbol value to a string");return r(t)}},function(t,e,l){var s=l(167),r=l(4),a=l(21),o=l(39)("toStringTag"),n=Object,i="Arguments"==a(function(){return arguments}());t.exports=s?a:function(t){var e,l,s;return void 0===t?"Undefined":null===t?"Null":"string"==typeof(l=function(t,e){try{return t[e]}catch(t){}}(e=n(t),o))?l:i?a(e):"Object"==(s=a(e))&&r(e.callee)?"Arguments":s}},function(t,e,l){var s={};s[l(39)("toStringTag")]="z",t.exports="[object z]"===String(s)},function(t,e,l){var s=l(13),r=l(16);t.exports=function(t,e){s(e)&&"cause"in e&&r(t,"cause",e.cause)}},function(t,e,l){var s=l(16),r=l(170),a=l(171),o=Error.captureStackTrace;t.exports=function(t,e,l,n){a&&(o?o(t,e):s(t,"stack",r(l,n)))}},function(t,e,l){var s=l(6),r=Error,a=s("".replace),o=String(r("zxcasd").stack),n=/\n\s*at [^:]*:[^\n]*/,i=n.test(o);t.exports=function(t,e){if(i&&"string"==typeof t&&!r.prepareStackTrace)for(;e--;)t=a(t,n,"");return t}},function(t,e,l){var s=l(5),r=l(35);t.exports=!s((function(){var t=Error("a");return!("stack"in t)||(Object.defineProperty(t,"stack",r(1,7)),7!==t.stack)}))},,,,,,,,,,,,,,,,,,,,,,,,,,,,,,,,,,,,,,,,,,,,,,,,,,,,,,,,,,,,,,,,,,,,,,,,,,,,,,,,,,,,,,,,,,,,,,,,,,,,,,,,,,,,,,,,,,function(t,e,l){},function(t,e,l){var s=l(287),r=l(288),a=/[T ]/,o=/:/,n=/^(\d{2})$/,i=[/^([+-]\d{2})$/,/^([+-]\d{3})$/,/^([+-]\d{4})$/],p=/^(\d{4})/,u=[/^([+-]\d{4})/,/^([+-]\d{5})/,/^([+-]\d{6})/],c=/^-(\d{2})$/,h=/^-?(\d{3})$/,d=/^-?(\d{2})-?(\d{2})$/,g=/^-?W(\d{2})$/,v=/^-?W(\d{2})-?(\d{1})$/,m=/^(\d{2}([.,]\d*)?)$/,f=/^(\d{2}):?(\d{2}([.,]\d*)?)$/,y=/^(\d{2}):?(\d{2}):?(\d{2}([.,]\d*)?)$/,b=/([Z+-].*)$/,x=/^(Z)$/,k=/^([+-])(\d{2})$/,P=/^([+-])(\d{2}):?(\d{2})$/;function _(t,e,l){e=e||0,l=l||0;var s=new Date(0);s.setUTCFullYear(t,0,4);var r=7*e+l+1-(s.getUTCDay()||7);return s.setUTCDate(s.getUTCDate()+r),s}t.exports=function(t,e){if(r(t))return new Date(t.getTime());if("string"!=typeof t)return new Date(t);var l=(e||{}).additionalDigits;l=null==l?2:Number(l);var w=function(t){var e,l={},s=t.split(a);o.test(s[0])?(l.date=null,e=s[0]):(l.date=s[0],e=s[1]);if(e){var r=b.exec(e);r?(l.time=e.replace(r[1],""),l.timezone=r[1]):l.time=e}return l}(t),T=function(t,e){var l,s=i[e],r=u[e];if(l=p.exec(t)||r.exec(t)){var a=l[1];return{year:parseInt(a,10),restDateString:t.slice(a.length)}}if(l=n.exec(t)||s.exec(t)){var o=l[1];return{year:100*parseInt(o,10),restDateString:t.slice(o.length)}}return{year:null}}(w.date,l),j=T.year,O=function(t,e){if(null===e)return null;var l,s,r,a;if(0===t.length)return(s=new Date(0)).setUTCFullYear(e),s;if(l=c.exec(t))return s=new Date(0),r=parseInt(l[1],10)-1,s.setUTCFullYear(e,r),s;if(l=h.exec(t)){s=new Date(0);var o=parseInt(l[1],10);return s.setUTCFullYear(e,0,o),s}if(l=d.exec(t)){s=new Date(0),r=parseInt(l[1],10)-1;var n=parseInt(l[2],10);return s.setUTCFullYear(e,r,n),s}if(l=g.exec(t))return a=parseInt(l[1],10)-1,_(e,a);if(l=v.exec(t)){a=parseInt(l[1],10)-1;var i=parseInt(l[2],10)-1;return _(e,a,i)}return null}(T.restDateString,j);if(O){var A,E=O.getTime(),U=0;if(w.time&&(U=function(t){var e,l,s;if(e=m.exec(t))return(l=parseFloat(e[1].replace(",",".")))%24*36e5;if(e=f.exec(t))return l=parseInt(e[1],10),s=parseFloat(e[2].replace(",",".")),l%24*36e5+6e4*s;if(e=y.exec(t)){l=parseInt(e[1],10),s=parseInt(e[2],10);var r=parseFloat(e[3].replace(",","."));return l%24*36e5+6e4*s+1e3*r}return null}(w.time)),w.timezone)A=6e4*function(t){var e,l;if(e=x.exec(t))return 0;if(e=k.exec(t))return l=60*parseInt(e[2],10),"+"===e[1]?-l:l;if(e=P.exec(t))return l=60*parseInt(e[2],10)+parseInt(e[3],10),"+"===e[1]?-l:l;return 0}(w.timezone);else{var C=E+U,$=new Date(C);A=s($);var S=new Date(C);S.setDate($.getDate()+1);var M=s(S)-s($);M>0&&(A+=M)}return new Date(E+U+A)}return new Date(t)}},function(t,e){t.exports=function(t){var e=new Date(t.getTime()),l=e.getTimezoneOffset();return e.setSeconds(0,0),6e4*l+e.getTime()%6e4}},function(t,e){t.exports=function(t){return t instanceof Date}},function(t,e,l){"use strict";l(113)},,function(t,e,l){"use strict";l(115)},function(t,e,l){"use strict";l(116)},function(t,e,l){"use strict";l.r(e);var s=l(3),r=l(54);l(125);var a=l(0),o=l(117),n=l.n(o),i=l(118),p=l.n(i),u={created(){if(this.siteMeta=this.$site.headTags.filter(([t])=>"meta"===t).map(([t,e])=>e),this.$ssrContext){const e=this.getMergedMetaTags();this.$ssrContext.title=this.$title,this.$ssrContext.lang=this.$lang,this.$ssrContext.pageMeta=(t=e)?t.map(t=>{let e="<meta";return Object.keys(t).forEach(l=>{e+=` ${l}="${p()(t[l])}"`}),e+">"}).join("\n    "):"",this.$ssrContext.canonicalLink=h(this.$canonicalUrl)}var t},mounted(){this.currentMetaTags=[...document.querySelectorAll("meta")],this.updateMeta(),this.updateCanonicalLink()},methods:{updateMeta(){document.title=this.$title,document.documentElement.lang=this.$lang;const t=this.getMergedMetaTags();this.currentMetaTags=d(t,this.currentMetaTags)},getMergedMetaTags(){const t=this.$page.frontmatter.meta||[];return n()([{name:"description",content:this.$description}],t,this.siteMeta,g)},updateCanonicalLink(){c(),this.$canonicalUrl&&document.head.insertAdjacentHTML("beforeend",h(this.$canonicalUrl))}},watch:{$page(){this.updateMeta(),this.updateCanonicalLink()}},beforeDestroy(){d(null,this.currentMetaTags),c()}};function c(){const t=document.querySelector("link[rel='canonical']");t&&t.remove()}function h(t=""){return t?`<link href="${t}" rel="canonical" />`:""}function d(t,e){if(e&&[...e].filter(t=>t.parentNode===document.head).forEach(t=>document.head.removeChild(t)),t)return t.map(t=>{const e=document.createElement("meta");return Object.keys(t).forEach(l=>{e.setAttribute(l,t[l])}),document.head.appendChild(e),e})}function g(t){for(const e of["name","property","itemprop"])if(t.hasOwnProperty(e))return t[e]+e;return JSON.stringify(t)}var v=l(119),m=l(120),f=l(124),y=[u,v.a,m.a,f.a],b=l(1);Object(a.g)(b.default,"mixins",y);const x=[{name:"v-05aa5a72",path:"/posts/2015/04/23/learn-node.html",component:b.default,beforeEnter:(t,e,l)=>{Object(a.a)("post","v-05aa5a72").then(l)}},{path:"/_posts/2015-04-23-learn-node.html",redirect:"/posts/2015/04/23/learn-node.html"},{name:"v-47d11919",path:"/posts/2015/04/29/http.html",component:b.default,beforeEnter:(t,e,l)=>{Object(a.a)("post","v-47d11919").then(l)}},{path:"/_posts/2015-04-29-http.html",redirect:"/posts/2015/04/29/http.html"},{name:"v-4d2c21d2",path:"/posts/2017/06/15/css-summary.html",component:b.default,beforeEnter:(t,e,l)=>{Object(a.a)("post","v-4d2c21d2").then(l)}},{path:"/_posts/2017-06-15-css-summary.html",redirect:"/posts/2017/06/15/css-summary.html"},{name:"v-4cf30fb5",path:"/posts/2016/04/29/fe-optimization-guid.html",component:b.default,beforeEnter:(t,e,l)=>{Object(a.a)("post","v-4cf30fb5").then(l)}},{path:"/_posts/2016-04-29-fe-optimization-guid.html",redirect:"/posts/2016/04/29/fe-optimization-guid.html"},{name:"v-e63a3eca",path:"/posts/2017/12/07/git-base.html",component:b.default,beforeEnter:(t,e,l)=>{Object(a.a)("post","v-e63a3eca").then(l)}},{path:"/_posts/2017-12-07-git-base.html",redirect:"/posts/2017/12/07/git-base.html"},{name:"v-659f2c17",path:"/posts/2016/02/20/linux-shell.html",component:b.default,beforeEnter:(t,e,l)=>{Object(a.a)("post","v-659f2c17").then(l)}},{path:"/_posts/2016-02-20-linux-shell.html",redirect:"/posts/2016/02/20/linux-shell.html"},{name:"v-5406ead7",path:"/posts/2017/12/07/git-sever.html",component:b.default,beforeEnter:(t,e,l)=>{Object(a.a)("post","v-5406ead7").then(l)}},{path:"/_posts/2017-12-07-git-sever.html",redirect:"/posts/2017/12/07/git-sever.html"},{name:"v-90b06392",path:"/posts/2017/12/07/nginx-proxy.html",component:b.default,beforeEnter:(t,e,l)=>{Object(a.a)("post","v-90b06392").then(l)}},{path:"/_posts/2017-12-07-nginx-proxy.html",redirect:"/posts/2017/12/07/nginx-proxy.html"},{name:"v-769abb97",path:"/posts/2015/08/22/linux.html",component:b.default,beforeEnter:(t,e,l)=>{Object(a.a)("post","v-769abb97").then(l)}},{path:"/_posts/2015-08-22-linux.html",redirect:"/posts/2015/08/22/linux.html"},{name:"v-479cd89b",path:"/posts/2018/06/13/css-block-inline.html",component:b.default,beforeEnter:(t,e,l)=>{Object(a.a)("post","v-479cd89b").then(l)}},{path:"/_posts/2018-06-13-css-block-inline.html",redirect:"/posts/2018/06/13/css-block-inline.html"},{name:"v-1b2fc321",path:"/posts/2019/03/23/theme-guide-zh.html",component:b.default,beforeEnter:(t,e,l)=>{Object(a.a)("post","v-1b2fc321").then(l)}},{path:"/_posts/2019-03-23-theme-guide-zh.html",redirect:"/posts/2019/03/23/theme-guide-zh.html"},{name:"v-5ac843d2",path:"/posts/2016/12/12/promise.html",component:b.default,beforeEnter:(t,e,l)=>{Object(a.a)("post","v-5ac843d2").then(l)}},{path:"/_posts/2016-12-12-promise.html",redirect:"/posts/2016/12/12/promise.html"},{name:"v-451d4ef7",path:"/posts/2019/05/01/error-log.html",component:b.default,beforeEnter:(t,e,l)=>{Object(a.a)("post","v-451d4ef7").then(l)}},{path:"/_posts/2019-05-01-error-log.html",redirect:"/posts/2019/05/01/error-log.html"},{name:"v-2ea06bd2",path:"/posts/2015/04/26/learn-node2.html",component:b.default,beforeEnter:(t,e,l)=>{Object(a.a)("post","v-2ea06bd2").then(l)}},{path:"/_posts/2015-04-23-learn-node2.html",redirect:"/posts/2015/04/26/learn-node2.html"},{name:"v-59dd9667",path:"/posts/2018/07/04/analysis-of-modern-frontend-technology.html",component:b.default,beforeEnter:(t,e,l)=>{Object(a.a)("post","v-59dd9667").then(l)}},{path:"/_posts/2018-07-04-analysis-of-modern-frontEnd-technology.html",redirect:"/posts/2018/07/04/analysis-of-modern-frontend-technology.html"},{name:"v-727bdcd7",path:"/posts/2019/12/24/use-mac.html",component:b.default,beforeEnter:(t,e,l)=>{Object(a.a)("post","v-727bdcd7").then(l)}},{path:"/_posts/2019-12-24-use-mac.html",redirect:"/posts/2019/12/24/use-mac.html"},{name:"v-c20a3d3a",path:"/posts/2019/08/26/regexp-learn.html",component:b.default,beforeEnter:(t,e,l)=>{Object(a.a)("post","v-c20a3d3a").then(l)}},{path:"/_posts/2019-08-26-regexp-learn.html",redirect:"/posts/2019/08/26/regexp-learn.html"},{name:"v-82ef379e",path:"/posts/2020/02/22/ray-method-polygon.html",component:b.default,beforeEnter:(t,e,l)=>{Object(a.a)("post","v-82ef379e").then(l)}},{path:"/_posts/2020-02-22-ray-method-polygon.html",redirect:"/posts/2020/02/22/ray-method-polygon.html"},{name:"v-3b2e133e",path:"/posts/2020/08/12/fe-microservices.html",component:b.default,beforeEnter:(t,e,l)=>{Object(a.a)("post","v-3b2e133e").then(l)}},{path:"/_posts/2020-08-12-fe-microservices.html",redirect:"/posts/2020/08/12/fe-microservices.html"},{name:"v-6c901c52",path:"/posts/2020/04/28/learn-css.html",component:b.default,beforeEnter:(t,e,l)=>{Object(a.a)("post","v-6c901c52").then(l)}},{path:"/_posts/2020-04-28-learn-css.html",redirect:"/posts/2020/04/28/learn-css.html"},{name:"v-02b9bb49",path:"/posts/2020/10/09/string.html",component:b.default,beforeEnter:(t,e,l)=>{Object(a.a)("post","v-02b9bb49").then(l)}},{path:"/_posts/2020-10-09-string.html",redirect:"/posts/2020/10/09/string.html"},{name:"v-5859a1d2",path:"/posts/2020/10/10/chart.html",component:b.default,beforeEnter:(t,e,l)=>{Object(a.a)("post","v-5859a1d2").then(l)}},{path:"/_posts/2020-10-10-chart.html",redirect:"/posts/2020/10/10/chart.html"},{name:"v-6a2fdcdd",path:"/posts/2020/10/11/sort.html",component:b.default,beforeEnter:(t,e,l)=>{Object(a.a)("post","v-6a2fdcdd").then(l)}},{path:"/_posts/2020-10-11-sort.html",redirect:"/posts/2020/10/11/sort.html"},{name:"v-5c8c14ad",path:"/posts/2020/10/13/seek.html",component:b.default,beforeEnter:(t,e,l)=>{Object(a.a)("post","v-5c8c14ad").then(l)}},{path:"/_posts/2020-10-13-seek.html",redirect:"/posts/2020/10/13/seek.html"},{name:"v-40322b92",path:"/posts/2021/02/26/react-basics.html",component:b.default,beforeEnter:(t,e,l)=>{Object(a.a)("post","v-40322b92").then(l)}},{path:"/_posts/2021-02-26-react-basics.html",redirect:"/posts/2021/02/26/react-basics.html"},{name:"v-a5140402",path:"/posts/2021/03/02/vue-basics.html",component:b.default,beforeEnter:(t,e,l)=>{Object(a.a)("post","v-a5140402").then(l)}},{path:"/_posts/2021-03-02-vue-basics.html",redirect:"/posts/2021/03/02/vue-basics.html"},{name:"v-4f270427",path:"/posts/2021/03/01/react-senior.html",component:b.default,beforeEnter:(t,e,l)=>{Object(a.a)("post","v-4f270427").then(l)}},{path:"/_posts/2021-02-29-react-senior.html",redirect:"/posts/2021/03/01/react-senior.html"},{name:"v-3c1a57b7",path:"/posts/2021/03/04/vue-principle.html",component:b.default,beforeEnter:(t,e,l)=>{Object(a.a)("post","v-3c1a57b7").then(l)}},{path:"/_posts/2021-03-04-vue-principle.html",redirect:"/posts/2021/03/04/vue-principle.html"},{name:"v-67bd99b7",path:"/posts/2021/02/02/chrome-plugin.html",component:b.default,beforeEnter:(t,e,l)=>{Object(a.a)("post","v-67bd99b7").then(l)}},{path:"/_posts/2021-02-02-chrome-plugin.html",redirect:"/posts/2021/02/02/chrome-plugin.html"},{name:"v-66101e52",path:"/posts/2021/03/09/webpack.html",component:b.default,beforeEnter:(t,e,l)=>{Object(a.a)("post","v-66101e52").then(l)}},{path:"/_posts/2021-03-09-webpack.html",redirect:"/posts/2021/03/09/webpack.html"},{name:"v-652145d2",path:"/posts/2021/07/13/font-weight.html",component:b.default,beforeEnter:(t,e,l)=>{Object(a.a)("post","v-652145d2").then(l)}},{path:"/_posts/2021-07-13-font-weight.html",redirect:"/posts/2021/07/13/font-weight.html"},{name:"v-67baae1e",path:"/posts/2021/03/10/webpack-senior.html",component:b.default,beforeEnter:(t,e,l)=>{Object(a.a)("post","v-67baae1e").then(l)}},{path:"/_posts/2021-03-10-webpack-senior.html",redirect:"/posts/2021/03/10/webpack-senior.html"},{name:"v-242cbd57",path:"/posts/2024/03/25/web-component.html",component:b.default,beforeEnter:(t,e,l)=>{Object(a.a)("post","v-242cbd57").then(l)}},{path:"/_posts/2024-03-25-web-component.html",redirect:"/posts/2024/03/25/web-component.html"},{name:"v-483c3f97",path:"/posts/2021/03/27/webpack-share.html",component:b.default,beforeEnter:(t,e,l)=>{Object(a.a)("post","v-483c3f97").then(l)}},{path:"/_posts/2021-03-27-webpack-share.html",redirect:"/posts/2021/03/27/webpack-share.html"},{name:"v-53b0f14d",path:"/posts/2021/04/03/typescript.html",component:b.default,beforeEnter:(t,e,l)=>{Object(a.a)("post","v-53b0f14d").then(l)}},{path:"/_posts/2021-04-03-typescript.html",redirect:"/posts/2021/04/03/typescript.html"},{name:"v-fb815392",path:"/posts/2023/03/23/upload-file.html",component:b.default,beforeEnter:(t,e,l)=>{Object(a.a)("post","v-fb815392").then(l)}},{path:"/_posts/2023-03-23-upload-file.html",redirect:"/posts/2023/03/23/upload-file.html"},{name:"v-448645d2",path:"/posts/2022/03/10/leetcode-thinking.html",component:b.default,beforeEnter:(t,e,l)=>{Object(a.a)("post","v-448645d2").then(l)}},{path:"/_posts/2022-03-10-leetcode-thinking.html",redirect:"/posts/2022/03/10/leetcode-thinking.html"},{name:"v-6f067db4",path:"/custom-pages/",component:b.default,beforeEnter:(t,e,l)=>{Object(a.a)("CustomLayout","v-6f067db4").then(l)}},{path:"/custom-pages/index.html",redirect:"/custom-pages/"},{name:"v-29605312",path:"/posts/2025/01/10/css-practical-application.html",component:b.default,beforeEnter:(t,e,l)=>{Object(a.a)("post","v-29605312").then(l)}},{path:"/_posts/2025-01-10-css-practical-application.html",redirect:"/posts/2025/01/10/css-practical-application.html"},{name:"v-19e0cb92",path:"/posts/2024/09/25/timezone-offset.html",component:b.default,beforeEnter:(t,e,l)=>{Object(a.a)("post","v-19e0cb92").then(l)}},{path:"/_posts/2024-09-25-timezone-offset.html",redirect:"/posts/2024/09/25/timezone-offset.html"},{name:"v-55ece897",path:"/posts/2023/10/23/_2023-1023-vscode.html",component:b.default,beforeEnter:(t,e,l)=>{Object(a.a)("post","v-55ece897").then(l)}},{path:"/_posts/2023-1023-vscode.html",redirect:"/posts/2023/10/23/_2023-1023-vscode.html"},{name:"v-b2754d56",path:"/",component:b.default,beforeEnter:(t,e,l)=>{Object(a.a)("Home","v-b2754d56").then(l)}},{path:"/index.html",redirect:"/"},{name:"v-1f814451",path:"/posts/",component:b.default,beforeEnter:(t,e,l)=>{Object(a.a)("Posts","v-1f814451").then(l)}},{path:"/posts/index.html",redirect:"/posts/"},{name:"v-03721585",path:"/posts/tags/",component:b.default,beforeEnter:(t,e,l)=>{Object(a.a)("Tags","v-03721585").then(l)}},{path:"/posts/tags/index.html",redirect:"/posts/tags/"},{name:"v-5eb9e6bc",path:"/posts/categories/",component:b.default,beforeEnter:(t,e,l)=>{Object(a.a)("Categories","v-5eb9e6bc").then(l)}},{path:"/posts/categories/index.html",redirect:"/posts/categories/"},{name:"v-1746ab84",path:"/posts/categories/技术文章.html",component:b.default,beforeEnter:(t,e,l)=>{Object(a.a)("Category","v-1746ab84").then(l)},meta:{categoryName:"技术文章"}},{name:"v-34e2e03f",path:"/posts/categories/工具收集.html",component:b.default,beforeEnter:(t,e,l)=>{Object(a.a)("Category","v-34e2e03f").then(l)},meta:{categoryName:"工具收集"}},{name:"v-6fe1551c",path:"/posts/categories/docs.html",component:b.default,beforeEnter:(t,e,l)=>{Object(a.a)("Category","v-6fe1551c").then(l)},meta:{categoryName:"docs"}},{name:"v-d262708c",path:"/posts/categories/心情随笔.html",component:b.default,beforeEnter:(t,e,l)=>{Object(a.a)("Category","v-d262708c").then(l)},meta:{categoryName:"心情随笔"}},{path:"*",component:b.default}],k={title:"",description:"This is my blog",base:"/",headTags:[],pages:[{title:"nodejs学习日记1",frontmatter:{layout:"post",title:"nodejs学习日记1",date:"2015-04-23T00:00:00.000Z",excerpt:"learn node diary","vssue-title":"nodejs学习日记1",category:"技术文章",permalink:"/posts/:year/:month/:day/:slug.html"},regularPath:"/_posts/2015-04-23-learn-node.html",relativePath:"_posts/2015-04-23-learn-node.md",key:"v-05aa5a72",path:"/posts/2015/04/23/learn-node.html",headers:[{level:2,title:"REPL(交互式解释器)",slug:"repl-交互式解释器"},{level:2,title:"控制台",slug:"控制台"},{level:2,title:"缓存区Buffer",slug:"缓存区buffer"},{level:2,title:"模块和包",slug:"模块和包"},{level:2,title:"内置模块",slug:"内置模块"},{level:2,title:"事件",slug:"事件"},{level:3,title:"启动mongodb",slug:"启动mongodb"}],lastUpdated:"5/9/2023, 2:46:10 PM",lastUpdatedTimestamp:168361477e4,type:"post",top:!1,tags:[],category:"技术文章",createdAt:"2015-04-23",updatedAt:"2023-05-09"},{title:"HTTP协议详解",frontmatter:{layout:"post",title:"HTTP协议详解",date:"2015-04-29T00:00:00.000Z",excerpt:"HTTP协议详解","vssue-title":"HTTP协议详解",category:"技术文章",permalink:"/posts/:year/:month/:day/:slug.html"},regularPath:"/_posts/2015-04-29-http.html",relativePath:"_posts/2015-04-29-http.md",key:"v-47d11919",path:"/posts/2015/04/29/http.html",headers:[{level:2,title:"HTTP协议详解",slug:"http协议详解"},{level:3,title:"一、HTTP协议详解之URL",slug:"一、http协议详解之url"},{level:3,title:"二、HTTP协议详解之请求",slug:"二、http协议详解之请求"},{level:3,title:"三、HTTP协议详解之响应",slug:"三、http协议详解之响应"},{level:3,title:"四、HTTP协议详解之消息报头",slug:"四、http协议详解之消息报头"},{level:3,title:"五、利用telnet观察http协议的通讯过程",slug:"五、利用telnet观察http协议的通讯过程"},{level:3,title:"六、HTTP协议相关技术补充",slug:"六、http协议相关技术补充"}],lastUpdated:"5/9/2023, 2:46:10 PM",lastUpdatedTimestamp:168361477e4,type:"post",top:!1,tags:[],category:"技术文章",createdAt:"2015-04-29",updatedAt:"2023-05-09"},{title:"css遇到问题",frontmatter:{layout:"post",title:"css遇到问题",date:"2017-06-15T00:00:00.000Z",excerpt:"常见的问题","vssue-title":"css常见的问题",category:"技术文章",permalink:"/posts/:year/:month/:day/:slug.html"},regularPath:"/_posts/2017-06-15-css-summary.html",relativePath:"_posts/2017-06-15-css-summary.md",key:"v-4d2c21d2",path:"/posts/2017/06/15/css-summary.html",headers:[{level:2,title:"静态页面常见问题汇总",slug:"静态页面常见问题汇总"},{level:3,title:"显示省略号(…)",slug:"显示省略号"},{level:3,title:"img遇到问题",slug:"img遇到问题"},{level:3,title:"css字体渐变色",slug:"css字体渐变色"},{level:3,title:"pc端常见问题",slug:"pc端常见问题"}],lastUpdated:"11/25/2021, 10:55:13 AM",lastUpdatedTimestamp:1637808913e3,type:"post",top:!1,tags:[],category:"技术文章",createdAt:"2017-06-15",updatedAt:"2021-11-25"},{title:"前端优化指南",frontmatter:{layout:"post",title:"前端优化指南",date:"2016-04-29T00:00:00.000Z",excerpt:"前端性能优化实践","vssue-title":"前端性能优化实践",category:"技术文章",permalink:"/posts/:year/:month/:day/:slug.html"},regularPath:"/_posts/2016-04-29-fe-optimization-guid.html",relativePath:"_posts/2016-04-29-fe-optimization-guid.md",key:"v-4cf30fb5",path:"/posts/2016/04/29/fe-optimization-guid.html",headers:[{level:2,title:"参考文章",slug:"参考文章"},{level:2,title:"目录：",slug:"目录"},{level:2,title:"页面内容",slug:"页面内容"},{level:2,title:"服务器",slug:"服务器"},{level:2,title:"Cookie",slug:"cookie"},{level:2,title:"CSS",slug:"css"},{level:2,title:"JavaScript",slug:"javascript"},{level:2,title:"图片",slug:"图片"},{level:2,title:"移动端",slug:"移动端"}],lastUpdated:"12/12/2021, 9:52:07 PM",lastUpdatedTimestamp:1639317127e3,type:"post",top:!1,tags:[],category:"技术文章",createdAt:"2016-04-29",updatedAt:"2021-12-12"},{title:"git相关的一些基础操作",frontmatter:{layout:"post",title:"git相关的一些基础操作",date:"2017-12-07T00:00:00.000Z",excerpt:"git相关的一些基础操作","vssue-title":"git相关的一些基础操作",category:"技术文章",permalink:"/posts/:year/:month/:day/:slug.html"},regularPath:"/_posts/2017-12-07-git-base.html",relativePath:"_posts/2017-12-07-git-base.md",key:"v-e63a3eca",path:"/posts/2017/12/07/git-base.html",headers:[{level:2,title:"git基础知识",slug:"git基础知识"},{level:3,title:"初始化配置",slug:"初始化配置"},{level:3,title:"文件操作",slug:"文件操作"},{level:3,title:"查看文件diff",slug:"查看文件diff"},{level:3,title:"查看提交记录",slug:"查看提交记录"},{level:3,title:"取得Git仓库",slug:"取得git仓库"},{level:3,title:"提交你的修改",slug:"提交你的修改"},{level:3,title:"分支操作",slug:"分支操作"},{level:3,title:"分支合并和rebase",slug:"分支合并和rebase"},{level:3,title:"Git补丁管理(方便在多台机器上开发同步时用)",slug:"git补丁管理-方便在多台机器上开发同步时用"},{level:3,title:"Git远程分支管理",slug:"git远程分支管理"},{level:3,title:"基本的分支管理",slug:"基本的分支管理"},{level:3,title:"Git远程仓库管理",slug:"git远程仓库管理"},{level:3,title:"第一次代码提交",slug:"第一次代码提交"},{level:3,title:"ssh key 配置",slug:"ssh-key-配置"},{level:3,title:"解决git冲突",slug:"解决git冲突"},{level:3,title:"github遇到问题",slug:"github遇到问题"},{level:3,title:"git服务器禁止用户shell登录",slug:"git服务器禁止用户shell登录"},{level:3,title:"Git 将一个项目同时推送到多个远程仓库",slug:"git-将一个项目同时推送到多个远程仓库"},{level:3,title:"前端代码git规范",slug:"前端代码git规范"}],lastUpdated:"3/12/2025, 2:49:39 PM",lastUpdatedTimestamp:1741762179e3,type:"post",top:!1,tags:[],category:"技术文章",createdAt:"2017-12-07",updatedAt:"2025-03-12"},{title:"shell基础知识",frontmatter:{layout:"post",title:"shell基础知识",date:"2016-02-20T00:00:00.000Z",excerpt:"shell基础知识","vssue-title":"shell基础知识",category:"技术文章",permalink:"/posts/:year/:month/:day/:slug.html"},regularPath:"/_posts/2016-02-20-linux-shell.html",relativePath:"_posts/2016-02-20-linux-shell.md",key:"v-659f2c17",path:"/posts/2016/02/20/linux-shell.html",headers:[{level:2,title:"shell相关知识",slug:"shell相关知识"},{level:3,title:"1. shell基础",slug:"_1-shell基础"},{level:3,title:"2. 变量",slug:"_2-变量"},{level:3,title:"3. 运算符",slug:"_3-运算符"},{level:3,title:"4. 环境变量配置文件",slug:"_4-环境变量配置文件"},{level:3,title:"4.正则表达式",slug:"_4-正则表达式"},{level:3,title:"5. 流程控制",slug:"_5-流程控制"},{level:3,title:"6. 函数",slug:"_6-函数"},{level:3,title:"7.shell实战",slug:"_7-shell实战"}],lastUpdated:"7/9/2022, 6:46:23 PM",lastUpdatedTimestamp:1657363583e3,type:"post",top:!1,tags:[],category:"技术文章",createdAt:"2016-02-20",updatedAt:"2022-07-09"},{title:"Building a git server",frontmatter:{layout:"post",title:"Building a git server",date:"2017-12-07T00:00:00.000Z",excerpt:"Building a git server","vssue-title":"创建git服务器",category:"工具收集",permalink:"/posts/:year/:month/:day/:slug.html"},regularPath:"/_posts/2017-12-07-git-sever.html",relativePath:"_posts/2017-12-07-git-sever.md",key:"v-5406ead7",path:"/posts/2017/12/07/git-sever.html",headers:[{level:2,title:"创建git服务器",slug:"创建git服务器"}],lastUpdated:"6/26/2019, 9:26:03 PM",lastUpdatedTimestamp:1561555563e3,type:"post",top:!1,tags:[],category:"工具收集",createdAt:"2017-12-07",updatedAt:"2019-06-26"},{title:"Nginx相关知识",frontmatter:{layout:"post",title:"Nginx相关知识",date:"2017-12-07T00:00:00.000Z",excerpt:"Nginx reverse proxy",content:"Nginx相关知识","vssue-title":"nginx反向代理",category:"技术文章",permalink:"/posts/:year/:month/:day/:slug.html"},regularPath:"/_posts/2017-12-07-nginx-proxy.html",relativePath:"_posts/2017-12-07-nginx-proxy.md",key:"v-90b06392",path:"/posts/2017/12/07/nginx-proxy.html",headers:[{level:2,title:"nginx相关知识",slug:"nginx相关知识"},{level:3,title:"系统",slug:"系统"},{level:3,title:"配置文件及用途",slug:"配置文件及用途"},{level:3,title:"nginx内容配置",slug:"nginx内容配置"},{level:3,title:"核心模块",slug:"核心模块"},{level:3,title:"静态资源Web服务",slug:"静态资源web服务"},{level:3,title:"浏览器缓存",slug:"浏览器缓存"},{level:3,title:"跨域",slug:"跨域"},{level:3,title:"防盗链",slug:"防盗链"},{level:3,title:"代理服务",slug:"代理服务"},{level:3,title:"负载均衡",slug:"负载均衡"},{level:3,title:"缓存",slug:"缓存"},{level:3,title:"rewrite",slug:"rewrite"}],lastUpdated:"7/9/2022, 6:46:23 PM",lastUpdatedTimestamp:1657363583e3,type:"post",top:!1,tags:[],category:"技术文章",createdAt:"2017-12-07",updatedAt:"2022-07-09"},{title:"linux常用命令",frontmatter:{layout:"post",title:"linux常用命令",date:"2015-08-22T00:00:00.000Z",excerpt:"linux常用命令","vssue-title":"linux常用命令",category:"技术文章",permalink:"/posts/:year/:month/:day/:slug.html"},regularPath:"/_posts/2015-08-22-linux.html",relativePath:"_posts/2015-08-22-linux.md",key:"v-769abb97",path:"/posts/2015/08/22/linux.html",headers:[{level:2,title:"Linux基础及文件",slug:"linux基础及文件"},{level:2,title:"linux常用命令",slug:"linux常用命令"},{level:3,title:"1. 目录",slug:"_1-目录"},{level:3,title:"2. shell",slug:"_2-shell"},{level:3,title:"3. vi编辑器",slug:"_3-vi编辑器"},{level:3,title:"4. 用户和用户组",slug:"_4-用户和用户组"},{level:3,title:"5. 用户命令",slug:"_5-用户命令"},{level:3,title:"6. 附录",slug:"_6-附录"},{level:3,title:"7 进程管理",slug:"_7-进程管理"},{level:3,title:"8. 系统资源查看",slug:"_8-系统资源查看"},{level:3,title:"9. 系统定时任务",slug:"_9-系统定时任务"},{level:3,title:"10. 实战任务",slug:"_10-实战任务"}],lastUpdated:"3/12/2022, 10:53:50 AM",lastUpdatedTimestamp:164705363e4,type:"post",top:!1,tags:[],category:"技术文章",createdAt:"2015-08-22",updatedAt:"2022-03-12"},{title:"css块元素和行内元素",frontmatter:{layout:"post",title:"css块元素和行内元素",date:"2018-06-13T00:00:00.000Z",excerpt:"css块元素和行内元素","vssue-title":"css块元素和行内元素",category:"技术文章",permalink:"/posts/:year/:month/:day/:slug.html"},regularPath:"/_posts/2018-06-13-css-block-inline.html",relativePath:"_posts/2018-06-13-css-block-inline.md",key:"v-479cd89b",path:"/posts/2018/06/13/css-block-inline.html",headers:[{level:2,title:"css块元素和行内元素",slug:"css块元素和行内元素"},{level:3,title:"块元素的特点",slug:"块元素的特点"},{level:3,title:"行内元素的特点",slug:"行内元素的特点"},{level:3,title:"行内块元素（inline-block）",slug:"行内块元素-inline-block"},{level:3,title:"BFC布局",slug:"bfc布局"},{level:3,title:"IFC布局规则",slug:"ifc布局规则"}],lastUpdated:"11/25/2021, 11:01:16 AM",lastUpdatedTimestamp:1637809276e3,type:"post",top:!1,tags:[],category:"技术文章",createdAt:"2018-06-13",updatedAt:"2021-11-25"},{title:"主题使用指南",frontmatter:{top:1,layout:"post",category:"docs",date:"2019-03-23T00:00:00.000Z",title:"主题使用指南",lang:"zh-CN",permalink:"/posts/:year/:month/:day/:slug.html"},regularPath:"/_posts/2019-03-23-theme-guide-zh.html",relativePath:"_posts/2019-03-23-theme-guide-zh.md",key:"v-1b2fc321",path:"/posts/2019/03/23/theme-guide-zh.html",headers:[{level:2,title:"开始使用",slug:"开始使用"},{level:3,title:"安装主题",slug:"安装主题"},{level:3,title:"配置主题",slug:"配置主题"},{level:3,title:"开始写博客",slug:"开始写博客"},{level:2,title:"主题语言",slug:"主题语言"},{level:3,title:"引入预设的语言包",slug:"引入预设的语言包"},{level:3,title:"翻译成你自己的语言",slug:"翻译成你自己的语言"},{level:3,title:"覆盖语言包的某些翻译",slug:"覆盖语言包的某些翻译"},{level:2,title:"页面评论",slug:"页面评论"},{level:3,title:"配置评论功能",slug:"配置评论功能"},{level:3,title:"针对每篇博文单独配置",slug:"针对每篇博文单独配置"},{level:3,title:"禁用评论功能",slug:"禁用评论功能"},{level:2,title:"配置参考",slug:"配置参考"},{level:3,title:"样式变量",slug:"样式变量"},{level:3,title:"Frontmatter",slug:"frontmatter"}],excerpt:'<p><code>vuepress-theme-glitzma</code> 主题使用指南</p>\n<p><img src="https://img.shields.io/npm/v/vuepress-theme-glitzma/latest.svg?style=flat" alt="">\n<img src="https://img.shields.io/npm/v/vuepress-theme-glitzma/next.svg?style=flat" alt="">\n<img src="https://img.shields.io/github/license/glitzma/vuepress-theme-glitzma.svg?style=flat" alt=""></p>\n',lastUpdated:"2021/12/2 10:35:16",lastUpdatedTimestamp:1638412516e3,type:"post",top:1,tags:[],category:"docs",createdAt:"2019-03-23",updatedAt:"2021-12-02"},{title:"promise函数",frontmatter:{layout:"post",title:"promise函数",date:"2016-12-12T00:00:00.000Z",excerpt:"promise函数","vssue-title":"promise函数",category:"技术文章",permalink:"/posts/:year/:month/:day/:slug.html"},regularPath:"/_posts/2016-12-12-promise.html",relativePath:"_posts/2016-12-12-promise.md",key:"v-5ac843d2",path:"/posts/2016/12/12/promise.html",headers:[{level:2,title:"promsie原理",slug:"promsie原理"},{level:3,title:"promise简易实现",slug:"promise简易实现"},{level:3,title:"加入发布订阅模式",slug:"加入发布订阅模式"},{level:3,title:"添加catch",slug:"添加catch"},{level:3,title:"all",slug:"all"},{level:3,title:"race",slug:"race"},{level:3,title:"finally",slug:"finally"},{level:2,title:"promise函数",slug:"promise函数"}],lastUpdated:"10/31/2021, 2:35:47 PM",lastUpdatedTimestamp:1635662147e3,type:"post",top:!1,tags:[],category:"技术文章",createdAt:"2016-12-12",updatedAt:"2021-10-31"},{title:"异常监控",frontmatter:{layout:"post",title:"异常监控",date:"2019-05-01T00:00:00.000Z",excerpt:"异常监控",category:"心情随笔",permalink:"/posts/:year/:month/:day/:slug.html"},regularPath:"/_posts/2019-05-01-error-log.html",relativePath:"_posts/2019-05-01-error-log.md",key:"v-451d4ef7",path:"/posts/2019/05/01/error-log.html",headers:[{level:2,title:"前端错误监控",slug:"前端错误监控"},{level:3,title:"为什么做前端监控",slug:"为什么做前端监控"},{level:3,title:"常见的埋点方案",slug:"常见的埋点方案"},{level:3,title:"运行时错误",slug:"运行时错误"},{level:3,title:"性能监控",slug:"性能监控"},{level:3,title:"白屏上报",slug:"白屏上报"},{level:3,title:"跨域的js运行错误捕获",slug:"跨域的js运行错误捕获"},{level:3,title:"错误上报",slug:"错误上报"},{level:3,title:"优化",slug:"优化"}],lastUpdated:"7/9/2022, 6:46:23 PM",lastUpdatedTimestamp:1657363583e3,type:"post",top:!1,tags:[],category:"心情随笔",createdAt:"2019-05-01",updatedAt:"2022-07-09"},{title:"nodejs学习日记2",frontmatter:{layout:"post",title:"nodejs学习日记2",date:"2015-04-26T00:00:00.000Z",excerpt:"learn node diary2","vssue-title":"nodejs学习日记2",category:"技术文章",permalink:"/posts/:year/:month/:day/:slug.html"},regularPath:"/_posts/2015-04-23-learn-node2.html",relativePath:"_posts/2015-04-23-learn-node2.md",key:"v-2ea06bd2",path:"/posts/2015/04/26/learn-node2.html",headers:[{level:2,title:"nextTick",slug:"nexttick"},{level:2,title:"模块",slug:"模块"},{level:2,title:"buffer 对象进行二进制数据处理",slug:"buffer-对象进行二进制数据处理"},{level:2,title:"fs模块中几种流的读写方法的区别",slug:"fs模块中几种流的读写方法的区别"},{level:2,title:"stram",slug:"stram"},{level:2,title:"中间件",slug:"中间件"},{level:2,title:"cookie",slug:"cookie"},{level:2,title:"referer",slug:"referer"},{level:2,title:"etag",slug:"etag"},{level:2,title:"浏览器如何不发请求",slug:"浏览器如何不发请求"},{level:2,title:"authorization",slug:"authorization"}],lastUpdated:"9/2/2020, 2:41:49 PM",lastUpdatedTimestamp:1599028909e3,type:"post",top:!1,tags:[],category:"技术文章",createdAt:"2015-04-26",updatedAt:"2020-09-02"},{title:"现在前端技术解析读后感",frontmatter:{layout:"post",title:"现在前端技术解析读后感",date:"2018-07-04T00:00:00.000Z",excerpt:"现在前端技术解析读后感","vssue-title":"现在前端技术解析读后感",category:"技术文章",permalink:"/posts/:year/:month/:day/:slug.html"},regularPath:"/_posts/2018-07-04-analysis-of-modern-frontEnd-technology.html",relativePath:"_posts/2018-07-04-analysis-of-modern-frontEnd-technology.md",key:"v-59dd9667",path:"/posts/2018/07/04/analysis-of-modern-frontend-technology.html",headers:[{level:2,title:"简介",slug:"简介"},{level:2,title:"第一章",slug:"第一章"},{level:3,title:"1.1、MVC",slug:"_1-1、mvc"},{level:3,title:"1.2 MVP",slug:"_1-2-mvp"},{level:3,title:"1.3 MVVM 模式",slug:"_1-3-mvvm-模式"},{level:3,title:"1.3.1 数据变更检测示例",slug:"_1-3-1-数据变更检测示例"},{level:3,title:"1.3.2 脏检测机制",slug:"_1-3-2-脏检测机制"},{level:3,title:"1.3.3 前端数据对象劫持(Hijacking)",slug:"_1-3-3-前端数据对象劫持-hijacking"},{level:3,title:"1.3.4 ECMAScript 6 Proxy",slug:"_1-3-4-ecmascript-6-proxy"},{level:2,title:"1.4 Virtual DOM 交互模式",slug:"_1-4-virtual-dom-交互模式"},{level:3,title:"1.4.1 Virtual DOM设计理念",slug:"_1-4-1-virtual-dom设计理念"},{level:3,title:"1.4.2 Virtual DOM的核心实现",slug:"_1-4-2-virtual-dom的核心实现"},{level:2,title:"1.5 MNV*模式",slug:"_1-5-mnv-模式"},{level:2,title:"到这里第一个话题终于说完了",slug:"到这里第一个话题终于说完了"},{level:2,title:"下面言归正传",slug:"下面言归正传"},{level:2,title:"2 浏览器基础应用",slug:"_2-浏览器基础应用"}],lastUpdated:"6/26/2019, 9:26:03 PM",lastUpdatedTimestamp:1561555563e3,type:"post",top:!1,tags:[],category:"技术文章",createdAt:"2018-07-04",updatedAt:"2019-06-26"},{title:"mac快捷键",frontmatter:{layout:"post",title:"mac快捷键",date:"2019-12-24",excerpt:"mac快捷键","vssue-title":"mac快捷键",category:"工具收集",permalink:"/posts/:year/:month/:day/:slug.html"},regularPath:"/_posts/2019-12-24-use-mac.html",relativePath:"_posts/2019-12-24-use-mac.md",key:"v-727bdcd7",path:"/posts/2019/12/24/use-mac.html",headers:[{level:2,title:"mac快捷键",slug:"mac快捷键"},{level:3,title:"剪切、拷贝、粘贴和其他常用快捷键",slug:"剪切、拷贝、粘贴和其他常用快捷键"},{level:3,title:"睡眠、退出登录和关机快捷键",slug:"睡眠、退出登录和关机快捷键"},{level:3,title:"访达和系统快捷键",slug:"访达和系统快捷键"},{level:3,title:"文稿快捷键",slug:"文稿快捷键"},{level:3,title:"屏幕截图快捷键记录",slug:"屏幕截图快捷键记录"},{level:3,title:"其他快捷键",slug:"其他快捷键"}],lastUpdated:"12/1/2021, 7:02:16 PM",lastUpdatedTimestamp:1638356536e3,type:"post",top:!1,tags:[],category:"工具收集",createdAt:"2019-12-24",updatedAt:"2021-12-01"},{title:"学习正则的使用",frontmatter:{layout:"post",title:"学习正则的使用",date:"2019-08-26T00:00:00.000Z",excerpt:"正则的使用心得","vssue-title":"使用心得",category:"心情随笔",permalink:"/posts/:year/:month/:day/:slug.html"},regularPath:"/_posts/2019-08-26-regexp-learn.html",relativePath:"_posts/2019-08-26-regexp-learn.md",key:"v-c20a3d3a",path:"/posts/2019/08/26/regexp-learn.html",headers:[{level:2,title:"正则基本语法",slug:"正则基本语法"},{level:2,title:"应用总结",slug:"应用总结"},{level:3,title:"验证连续数字是否有重复",slug:"验证连续数字是否有重复"},{level:3,title:"验证是否有重复字符",slug:"验证是否有重复字符"},{level:3,title:"ip地址的正则",slug:"ip地址的正则"},{level:3,title:"12位数字，其中不能出现6位连续相同数字",slug:"_12位数字-其中不能出现6位连续相同数字"},{level:3,title:"A-Z以内不重复的10个字母",slug:"a-z以内不重复的10个字母"},{level:3,title:"千位分隔符(js 实现)",slug:"千位分隔符-js-实现"}],lastUpdated:"4/21/2023, 11:58:53 AM",lastUpdatedTimestamp:1682049533e3,type:"post",top:!1,tags:[],category:"心情随笔",createdAt:"2019-08-26",updatedAt:"2023-04-21"},{title:"地图标绘--射线法来计算点在多边形内",frontmatter:{layout:"post",title:"地图标绘--射线法来计算点在多边形内",date:"2020-02-22",excerpt:"射线法来计算点在多边形内","vssue-title":"射线法来计算点再多边形内",category:"心情随笔",permalink:"/posts/:year/:month/:day/:slug.html"},regularPath:"/_posts/2020-02-22-ray-method-polygon.html",relativePath:"_posts/2020-02-22-ray-method-polygon.md",key:"v-82ef379e",path:"/posts/2020/02/22/ray-method-polygon.html",headers:[{level:2,title:"射线法介绍",slug:"射线法介绍"}],lastUpdated:"3/16/2021, 3:17:41 PM",lastUpdatedTimestamp:1615879061e3,type:"post",top:!1,tags:[],category:"心情随笔",createdAt:"2020-02-22",updatedAt:"2021-03-16"},{title:"前端微服务总结",frontmatter:{layout:"post",title:"前端微服务总结",date:"2020-08-12",excerpt:"前端微服务总结","vssue-title":"前端微服务总结",category:"心情随笔",permalink:"/posts/:year/:month/:day/:slug.html"},regularPath:"/_posts/2020-08-12-fe-microservices.html",relativePath:"_posts/2020-08-12-fe-microservices.md",key:"v-3b2e133e",path:"/posts/2020/08/12/fe-microservices.html",headers:[{level:2,title:"前端微服务总结",slug:"前端微服务总结"},{level:3,title:"如何样式隔离",slug:"如何样式隔离"},{level:3,title:"如何通讯",slug:"如何通讯"},{level:3,title:"介绍",slug:"介绍"},{level:2,title:"什么是微前端",slug:"什么是微前端"},{level:2,title:"qiankun 的核心设计理念",slug:"qiankun-的核心设计理念"},{level:2,title:"特性",slug:"特性"},{level:2,title:"qiankun使用",slug:"qiankun使用"},{level:3,title:"single-spa使用",slug:"single-spa使用"},{level:3,title:"qiankun使用（快速上手）",slug:"qiankun使用-快速上手"}],lastUpdated:"12/3/2021, 8:15:07 PM",lastUpdatedTimestamp:1638533707e3,type:"post",top:!1,tags:[],category:"心情随笔",createdAt:"2020-08-12",updatedAt:"2021-12-03"},{title:"今天总结一下用到的css吧",frontmatter:{layout:"post",title:"今天总结一下用到的css吧",date:"2020-04-28",excerpt:"好久没写记录了，今天闲下来就总结一下","vssue-title":" css总结",category:"心情随笔",permalink:"/posts/:year/:month/:day/:slug.html"},regularPath:"/_posts/2020-04-28-learn-css.html",relativePath:"_posts/2020-04-28-learn-css.md",key:"v-6c901c52",path:"/posts/2020/04/28/learn-css.html",headers:[{level:2,title:"概要",slug:"概要"},{level:3,title:"行和列",slug:"行和列"},{level:3,title:"网格线",slug:"网格线"},{level:2,title:"容器的属性",slug:"容器的属性"},{level:2,title:"css 性能优化",slug:"css-性能优化"},{level:2,title:"css3动画加速",slug:"css3动画加速"},{level:2,title:"css层叠",slug:"css层叠"},{level:2,title:"div居中总结",slug:"div居中总结"},{level:3,title:"浮动",slug:"浮动"},{level:3,title:"link和@import的区别",slug:"link和-import的区别"},{level:3,title:"css常见的选择器",slug:"css常见的选择器"}],lastUpdated:"4/25/2021, 10:47:41 AM",lastUpdatedTimestamp:1619318861e3,type:"post",top:!1,tags:[],category:"心情随笔",createdAt:"2020-04-28",updatedAt:"2021-04-25"},{title:"串的模式匹配",frontmatter:{layout:"post",title:"串的模式匹配",date:"2020-10-09",excerpt:"串的模式匹配","vssue-title":"串的模式匹配",category:"心情随笔",permalink:"/posts/:year/:month/:day/:slug.html"},regularPath:"/_posts/2020-10-09-string.html",relativePath:"_posts/2020-10-09-string.md",key:"v-02b9bb49",path:"/posts/2020/10/09/string.html",headers:[{level:2,title:"🔰模式匹配",slug:"模式匹配"},{level:2,title:"1️⃣模式匹配—BF算法",slug:"模式匹配-bf算法"},{level:2,title:"2️⃣模式匹配—KMP算法",slug:"模式匹配-kmp算法"}],lastUpdated:"4/23/2021, 3:43:32 PM",lastUpdatedTimestamp:1619163812e3,type:"post",top:!1,tags:[],category:"心情随笔",createdAt:"2020-10-09",updatedAt:"2021-04-23"},{title:"图的定义及应用",frontmatter:{layout:"post",title:"图的定义及应用",date:"2020-10-10",excerpt:"图的定义及应用","vssue-title":"图的定义及应用",category:"心情随笔",permalink:"/posts/:year/:month/:day/:slug.html"},regularPath:"/_posts/2020-10-10-chart.html",relativePath:"_posts/2020-10-10-chart.md",key:"v-5859a1d2",path:"/posts/2020/10/10/chart.html",headers:[{level:2,title:"图的定义",slug:"图的定义"},{level:2,title:"基本术语",slug:"基本术语"},{level:2,title:"图的存储",slug:"图的存储"},{level:2,title:"图的遍历",slug:"图的遍历"},{level:2,title:"图的应用（四大应用）",slug:"图的应用-四大应用"},{level:3,title:"关于图的几个概念定义：",slug:"关于图的几个概念定义"},{level:3,title:"👉应用1️⃣:生成树",slug:"应用-生成树"},{level:3,title:"👉应用2️⃣:最小生成树",slug:"应用-最小生成树"},{level:3,title:"👉应用3️⃣:最短路径",slug:"应用-最短路径"},{level:3,title:"👉应用4️⃣:拓扑排序",slug:"应用-拓扑排序"},{level:3,title:"👉应用5️⃣:关键路径",slug:"应用-关键路径"},{level:3,title:"总结",slug:"总结"}],lastUpdated:"10/26/2021, 11:39:12 AM",lastUpdatedTimestamp:1635219552e3,type:"post",top:!1,tags:[],category:"心情随笔",createdAt:"2020-10-10",updatedAt:"2021-10-26"},{title:"排序",frontmatter:{layout:"post",title:"排序",date:"2020-10-11",excerpt:"排序","vssue-title":"排序",category:"心情随笔",permalink:"/posts/:year/:month/:day/:slug.html"},regularPath:"/_posts/2020-10-11-sort.html",relativePath:"_posts/2020-10-11-sort.md",key:"v-6a2fdcdd",path:"/posts/2020/10/11/sort.html",headers:[{level:2,title:"排序算法分类",slug:"排序算法分类"},{level:3,title:"插入排序",slug:"插入排序"},{level:3,title:"交换排序",slug:"交换排序"},{level:3,title:"选择排序",slug:"选择排序"},{level:3,title:"堆排序",slug:"堆排序"},{level:3,title:"归并排序 （二路归并）",slug:"归并排序-二路归并"},{level:3,title:"基数排序",slug:"基数排序"}],lastUpdated:"3/18/2021, 10:28:27 AM",lastUpdatedTimestamp:1616034507e3,type:"post",top:!1,tags:[],category:"心情随笔",createdAt:"2020-10-11",updatedAt:"2021-03-18"},{title:"查找",frontmatter:{layout:"post",title:"查找",date:"2020-10-13",excerpt:"查找","vssue-title":"查找",category:"心情随笔",permalink:"/posts/:year/:month/:day/:slug.html"},regularPath:"/_posts/2020-10-13-seek.html",relativePath:"_posts/2020-10-13-seek.md",key:"v-5c8c14ad",path:"/posts/2020/10/13/seek.html",headers:[{level:2,title:"查找的基本概念",slug:"查找的基本概念"},{level:3,title:"方法1️⃣ 顺序查找",slug:"方法-顺序查找"},{level:3,title:"方法2️⃣:二分查找",slug:"方法-二分查找"},{level:3,title:"方法3️⃣:分块查找",slug:"方法-分块查找"},{level:3,title:"方法4️⃣:树表的查找",slug:"方法-树表的查找"},{level:3,title:"散列查找",slug:"散列查找"}],lastUpdated:"12/12/2021, 5:43:54 PM",lastUpdatedTimestamp:1639302234e3,type:"post",top:!1,tags:[],category:"心情随笔",createdAt:"2020-10-13",updatedAt:"2021-12-12"},{title:"react基础知识",frontmatter:{layout:"post",title:"react基础知识",date:"2021-02-26",excerpt:"查找","vssue-title":"react基础知识",category:"心情随笔",permalink:"/posts/:year/:month/:day/:slug.html"},regularPath:"/_posts/2021-02-26-react-basics.html",relativePath:"_posts/2021-02-26-react-basics.md",key:"v-40322b92",path:"/posts/2021/02/26/react-basics.html",headers:[{level:2,title:"react基础知识",slug:"react基础知识"},{level:3,title:"hooks",slug:"hooks"},{level:3,title:"jsx基本使用",slug:"jsx基本使用"},{level:3,title:"react生命周期",slug:"react生命周期"},{level:3,title:"react-router",slug:"react-router"}],lastUpdated:"11/15/2021, 10:13:14 AM",lastUpdatedTimestamp:1636942394e3,type:"post",top:!1,tags:[],category:"心情随笔",createdAt:"2021-02-26",updatedAt:"2021-11-15"},{title:"vue基础知识",frontmatter:{layout:"post",title:"vue基础知识",date:"2021-03-02",excerpt:"查找","vssue-title":"vue基础知识",category:"心情随笔",permalink:"/posts/:year/:month/:day/:slug.html"},regularPath:"/_posts/2021-03-02-vue-basics.html",relativePath:"_posts/2021-03-02-vue-basics.md",key:"v-a5140402",path:"/posts/2021/03/02/vue-basics.html",headers:[{level:2,title:"基础知识",slug:"基础知识"},{level:3,title:"模板",slug:"模板"},{level:3,title:"指令",slug:"指令"},{level:3,title:"computed 和watch",slug:"computed-和watch"},{level:3,title:"v-for循环",slug:"v-for循环"},{level:3,title:"生命周期",slug:"生命周期"},{level:3,title:"组件通信",slug:"组件通信"},{level:3,title:"自定义组件v-model",slug:"自定义组件v-model"},{level:3,title:"nextTick",slug:"nexttick"},{level:3,title:"动态组件&异步组件",slug:"动态组件-异步组件"},{level:3,title:"keep-alive",slug:"keep-alive"},{level:3,title:"mixin",slug:"mixin"},{level:3,title:"vue-router",slug:"vue-router"},{level:3,title:"vue3的差异",slug:"vue3的差异"}],lastUpdated:"6/26/2023, 5:28:19 PM",lastUpdatedTimestamp:1687771699e3,type:"post",top:!1,tags:[],category:"心情随笔",createdAt:"2021-03-02",updatedAt:"2023-06-26"},{title:"react高级特性",frontmatter:{layout:"post",title:"react高级特性",date:"2021-02-29",excerpt:"查找","vssue-title":"react高级特性",category:"心情随笔",permalink:"/posts/:year/:month/:day/:slug.html"},regularPath:"/_posts/2021-02-29-react-senior.html",relativePath:"_posts/2021-02-29-react-senior.md",key:"v-4f270427",path:"/posts/2021/03/01/react-senior.html",headers:[{level:2,title:"特性",slug:"特性"},{level:3,title:"函数组件",slug:"函数组件"},{level:3,title:"非受控组件",slug:"非受控组件"},{level:3,title:"portals",slug:"portals"},{level:3,title:"context",slug:"context"},{level:3,title:"异步组件",slug:"异步组件"},{level:3,title:"shouldComponentUpdate",slug:"shouldcomponentupdate"},{level:3,title:"pureComponent",slug:"purecomponent"},{level:3,title:"immutable.js",slug:"immutable-js"},{level:3,title:"高阶组件HOC",slug:"高阶组件hoc"},{level:3,title:"render Props",slug:"render-props"},{level:3,title:"redux过程描述",slug:"redux过程描述"},{level:2,title:"react本质",slug:"react本质"},{level:3,title:"vdom和diff",slug:"vdom和diff"},{level:3,title:"jsx",slug:"jsx"},{level:3,title:"合成事件",slug:"合成事件"},{level:3,title:"setState",slug:"setstate"},{level:3,title:"组件渲染、更新过程",slug:"组件渲染、更新过程"}],lastUpdated:"12/1/2021, 7:02:16 PM",lastUpdatedTimestamp:1638356536e3,type:"post",top:!1,tags:[],category:"心情随笔",createdAt:"2021-03-01",updatedAt:"2021-12-01"},{title:"vue一些思考",frontmatter:{layout:"post",title:"vue一些思考",date:"2021-03-04",excerpt:"查找","vssue-title":"vue一些思考",category:"心情随笔",permalink:"/posts/:year/:month/:day/:slug.html"},regularPath:"/_posts/2021-03-04-vue-principle.html",relativePath:"_posts/2021-03-04-vue-principle.md",key:"v-3c1a57b7",path:"/posts/2021/03/04/vue-principle.html",headers:[{level:2,title:"vue常见原理",slug:"vue常见原理"},{level:3,title:"模板编译过程概述",slug:"模板编译过程概述"},{level:3,title:"响应式",slug:"响应式"},{level:3,title:"vdom",slug:"vdom"},{level:3,title:"diff算法概述",slug:"diff算法概述"},{level:3,title:"组件的渲染更新过程",slug:"组件的渲染更新过程"},{level:3,title:"将props传递子组件",slug:"将props传递子组件"},{level:3,title:"hash模式",slug:"hash模式"},{level:3,title:"hisotry模式",slug:"hisotry模式"}],lastUpdated:"12/2/2021, 10:35:16 AM",lastUpdatedTimestamp:1638412516e3,type:"post",top:!1,tags:[],category:"心情随笔",createdAt:"2021-03-04",updatedAt:"2021-12-02"},{title:"chrome插件",frontmatter:{layout:"post",title:"chrome插件",date:"2021-02-02",excerpt:"chrome插件开发","vssue-title":"chrome插件开发",category:"心情随笔",permalink:"/posts/:year/:month/:day/:slug.html"},regularPath:"/_posts/2021-02-02-chrome-plugin.html",relativePath:"_posts/2021-02-02-chrome-plugin.md",key:"v-67bd99b7",path:"/posts/2021/02/02/chrome-plugin.html",headers:[{level:2,title:"说明",slug:"说明"},{level:2,title:"手把手教搭建过程",slug:"手把手教搭建过程"},{level:2,title:"wokoo-scripts编写",slug:"wokoo-scripts编写"},{level:2,title:"wokoo-template编写",slug:"wokoo-template编写"},{level:2,title:"发布wokoo",slug:"发布wokoo"},{level:2,title:"wokoo使用",slug:"wokoo使用"},{level:3,title:"1.1 项目安装 & 初始化配置",slug:"_1-1-项目安装-初始化配置"},{level:3,title:"1.2 开发基本功能",slug:"_1-2-开发基本功能"},{level:2,title:"三、部署插件到油猴商店",slug:"三、部署插件到油猴商店"}],lastUpdated:"11/15/2021, 10:13:14 AM",lastUpdatedTimestamp:1636942394e3,type:"post",top:!1,tags:[],category:"心情随笔",createdAt:"2021-02-02",updatedAt:"2021-11-15"},{title:"webpack应用总结一",frontmatter:{layout:"post",title:"webpack应用总结一",date:"2021-03-09",excerpt:"查找","vssue-title":"webpack应用总结一",category:"心情随笔",permalink:"/posts/:year/:month/:day/:slug.html"},regularPath:"/_posts/2021-03-09-webpack.html",relativePath:"_posts/2021-03-09-webpack.md",key:"v-66101e52",path:"/posts/2021/03/09/webpack.html",headers:[{level:2,title:"webpack应用总结",slug:"webpack应用总结"},{level:3,title:"拆分配置",slug:"拆分配置"},{level:3,title:"启动本地服务",slug:"启动本地服务"},{level:3,title:"es6处理",slug:"es6处理"},{level:3,title:"处理样式",slug:"处理样式"},{level:3,title:"处理图片",slug:"处理图片"},{level:3,title:"多入口",slug:"多入口"},{level:3,title:"抽离CSS文件",slug:"抽离css文件"},{level:3,title:"抽离公共代码",slug:"抽离公共代码"},{level:3,title:"懒加载",slug:"懒加载"},{level:3,title:"loader",slug:"loader"},{level:3,title:"处理jsx与vue",slug:"处理jsx与vue"}],lastUpdated:"4/26/2021, 12:43:46 PM",lastUpdatedTimestamp:1619412226e3,type:"post",top:!1,tags:[],category:"心情随笔",createdAt:"2021-03-09",updatedAt:"2021-04-26"},{title:"font-weight相关内容",frontmatter:{layout:"post",title:"font-weight相关内容",date:"2021-07-13T00:00:00.000Z",excerpt:"font-weight的真相","vssue-title":"font-weight的真相",category:"心情随笔",permalink:"/posts/:year/:month/:day/:slug.html"},regularPath:"/_posts/2021-07-13-font-weight.html",relativePath:"_posts/2021-07-13-font-weight.md",key:"v-652145d2",path:"/posts/2021/07/13/font-weight.html",headers:[{level:2,title:"font-weight基本信息",slug:"font-weight基本信息"},{level:3,title:"语法",slug:"语法"},{level:3,title:"font-weight的转化规律",slug:"font-weight的转化规律"},{level:3,title:"字体匹配算法",slug:"字体匹配算法"},{level:3,title:"总结",slug:"总结"}],lastUpdated:"2/17/2025, 3:18:20 PM",lastUpdatedTimestamp:17397767e5,type:"post",top:!1,tags:[],category:"心情随笔",createdAt:"2021-07-13",updatedAt:"2025-02-17"},{title:"webpack应用总结二",frontmatter:{layout:"post",title:"webpack应用总结二",date:"2021-03-10",excerpt:"查找","vssue-title":"webpack应用总结二",category:"心情随笔",permalink:"/posts/:year/:month/:day/:slug.html"},regularPath:"/_posts/2021-03-10-webpack-senior.html",relativePath:"_posts/2021-03-10-webpack-senior.md",key:"v-67baae1e",path:"/posts/2021/03/10/webpack-senior.html",headers:[{level:2,title:"webpack应用总结二",slug:"webpack应用总结二"},{level:3,title:"module、chunk、bundle区别",slug:"module、chunk、bundle区别"},{level:3,title:"loader和plugins的区别",slug:"loader和plugins的区别"},{level:3,title:"优化babel-loader",slug:"优化babel-loader"},{level:3,title:"ignorePlugin和noParse",slug:"ignoreplugin和noparse"},{level:3,title:"happyPack",slug:"happypack"},{level:3,title:"ParallelUglifyPlugin",slug:"paralleluglifyplugin"},{level:3,title:"关于开启多进程",slug:"关于开启多进程"},{level:3,title:"自动刷新",slug:"自动刷新"},{level:3,title:"热更新",slug:"热更新"},{level:3,title:"DllPlugin动态链接库",slug:"dllplugin动态链接库"},{level:3,title:"webpack 优化构建速度",slug:"webpack-优化构建速度"},{level:3,title:"webpack 性能优化",slug:"webpack-性能优化"},{level:3,title:"es6 module和commonjs的区别",slug:"es6-module和commonjs的区别"},{level:3,title:"tree shaking",slug:"tree-shaking"},{level:3,title:"scope Hosting",slug:"scope-hosting"},{level:3,title:"为什么要进行打包和构建",slug:"为什么要进行打包和构建"}],lastUpdated:"12/9/2021, 11:07:41 AM",lastUpdatedTimestamp:1639019261e3,type:"post",top:!1,tags:[],category:"心情随笔",createdAt:"2021-03-10",updatedAt:"2021-12-09"},{title:"微前端调研",frontmatter:{layout:"post",title:"微前端调研",date:"2024-03-25",excerpt:"微前端调研","vssue-title":"微前端调研",category:"心情随笔",permalink:"/posts/:year/:month/:day/:slug.html"},regularPath:"/_posts/2024-03-25-web-component.html",relativePath:"_posts/2024-03-25-web-component.md",key:"v-242cbd57",path:"/posts/2024/03/25/web-component.html",headers:[{level:2,title:"微前端调研",slug:"微前端调研"},{level:3,title:"虚拟路由",slug:"虚拟路由"},{level:3,title:"web components",slug:"web-components"}],lastUpdated:"5/5/2024, 5:46:13 PM",lastUpdatedTimestamp:1714902373e3,type:"post",top:!1,tags:[],category:"心情随笔",createdAt:"2024-03-25",updatedAt:"2024-05-05"},{title:"webpack优化实践",frontmatter:{layout:"post",title:"webpack优化实践",date:"2021-03-27",excerpt:"webpack优化实践","vssue-title":"webpack优化实践",category:"心情随笔",permalink:"/posts/:year/:month/:day/:slug.html"},regularPath:"/_posts/2021-03-27-webpack-share.html",relativePath:"_posts/2021-03-27-webpack-share.md",key:"v-483c3f97",path:"/posts/2021/03/27/webpack-share.html",headers:[{level:2,title:"webpack优化打包速度",slug:"webpack优化打包速度"},{level:3,title:"webpack打包流程",slug:"webpack打包流程"},{level:3,title:"缩短解析时间",slug:"缩短解析时间"},{level:3,title:"缩短搜索时间",slug:"缩短搜索时间"},{level:3,title:"缩短打包时间",slug:"缩短打包时间"},{level:3,title:"其他",slug:"其他"},{level:2,title:"webpack编译体积优化",slug:"webpack编译体积优化"}],lastUpdated:"12/31/2021, 4:28:57 PM",lastUpdatedTimestamp:1640939337e3,type:"post",top:!1,tags:[],category:"心情随笔",createdAt:"2021-03-27",updatedAt:"2021-12-31"},{title:"typescript总结",frontmatter:{layout:"post",title:"typescript总结",date:"2021-04-03",excerpt:"typescript总结","vssue-title":"typescript总结",category:"心情随笔",permalink:"/posts/:year/:month/:day/:slug.html"},regularPath:"/_posts/2021-04-03-typescript.html",relativePath:"_posts/2021-04-03-typescript.md",key:"v-53b0f14d",path:"/posts/2021/04/03/typescript.html",headers:[{level:2,title:"typescipt总结",slug:"typescipt总结"},{level:3,title:"1. typescript是什么",slug:"_1-typescript是什么"},{level:3,title:"2. TypeScript安装和编译",slug:"_2-typescript安装和编译"},{level:3,title:"3. 数据类型",slug:"_3-数据类型"},{level:3,title:"4. 函数",slug:"_4-函数"},{level:3,title:"5. 类",slug:"_5-类"},{level:3,title:"6. 接口",slug:"_6-接口"},{level:3,title:"7. 泛型",slug:"_7-泛型"},{level:3,title:"8.结构类型系统",slug:"_8-结构类型系统"},{level:3,title:"9.类型保护",slug:"_9-类型保护"},{level:3,title:"10. 类型变换",slug:"_10-类型变换"},{level:3,title:"11. 模块VS命名空间",slug:"_11-模块vs命名空间"},{level:3,title:"12.类型声明",slug:"_12-类型声明"}],lastUpdated:"4/1/2023, 1:38:16 PM",lastUpdatedTimestamp:1680327496e3,type:"post",top:!1,tags:[],category:"心情随笔",createdAt:"2021-04-03",updatedAt:"2023-04-01"},{title:"上传下载文件方式总结",frontmatter:{layout:"post",title:"上传下载文件方式总结",date:"2023-03-23",excerpt:"上传下载文件方式总结","vssue-title":"上传下载文件方式总结",category:"心情随笔",permalink:"/posts/:year/:month/:day/:slug.html"},regularPath:"/_posts/2023-03-23-upload-file.html",relativePath:"_posts/2023-03-23-upload-file.md",key:"v-fb815392",path:"/posts/2023/03/23/upload-file.html",headers:[{level:2,title:"下载的方式",slug:"下载的方式"},{level:3,title:"直接下载的方式",slug:"直接下载的方式"},{level:3,title:"文件流转blob对象下载",slug:"文件流转blob对象下载"},{level:2,title:"上传文件的方式",slug:"上传文件的方式"},{level:3,title:"1. 传统上传方式",slug:"_1-传统上传方式"},{level:3,title:"2. formData上传",slug:"_2-formdata上传"},{level:3,title:"3. 拖拽上传",slug:"_3-拖拽上传"}],lastUpdated:"3/29/2023, 5:12:36 PM",lastUpdatedTimestamp:1680081156e3,type:"post",top:!1,tags:[],category:"心情随笔",createdAt:"2023-03-23",updatedAt:"2023-03-29"},{title:"常见的leetCode题目与解题思路",frontmatter:{layout:"post",title:"常见的leetCode题目与解题思路",date:"2022-03-10T00:00:00.000Z",excerpt:"常见的leetCode题目与解题思路","vssue-title":"常见的leetCode题目与解题思路",category:"心情随笔",permalink:"/posts/:year/:month/:day/:slug.html"},regularPath:"/_posts/2022-03-10-leetcode-thinking.html",relativePath:"_posts/2022-03-10-leetcode-thinking.md",key:"v-448645d2",path:"/posts/2022/03/10/leetcode-thinking.html",headers:[{level:2,title:"常见的算法思路",slug:"常见的算法思路"},{level:3,title:"P1. 回文字符串判断",slug:"p1-回文字符串判断"},{level:3,title:"P2. 求和为给定值的两个数",slug:"p2-求和为给定值的两个数"},{level:3,title:"P3. 有序数组中求和为给定值的两个数",slug:"p3-有序数组中求和为给定值的两个数"},{level:3,title:"P4. 判断二叉树是否对称",slug:"p4-判断二叉树是否对称"},{level:3,title:"P5. 不用+/-求两数之和",slug:"p5-不用-求两数之和"},{level:3,title:"P6. 单身数字",slug:"p6-单身数字"},{level:3,title:"P7. 行列递增的二维数组搜索",slug:"p7-行列递增的二维数组搜索"},{level:3,title:"P8. 判断二叉树是否相同",slug:"p8-判断二叉树是否相同"},{level:3,title:"P9. 反转单链表",slug:"p9-反转单链表"},{level:3,title:"P10. 数值的 n 次方",slug:"p10-数值的-n-次方"},{level:3,title:"P11. 数组的全排列",slug:"p11-数组的全排列"},{level:3,title:"P12. 回文子串个数",slug:"p12-回文子串个数"},{level:3,title:"P13. 回文数字判断",slug:"p13-回文数字判断"},{level:3,title:"P14. 判断单链表是否为回文链表",slug:"p14-判断单链表是否为回文链表"},{level:3,title:"P15. 缺失的数字",slug:"p15-缺失的数字"},{level:3,title:"P16. 二叉树的最小深度",slug:"p16-二叉树的最小深度"},{level:3,title:"P17. 带有 min 函数的栈",slug:"p17-带有-min-函数的栈"},{level:3,title:"P18. 合并两个有序链表",slug:"p18-合并两个有序链表"},{level:3,title:"P19. 合并两个有序数组",slug:"p19-合并两个有序数组"},{level:3,title:"P20. 求两个有序数组的中位数",slug:"p20-求两个有序数组的中位数"},{level:3,title:"P21. 连续子序列的最大和",slug:"p21-连续子序列的最大和"},{level:3,title:"P22. 二叉树的最大深度",slug:"p22-二叉树的最大深度"},{level:3,title:"P23. 数组中超过一半的数字",slug:"p23-数组中超过一半的数字"},{level:3,title:"P24. 实现 LRU 缓存",slug:"p24-实现-lru-缓存"},{level:3,title:"P25. 没有重复字符的最长子串长度",slug:"p25-没有重复字符的最长子串长度"},{level:3,title:"P26. 最长回文子串",slug:"p26-最长回文子串"},{level:3,title:"P27. 判断单链表是否有环",slug:"p27-判断单链表是否有环"},{level:3,title:"P28. 链表的相交节点",slug:"p28-链表的相交节点"},{level:3,title:"P29. 括号的合法排列",slug:"p29-括号的合法排列"},{level:3,title:"P30. 编辑距离",slug:"p30-编辑距离"},{level:3,title:"P31. 容纳最多水的凹槽容量",slug:"p31-容纳最多水的凹槽容量"},{level:3,title:"P32. 爬楼梯方法数",slug:"p32-爬楼梯方法数"},{level:3,title:"P33. 二叉树的层序遍历",slug:"p33-二叉树的层序遍历"},{level:3,title:"P34. 二叉树的逆层序遍历",slug:"p34-二叉树的逆层序遍历"},{level:3,title:"P35. 二叉树中序遍历",slug:"p35-二叉树中序遍历"},{level:3,title:"P36. 二分搜索",slug:"p36-二分搜索"},{level:3,title:"P37. 二分搜索插入位置",slug:"p37-二分搜索插入位置"},{level:3,title:"P38. 二维数组的二分搜索",slug:"p38-二维数组的二分搜索"},{level:3,title:"P39. 判断二叉树是否平衡",slug:"p39-判断二叉树是否平衡"},{level:3,title:"P40. 求两个单链表之和",slug:"p40-求两个单链表之和"},{level:3,title:"P41. 丑数",slug:"p41-丑数"},{level:3,title:"P42. 字符串转整数",slug:"p42-字符串转整数"},{level:3,title:"P43. 实现 strstr",slug:"p43-实现-strstr"},{level:3,title:"P44. 检验二叉搜索树",slug:"p44-检验二叉搜索树"},{level:3,title:"P45. 有效的括号序列",slug:"p45-有效的括号序列"},{level:3,title:"P46. 买卖股票的最大利润",slug:"p46-买卖股票的最大利润"},{level:3,title:"P47. 翻转二叉树",slug:"p47-翻转二叉树"},{level:3,title:"P48. 单链表删除数字",slug:"p48-单链表删除数字"},{level:3,title:"P49. 二进制中 1 的个数",slug:"p49-二进制中-1-的个数"},{level:3,title:"P50. 矩阵置零",slug:"p50-矩阵置零"}],lastUpdated:"7/9/2022, 6:46:23 PM",lastUpdatedTimestamp:1657363583e3,type:"post",top:!1,tags:[],category:"心情随笔",createdAt:"2022-03-10",updatedAt:"2022-07-09"},{title:"Enjoy life:)",frontmatter:{layout:"CustomLayout",title:"Enjoy life:)",aside:!1},regularPath:"/custom-pages/",relativePath:"custom-pages/index.md",key:"v-6f067db4",path:"/custom-pages/",headers:[{level:2,title:"About",slug:"about"},{level:2,title:"How to reach me",slug:"how-to-reach-me"}],lastUpdated:"11/25/2021, 11:01:16 AM",lastUpdatedTimestamp:1637809276e3,type:"page"},{title:"css实战",frontmatter:{layout:"post",title:"css实战",date:"2025-01-10T00:00:00.000Z",excerpt:"css实战","vssue-title":"css实战",category:"技术文章",permalink:"/posts/:year/:month/:day/:slug.html"},regularPath:"/_posts/2025-01-10-css-practical-application.html",relativePath:"_posts/2025-01-10-css-practical-application.md",key:"v-29605312",path:"/posts/2025/01/10/css-practical-application.html",headers:[{level:2,title:"W3C的选择器",slug:"w3c的选择器"},{level:3,title:"相关的html新标签",slug:"相关的html新标签"},{level:3,title:":has的使用",slug:"has的使用"},{level:3,title:"组合选择器",slug:"组合选择器"},{level:3,title:"伪类选择器",slug:"伪类选择器"},{level:3,title:"选择多个范围的组",slug:"选择多个范围的组"}],lastUpdated:"2/17/2025, 3:18:20 PM",lastUpdatedTimestamp:17397767e5,type:"post",top:!1,tags:[],category:"技术文章",createdAt:"2025-01-10",updatedAt:"2025-02-17"},{title:"timezone offset校正",frontmatter:{layout:"post",title:"timezone offset校正",date:"2024-09-25T00:00:00.000Z",excerpt:"时区校正","vssue-title":"时区校正",category:"技术文章",permalink:"/posts/:year/:month/:day/:slug.html"},regularPath:"/_posts/2024-09-25-timezone-offset.html",relativePath:"_posts/2024-09-25-timezone-offset.md",key:"v-19e0cb92",path:"/posts/2024/09/25/timezone-offset.html",headers:[{level:2,title:"时差转换 getTimezoneOffset()",slug:"时差转换-gettimezoneoffset"},{level:3,title:"解决方案",slug:"解决方案"}],lastUpdated:"1/10/2025, 11:24:31 AM",lastUpdatedTimestamp:1736479471e3,type:"post",top:!1,tags:[],category:"技术文章",createdAt:"2024-09-25",updatedAt:"2025-01-10"},{title:"vsCode源码运行",frontmatter:{layout:"post",title:"vsCode源码运行",date:"2023-10-23",excerpt:"vsCode源码运行","vssue-title":"vsCode源码运行",category:"心情随笔",permalink:"/posts/:year/:month/:day/:slug.html"},regularPath:"/_posts/2023-1023-vscode.html",relativePath:"_posts/2023-1023-vscode.md",key:"v-55ece897",path:"/posts/2023/10/23/_2023-1023-vscode.html",headers:[{level:2,title:"xxx",slug:"xxx"}],lastUpdated:"3/25/2024, 2:39:46 PM",lastUpdatedTimestamp:1711348786e3,type:"post",top:!1,tags:[],category:"心情随笔",createdAt:"2023-10-23",updatedAt:"2024-03-25"},{frontmatter:{title:"Hello World...",layout:"Home"},regularPath:"/",key:"v-b2754d56",path:"/",type:"page"},{frontmatter:{title:"Enjoy coding",layout:"Posts"},regularPath:"/posts/",key:"v-1f814451",path:"/posts/",type:"page"},{frontmatter:{title:"标签",layout:"Tags"},regularPath:"/posts/tags/",key:"v-03721585",path:"/posts/tags/"},{frontmatter:{title:"分类",layout:"Categories"},regularPath:"/posts/categories/",key:"v-5eb9e6bc",path:"/posts/categories/"},{frontmatter:{title:"技术文章 | 分类",layout:"Category"},regularPath:"/posts/categories/%E6%8A%80%E6%9C%AF%E6%96%87%E7%AB%A0.html",key:"v-1746ab84",path:"/posts/categories/技术文章.html"},{frontmatter:{title:"工具收集 | 分类",layout:"Category"},regularPath:"/posts/categories/%E5%B7%A5%E5%85%B7%E6%94%B6%E9%9B%86.html",key:"v-34e2e03f",path:"/posts/categories/工具收集.html"},{frontmatter:{title:"docs | 分类",layout:"Category"},regularPath:"/posts/categories/docs.html",key:"v-6fe1551c",path:"/posts/categories/docs.html"},{frontmatter:{title:"心情随笔 | 分类",layout:"Category"},regularPath:"/posts/categories/%E5%BF%83%E6%83%85%E9%9A%8F%E7%AC%94.html",key:"v-d262708c",path:"/posts/categories/心情随笔.html"}],themeConfig:{lang:{home:"Hello World...",posts:"Enjoy coding",category:"分类",categories:"分类",tag:"标签",tags:"标签",allCategories:"全部",search:"查找",searchHint:"查找标题和摘要",noRelatedPosts:"没有相关文章",top:"置顶",createdAt:"发布于",updatedAt:"修改于",prevPost:"上一篇",nextPost:"下一篇",toc:"文章目录",comments:"评论",notFound:"哎呀！你要找的页面不在这里"},personalInfo:{nickname:"Glitr",description:"Enjoy coding,<br/>Enjoy life:)",copyrightYear:2023,email:"glitteringma@gmail.com",location:"Beijing City, China",organization:"Secrecy",avatar:"https://www.mamingjuan.cn/assets/img/avatar.jpeg",sns:{github:{account:"glitzma",link:"https://github.com/happy760690"}}},header:{background:{url:["/assets/img/header-image-01.jpg","/assets/img/header-image-02.jpg","/assets/img/header-image-03.jpg","/assets/img/header-image-04.jpg","/assets/img/header-image-05.jpg"],useGeo:!1},showTitle:!1},lastUpdated:!0,nav:[{text:"Home",link:"/",exact:!0},{text:"Search",link:"/posts/",exact:!1},{text:"About",link:"/custom-pages/",exact:!1}],comments:!1,pagination:{perPage:20},defaultPages:{},plugins:{}},locales:{"/":{title:"马明娟",path:"/"}}};var P=l(28);l(285);s.a.component("CustomLayout",()=>l.e(10).then(l.bind(null,331)));var _=l(111),w=l(112),T=l(20),j=l.n(T),O={name:"BackToTop",props:{threshold:{type:Number,default:300}},data:()=>({scrollTop:null}),computed:{show(){return this.scrollTop>this.threshold}},mounted(){this.scrollTop=this.getScrollTop(),window.addEventListener("scroll",j()(()=>{this.scrollTop=this.getScrollTop()},100))},methods:{getScrollTop:()=>window.pageYOffset||document.documentElement.scrollTop||document.body.scrollTop||0,scrollToTop(){window.scrollTo({top:0,behavior:"smooth"}),this.scrollTop=0}}},A=(l(289),l(2)),E=Object(A.a)(O,(function(){var t=this._self._c;return t("transition",{attrs:{name:"fade"}},[this.show?t("svg",{staticClass:"go-to-top",attrs:{xmlns:"http://www.w3.org/2000/svg",viewBox:"0 0 49.484 28.284"},on:{click:this.scrollToTop}},[t("g",{attrs:{transform:"translate(-229 -126.358)"}},[t("rect",{attrs:{fill:"currentColor",width:"35",height:"5",rx:"2",transform:"translate(229 151.107) rotate(-45)"}}),this._v(" "),t("rect",{attrs:{fill:"currentColor",width:"35",height:"5",rx:"2",transform:"translate(274.949 154.642) rotate(-135)"}})])]):this._e()])}),[],!1,null,"5fd4ef0c",null).exports,U=l(114),C=[P.a,{},({Vue:t})=>{t.mixin({computed:{$dataBlock(){return this.$options.__data__block__}}})},{},P.a,_.a,w.a,({Vue:t})=>{t.component("BackToTop",E)},U.a,({Vue:t})=>t.component("TOC",()=>l.e(54).then(l.bind(null,321)))],$=["Iconfont","BackToTop"];class S extends class{constructor(){this.store=new s.a({data:{state:{}}})}$get(t){return this.store.state[t]}$set(t,e){s.a.set(this.store.state,t,e)}$emit(...t){this.store.$emit(...t)}$on(...t){this.store.$on(...t)}}{}Object.assign(S.prototype,{getPageAsyncComponent:a.e,getLayoutAsyncComponent:a.d,getAsyncComponent:a.c,getVueComponent:a.f});var M={install(t){const e=new S;t.$vuepress=e,t.prototype.$vuepress=e}};function z(t,e){const l=e.toLowerCase();return t.options.routes.some(t=>t.path.toLowerCase()===l)}var D={props:{pageKey:String,slotKey:{type:String,default:"default"}},render(t){const e=this.pageKey||this.$parent.$page.key;return Object(a.h)("pageKey",e),s.a.component(e)||s.a.component(e,Object(a.e)(e)),s.a.component(e)?t(e):t("")}},L={functional:!0,props:{slotKey:String,required:!0},render:(t,{props:e,slots:l})=>t("div",{class:["content__"+e.slotKey]},l()[e.slotKey])},I={computed:{openInNewWindowTitle(){return this.$themeLocaleConfig.openNewWindowText||"(opens new window)"}}},F=(l(291),l(292),Object(A.a)(I,(function(){var t=this._self._c;return t("span",[t("svg",{staticClass:"icon outbound",attrs:{xmlns:"http://www.w3.org/2000/svg","aria-hidden":"true",focusable:"false",x:"0px",y:"0px",viewBox:"0 0 100 100",width:"15",height:"15"}},[t("path",{attrs:{fill:"currentColor",d:"M18.8,85.1h56l0,0c2.2,0,4-1.8,4-4v-32h-8v28h-48v-48h28v-8h-32l0,0c-2.2,0-4,1.8-4,4v56C14.8,83.3,16.6,85.1,18.8,85.1z"}}),this._v(" "),t("polygon",{attrs:{fill:"currentColor",points:"45.7,48.7 51.3,54.3 77.2,28.5 77.2,37.2 85.2,37.2 85.2,14.9 62.8,14.9 62.8,22.9 71.5,22.9"}})]),this._v(" "),t("span",{staticClass:"sr-only"},[this._v(this._s(this.openInNewWindowTitle))])])}),[],!1,null,null,null).exports),B={functional:!0,render(t,{parent:e,children:l}){if(e._isMounted)return l;e.$once("hook:mounted",()=>{e.$forceUpdate()})}};s.a.config.productionTip=!1,s.a.use(r.a),s.a.use(M),s.a.mixin(function(t,e,l=s.a){!function(t){t.locales&&Object.keys(t.locales).forEach(e=>{t.locales[e].path=e});Object.freeze(t)}(e),l.$vuepress.$set("siteData",e);const r=new(t(l.$vuepress.$get("siteData"))),a=Object.getOwnPropertyDescriptors(Object.getPrototypeOf(r)),o={};return Object.keys(a).reduce((t,e)=>(e.startsWith("$")&&(t[e]=a[e].get),t),o),{computed:o}}(t=>class{setPage(t){this.__page=t}get $site(){return t}get $themeConfig(){return this.$site.themeConfig}get $frontmatter(){return this.$page.frontmatter}get $localeConfig(){const{locales:t={}}=this.$site;let e,l;for(const s in t)"/"===s?l=t[s]:0===this.$page.path.indexOf(s)&&(e=t[s]);return e||l||{}}get $siteTitle(){return this.$localeConfig.title||this.$site.title||""}get $canonicalUrl(){const{canonicalUrl:t}=this.$page.frontmatter;return"string"==typeof t&&t}get $title(){const t=this.$page,{metaTitle:e}=this.$page.frontmatter;if("string"==typeof e)return e;const l=this.$siteTitle,s=t.frontmatter.home?null:t.frontmatter.title||t.title;return l?s?s+" | "+l:l:s||"VuePress"}get $description(){const t=function(t){if(t){const e=t.filter(t=>"description"===t.name)[0];if(e)return e.content}}(this.$page.frontmatter.meta);return t||(this.$page.frontmatter.description||this.$localeConfig.description||this.$site.description||"")}get $lang(){return this.$page.frontmatter.lang||this.$localeConfig.lang||"en-US"}get $localePath(){return this.$localeConfig.path||"/"}get $themeLocaleConfig(){return(this.$site.themeConfig.locales||{})[this.$localePath]||{}}get $page(){return this.__page?this.__page:function(t,e){for(let l=0;l<t.length;l++){const s=t[l];if(s.path.toLowerCase()===e.toLowerCase())return s}return{path:"",frontmatter:{}}}(this.$site.pages,this.$route.path)}},k)),s.a.component("Content",D),s.a.component("ContentSlotsDistributor",L),s.a.component("OutboundLink",F),s.a.component("ClientOnly",B),s.a.component("Layout",Object(a.d)("Layout")),s.a.component("NotFound",Object(a.d)("NotFound")),s.a.prototype.$withBase=function(t){const e=this.$site.base;return"/"===t.charAt(0)?e+t.slice(1):t},window.__VUEPRESS__={version:"1.9.9",hash:"c890a63"},async function(t){const e="undefined"!=typeof window&&window.__VUEPRESS_ROUTER_BASE__?window.__VUEPRESS_ROUTER_BASE__:k.routerBase||k.base,l=new r.a({base:e,mode:"history",fallback:!1,routes:x,scrollBehavior:(t,e,l)=>l||(t.hash?!s.a.$vuepress.$get("disableScrollBehavior")&&{selector:decodeURIComponent(t.hash)}:{x:0,y:0})});!function(t){t.beforeEach((e,l,s)=>{if(z(t,e.path))s();else if(/(\/|\.html)$/.test(e.path))if(/\/$/.test(e.path)){const l=e.path.replace(/\/$/,"")+".html";z(t,l)?s(l):s()}else s();else{const l=e.path+"/",r=e.path+".html";z(t,r)?s(r):z(t,l)?s(l):s()}})}(l);const a={};try{await Promise.all(C.filter(t=>"function"==typeof t).map(e=>e({Vue:s.a,options:a,router:l,siteData:k,isServer:t})))}catch(t){console.error(t)}return{app:new s.a(Object.assign(a,{router:l,render:t=>t("div",{attrs:{id:"app"}},[t("RouterView",{ref:"layout"}),t("div",{class:"global-ui"},$.map(e=>t(e)))])})),router:l}}(!1).then(({app:t,router:e})=>{e.onReady(()=>{t.$mount("#app")})})},function(t,e,l){t.exports=l(293)}]]);