(window.webpackJsonp=window.webpackJsonp||[]).push([[2],{0:function(t,e,l){"use strict";l.d(e,"e",(function(){return b})),l.d(e,"d",(function(){return y})),l.d(e,"c",(function(){return k})),l.d(e,"f",(function(){return _})),l.d(e,"a",(function(){return P})),l.d(e,"g",(function(){return w})),l.d(e,"b",(function(){return x})),l.d(e,"h",(function(){return $}));l(64),l(180);var s=l(2),a={Categories:()=>l.e(7).then(l.bind(null,386)),Category:()=>l.e(3).then(l.bind(null,387)),GlobalLayout:()=>Promise.resolve().then(l.bind(null,1)),Home:()=>l.e(6).then(l.bind(null,388)),Layout:()=>l.e(12).then(l.bind(null,383)),NotFound:()=>l.e(9).then(l.bind(null,389)),Page:()=>l.e(13).then(l.bind(null,390)),Post:()=>l.e(10).then(l.bind(null,385)),Posts:()=>l.e(4).then(l.bind(null,391)),Tag:()=>l.e(5).then(l.bind(null,392)),Tags:()=>l.e(8).then(l.bind(null,393))},o={"v-05aa5a72":()=>l.e(14).then(l.bind(null,395)),"v-769abb97":()=>l.e(17).then(l.bind(null,396)),"v-47d11919":()=>l.e(16).then(l.bind(null,397)),"v-5ac843d2":()=>l.e(20).then(l.bind(null,398)),"v-659f2c17":()=>l.e(18).then(l.bind(null,399)),"v-4cf30fb5":()=>l.e(19).then(l.bind(null,400)),"v-4d2c21d2":()=>l.e(21).then(l.bind(null,401)),"v-5406ead7":()=>l.e(23).then(l.bind(null,402)),"v-2ea06bd2":()=>l.e(15).then(l.bind(null,403)),"v-479cd89b":()=>l.e(25).then(l.bind(null,404)),"v-e63a3eca":()=>l.e(22).then(l.bind(null,405)),"v-90b06392":()=>l.e(24).then(l.bind(null,406)),"v-1b2fc321":()=>l.e(28).then(l.bind(null,407)),"v-59dd9667":()=>l.e(26).then(l.bind(null,408)),"v-4f2a1622":()=>l.e(27).then(l.bind(null,409)),"v-451d4ef7":()=>l.e(29).then(l.bind(null,410)),"v-c20a3d3a":()=>l.e(30).then(l.bind(null,411)),"v-6c901c52":()=>l.e(33).then(l.bind(null,412)),"v-727bdcd7":()=>l.e(31).then(l.bind(null,413)),"v-3b2e133e":()=>l.e(34).then(l.bind(null,414)),"v-02b9bb49":()=>l.e(35).then(l.bind(null,415)),"v-82ef379e":()=>l.e(32).then(l.bind(null,416)),"v-5859a1d2":()=>l.e(36).then(l.bind(null,417)),"v-6a2fdcdd":()=>l.e(37).then(l.bind(null,418)),"v-5c8c14ad":()=>l.e(38).then(l.bind(null,419)),"v-4f270427":()=>l.e(41).then(l.bind(null,420)),"v-67bd99b7":()=>l.e(39).then(l.bind(null,421)),"v-a5140402":()=>l.e(42).then(l.bind(null,422)),"v-40322b92":()=>l.e(40).then(l.bind(null,423)),"v-3c1a57b7":()=>l.e(43).then(l.bind(null,424)),"v-67baae1e":()=>l.e(45).then(l.bind(null,425)),"v-66101e52":()=>l.e(44).then(l.bind(null,426)),"v-652145d2":()=>l.e(48).then(l.bind(null,427)),"v-483c3f97":()=>l.e(46).then(l.bind(null,428)),"v-6f067db4":()=>l.e(51).then(l.bind(null,429)),"v-448645d2":()=>l.e(49).then(l.bind(null,430)),"v-fb815392":()=>l.e(50).then(l.bind(null,431)),"v-53b0f14d":()=>l.e(47).then(l.bind(null,432))};function i(t){const e=Object.create(null);return function(l){return e[l]||(e[l]=t(l))}}const r=/-(\w)/g,n=i(t=>t.replace(r,(t,e)=>e?e.toUpperCase():"")),p=/\B([A-Z])/g,u=i(t=>t.replace(p,"-$1").toLowerCase()),c=i(t=>t.charAt(0).toUpperCase()+t.slice(1));function h(t,e){if(!e)return;if(t(e))return t(e);return e.includes("-")?t(c(n(e))):t(c(e))||t(u(e))}const d=Object.assign({},a,o),g=t=>d[t],m=t=>o[t],v=t=>a[t],f=t=>s.a.component(t);function b(t){return h(m,t)}function y(t){return h(v,t)}function k(t){return h(g,t)}function _(t){return h(f,t)}function P(...t){return Promise.all(t.filter(t=>t).map(async t=>{if(!_(t)&&k(t)){const e=await k(t)();s.a.component(t,e.default)}}))}function w(t,e,l){switch(e){case"components":t[e]||(t[e]={}),Object.assign(t[e],l);break;case"mixins":t[e]||(t[e]=[]),t[e].push(...l);break;default:throw new Error("Unknown option name.")}}function x(t,e){for(let l=0;l<t.length;l++){const s=t[l];if(s.key===e)return s}return{path:"",frontmatter:{}}}function $(t,e){"undefined"!=typeof window&&window.__VUEPRESS__&&(window.__VUEPRESS__[t]=e)}},123:function(t,e,l){},135:function(t,e,l){},136:function(t,e,l){},142:function(t,e,l){"use strict";e.a={}},143:function(t,e,l){"use strict";e.a={"æŠ€æœ¯æ–‡ç« ":{path:"/posts/categories/æŠ€æœ¯æ–‡ç« .html",pageKeys:["v-05aa5a72","v-769abb97","v-47d11919","v-5ac843d2","v-659f2c17","v-4cf30fb5","v-4d2c21d2","v-2ea06bd2","v-479cd89b","v-e63a3eca","v-90b06392","v-59dd9667"]},"å·¥å…·æ”¶é›†":{path:"/posts/categories/å·¥å…·æ”¶é›†.html",pageKeys:["v-5406ead7","v-4f2a1622","v-727bdcd7"]},docs:{path:"/posts/categories/docs.html",pageKeys:["v-1b2fc321"]},"å¿ƒæƒ…éšç¬”":{path:"/posts/categories/å¿ƒæƒ…éšç¬”.html",pageKeys:["v-451d4ef7","v-c20a3d3a","v-6c901c52","v-3b2e133e","v-02b9bb49","v-82ef379e","v-5859a1d2","v-6a2fdcdd","v-5c8c14ad","v-4f270427","v-67bd99b7","v-a5140402","v-40322b92","v-3c1a57b7","v-67baae1e","v-66101e52","v-652145d2","v-483c3f97","v-448645d2","v-fb815392","v-53b0f14d"]}}},308:function(t,e,l){},310:function(t,e,l){"use strict";l(123)},321:function(t,e){},353:function(t,e,l){},354:function(t,e,l){"use strict";l(135)},355:function(t,e,l){"use strict";l(136)},356:function(t,e,l){"use strict";l.r(e);var s=l(2),a=l(63);l(148);var o=l(0),i=l(137),r=l.n(i),n=l(138),p=l.n(n),u={created(){if(this.siteMeta=this.$site.headTags.filter(([t])=>"meta"===t).map(([t,e])=>e),this.$ssrContext){const e=this.getMergedMetaTags();this.$ssrContext.title=this.$title,this.$ssrContext.lang=this.$lang,this.$ssrContext.pageMeta=(t=e)?t.map(t=>{let e="<meta";return Object.keys(t).forEach(l=>{e+=` ${l}="${p()(t[l])}"`}),e+">"}).join("\n    "):"",this.$ssrContext.canonicalLink=h(this.$canonicalUrl)}var t},mounted(){this.currentMetaTags=[...document.querySelectorAll("meta")],this.updateMeta(),this.updateCanonicalLink()},methods:{updateMeta(){document.title=this.$title,document.documentElement.lang=this.$lang;const t=this.getMergedMetaTags();this.currentMetaTags=d(t,this.currentMetaTags)},getMergedMetaTags(){const t=this.$page.frontmatter.meta||[];return r()([{name:"description",content:this.$description}],t,this.siteMeta,g)},updateCanonicalLink(){c(),this.$canonicalUrl&&document.head.insertAdjacentHTML("beforeend",h(this.$canonicalUrl))}},watch:{$page(){this.updateMeta(),this.updateCanonicalLink()}},beforeDestroy(){d(null,this.currentMetaTags),c()}};function c(){const t=document.querySelector("link[rel='canonical']");t&&t.remove()}function h(t=""){return t?`<link href="${t}" rel="canonical" />`:""}function d(t,e){if(e&&[...e].filter(t=>t.parentNode===document.head).forEach(t=>document.head.removeChild(t)),t)return t.map(t=>{const e=document.createElement("meta");return Object.keys(t).forEach(l=>{e.setAttribute(l,t[l])}),document.head.appendChild(e),e})}function g(t){for(const e of["name","property","itemprop"])if(t.hasOwnProperty(e))return t[e]+e;return JSON.stringify(t)}var m=l(139),v=l(140),f=l(147),b=[u,m.a,v.a,f.a],y=l(1);Object(o.g)(y.default,"mixins",b);const k=[{name:"v-05aa5a72",path:"/posts/2015/04/23/learn-node.html",component:y.default,beforeEnter:(t,e,l)=>{Object(o.a)("post","v-05aa5a72").then(l)}},{path:"/_posts/2015-04-23-learn-node.html",redirect:"/posts/2015/04/23/learn-node.html"},{name:"v-769abb97",path:"/posts/2015/08/22/linux.html",component:y.default,beforeEnter:(t,e,l)=>{Object(o.a)("post","v-769abb97").then(l)}},{path:"/_posts/2015-08-22-linux.html",redirect:"/posts/2015/08/22/linux.html"},{name:"v-47d11919",path:"/posts/2015/04/29/http.html",component:y.default,beforeEnter:(t,e,l)=>{Object(o.a)("post","v-47d11919").then(l)}},{path:"/_posts/2015-04-29-http.html",redirect:"/posts/2015/04/29/http.html"},{name:"v-5ac843d2",path:"/posts/2016/12/12/promise.html",component:y.default,beforeEnter:(t,e,l)=>{Object(o.a)("post","v-5ac843d2").then(l)}},{path:"/_posts/2016-12-12-promise.html",redirect:"/posts/2016/12/12/promise.html"},{name:"v-659f2c17",path:"/posts/2016/02/20/linux-shell.html",component:y.default,beforeEnter:(t,e,l)=>{Object(o.a)("post","v-659f2c17").then(l)}},{path:"/_posts/2016-02-20-linux-shell.html",redirect:"/posts/2016/02/20/linux-shell.html"},{name:"v-4cf30fb5",path:"/posts/2016/04/29/fe-optimization-guid.html",component:y.default,beforeEnter:(t,e,l)=>{Object(o.a)("post","v-4cf30fb5").then(l)}},{path:"/_posts/2016-04-29-fe-optimization-guid.html",redirect:"/posts/2016/04/29/fe-optimization-guid.html"},{name:"v-4d2c21d2",path:"/posts/2017/06/15/css-summary.html",component:y.default,beforeEnter:(t,e,l)=>{Object(o.a)("post","v-4d2c21d2").then(l)}},{path:"/_posts/2017-06-15-css-summary.html",redirect:"/posts/2017/06/15/css-summary.html"},{name:"v-5406ead7",path:"/posts/2017/12/07/git-sever.html",component:y.default,beforeEnter:(t,e,l)=>{Object(o.a)("post","v-5406ead7").then(l)}},{path:"/_posts/2017-12-07-git-sever.html",redirect:"/posts/2017/12/07/git-sever.html"},{name:"v-2ea06bd2",path:"/posts/2015/04/26/learn-node2.html",component:y.default,beforeEnter:(t,e,l)=>{Object(o.a)("post","v-2ea06bd2").then(l)}},{path:"/_posts/2015-04-23-learn-node2.html",redirect:"/posts/2015/04/26/learn-node2.html"},{name:"v-479cd89b",path:"/posts/2018/06/13/css-block-inline.html",component:y.default,beforeEnter:(t,e,l)=>{Object(o.a)("post","v-479cd89b").then(l)}},{path:"/_posts/2018-06-13-css-block-inline.html",redirect:"/posts/2018/06/13/css-block-inline.html"},{name:"v-e63a3eca",path:"/posts/2017/12/07/git-base.html",component:y.default,beforeEnter:(t,e,l)=>{Object(o.a)("post","v-e63a3eca").then(l)}},{path:"/_posts/2017-12-07-git-base.html",redirect:"/posts/2017/12/07/git-base.html"},{name:"v-90b06392",path:"/posts/2017/12/07/nginx-proxy.html",component:y.default,beforeEnter:(t,e,l)=>{Object(o.a)("post","v-90b06392").then(l)}},{path:"/_posts/2017-12-07-nginx-proxy.html",redirect:"/posts/2017/12/07/nginx-proxy.html"},{name:"v-1b2fc321",path:"/posts/2019/03/23/theme-guide-zh.html",component:y.default,beforeEnter:(t,e,l)=>{Object(o.a)("post","v-1b2fc321").then(l)}},{path:"/_posts/2019-03-23-theme-guide-zh.html",redirect:"/posts/2019/03/23/theme-guide-zh.html"},{name:"v-59dd9667",path:"/posts/2018/07/04/analysis-of-modern-frontend-technology.html",component:y.default,beforeEnter:(t,e,l)=>{Object(o.a)("post","v-59dd9667").then(l)}},{path:"/_posts/2018-07-04-analysis-of-modern-frontEnd-technology.html",redirect:"/posts/2018/07/04/analysis-of-modern-frontend-technology.html"},{name:"v-4f2a1622",path:"/posts/2019/03/13/andorid-studio-hot-map.html",component:y.default,beforeEnter:(t,e,l)=>{Object(o.a)("post","v-4f2a1622").then(l)}},{path:"/_posts/2019-03-13-andorid-studio-hot-map.html",redirect:"/posts/2019/03/13/andorid-studio-hot-map.html"},{name:"v-451d4ef7",path:"/posts/2019/05/01/error-log.html",component:y.default,beforeEnter:(t,e,l)=>{Object(o.a)("post","v-451d4ef7").then(l)}},{path:"/_posts/2019-05-01-error-log.html",redirect:"/posts/2019/05/01/error-log.html"},{name:"v-c20a3d3a",path:"/posts/2019/08/26/regexp-learn.html",component:y.default,beforeEnter:(t,e,l)=>{Object(o.a)("post","v-c20a3d3a").then(l)}},{path:"/_posts/2019-08-26-regexp-learn.html",redirect:"/posts/2019/08/26/regexp-learn.html"},{name:"v-6c901c52",path:"/posts/2020/04/28/learn-css.html",component:y.default,beforeEnter:(t,e,l)=>{Object(o.a)("post","v-6c901c52").then(l)}},{path:"/_posts/2020-04-28-learn-css.html",redirect:"/posts/2020/04/28/learn-css.html"},{name:"v-727bdcd7",path:"/posts/2019/12/24/use-mac.html",component:y.default,beforeEnter:(t,e,l)=>{Object(o.a)("post","v-727bdcd7").then(l)}},{path:"/_posts/2019-12-24-use-mac.html",redirect:"/posts/2019/12/24/use-mac.html"},{name:"v-3b2e133e",path:"/posts/2020/08/12/fe-microservices.html",component:y.default,beforeEnter:(t,e,l)=>{Object(o.a)("post","v-3b2e133e").then(l)}},{path:"/_posts/2020-08-12-fe-microservices.html",redirect:"/posts/2020/08/12/fe-microservices.html"},{name:"v-02b9bb49",path:"/posts/2020/10/09/string.html",component:y.default,beforeEnter:(t,e,l)=>{Object(o.a)("post","v-02b9bb49").then(l)}},{path:"/_posts/2020-10-09-string.html",redirect:"/posts/2020/10/09/string.html"},{name:"v-82ef379e",path:"/posts/2020/02/22/ray-method-polygon.html",component:y.default,beforeEnter:(t,e,l)=>{Object(o.a)("post","v-82ef379e").then(l)}},{path:"/_posts/2020-02-22-ray-method-polygon.html",redirect:"/posts/2020/02/22/ray-method-polygon.html"},{name:"v-5859a1d2",path:"/posts/2020/10/10/chart.html",component:y.default,beforeEnter:(t,e,l)=>{Object(o.a)("post","v-5859a1d2").then(l)}},{path:"/_posts/2020-10-10-chart.html",redirect:"/posts/2020/10/10/chart.html"},{name:"v-6a2fdcdd",path:"/posts/2020/10/11/sort.html",component:y.default,beforeEnter:(t,e,l)=>{Object(o.a)("post","v-6a2fdcdd").then(l)}},{path:"/_posts/2020-10-11-sort.html",redirect:"/posts/2020/10/11/sort.html"},{name:"v-5c8c14ad",path:"/posts/2020/10/13/seek.html",component:y.default,beforeEnter:(t,e,l)=>{Object(o.a)("post","v-5c8c14ad").then(l)}},{path:"/_posts/2020-10-13-seek.html",redirect:"/posts/2020/10/13/seek.html"},{name:"v-4f270427",path:"/posts/2021/03/01/react-senior.html",component:y.default,beforeEnter:(t,e,l)=>{Object(o.a)("post","v-4f270427").then(l)}},{path:"/_posts/2021-02-29-react-senior.html",redirect:"/posts/2021/03/01/react-senior.html"},{name:"v-67bd99b7",path:"/posts/2021/02/02/chrome-plugin.html",component:y.default,beforeEnter:(t,e,l)=>{Object(o.a)("post","v-67bd99b7").then(l)}},{path:"/_posts/2021-02-02-chrome-plugin.html",redirect:"/posts/2021/02/02/chrome-plugin.html"},{name:"v-a5140402",path:"/posts/2021/03/02/vue-basics.html",component:y.default,beforeEnter:(t,e,l)=>{Object(o.a)("post","v-a5140402").then(l)}},{path:"/_posts/2021-03-02-vue-basics.html",redirect:"/posts/2021/03/02/vue-basics.html"},{name:"v-40322b92",path:"/posts/2021/02/26/react-basics.html",component:y.default,beforeEnter:(t,e,l)=>{Object(o.a)("post","v-40322b92").then(l)}},{path:"/_posts/2021-02-26-react-basics.html",redirect:"/posts/2021/02/26/react-basics.html"},{name:"v-3c1a57b7",path:"/posts/2021/03/04/vue-principle.html",component:y.default,beforeEnter:(t,e,l)=>{Object(o.a)("post","v-3c1a57b7").then(l)}},{path:"/_posts/2021-03-04-vue-principle.html",redirect:"/posts/2021/03/04/vue-principle.html"},{name:"v-67baae1e",path:"/posts/2021/03/10/webpack-senior.html",component:y.default,beforeEnter:(t,e,l)=>{Object(o.a)("post","v-67baae1e").then(l)}},{path:"/_posts/2021-03-10-webpack-senior.html",redirect:"/posts/2021/03/10/webpack-senior.html"},{name:"v-66101e52",path:"/posts/2021/03/09/webpack.html",component:y.default,beforeEnter:(t,e,l)=>{Object(o.a)("post","v-66101e52").then(l)}},{path:"/_posts/2021-03-09-webpack.html",redirect:"/posts/2021/03/09/webpack.html"},{name:"v-652145d2",path:"/posts/2021/07/13/font-weight.html",component:y.default,beforeEnter:(t,e,l)=>{Object(o.a)("post","v-652145d2").then(l)}},{path:"/_posts/2021-07-13-font-weight.html",redirect:"/posts/2021/07/13/font-weight.html"},{name:"v-483c3f97",path:"/posts/2021/03/27/webpack-share.html",component:y.default,beforeEnter:(t,e,l)=>{Object(o.a)("post","v-483c3f97").then(l)}},{path:"/_posts/2021-03-27-webpack-share.html",redirect:"/posts/2021/03/27/webpack-share.html"},{name:"v-6f067db4",path:"/custom-pages/",component:y.default,beforeEnter:(t,e,l)=>{Object(o.a)("CustomLayout","v-6f067db4").then(l)}},{path:"/custom-pages/index.html",redirect:"/custom-pages/"},{name:"v-448645d2",path:"/posts/2022/03/10/leetcode-thinking.html",component:y.default,beforeEnter:(t,e,l)=>{Object(o.a)("post","v-448645d2").then(l)}},{path:"/_posts/2022-03-10-leetcode-thinking.html",redirect:"/posts/2022/03/10/leetcode-thinking.html"},{name:"v-fb815392",path:"/posts/2023/03/23/upload-file.html",component:y.default,beforeEnter:(t,e,l)=>{Object(o.a)("post","v-fb815392").then(l)}},{path:"/_posts/2023-03-23-upload-file.html",redirect:"/posts/2023/03/23/upload-file.html"},{name:"v-53b0f14d",path:"/posts/2021/04/03/typescript.html",component:y.default,beforeEnter:(t,e,l)=>{Object(o.a)("post","v-53b0f14d").then(l)}},{path:"/_posts/2021-04-03-typescript.html",redirect:"/posts/2021/04/03/typescript.html"},{name:"v-b2754d56",path:"/",component:y.default,beforeEnter:(t,e,l)=>{Object(o.a)("Home","v-b2754d56").then(l)}},{path:"/index.html",redirect:"/"},{name:"v-1f814451",path:"/posts/",component:y.default,beforeEnter:(t,e,l)=>{Object(o.a)("Posts","v-1f814451").then(l)}},{path:"/posts/index.html",redirect:"/posts/"},{name:"v-03721585",path:"/posts/tags/",component:y.default,beforeEnter:(t,e,l)=>{Object(o.a)("Tags","v-03721585").then(l)}},{path:"/posts/tags/index.html",redirect:"/posts/tags/"},{name:"v-5eb9e6bc",path:"/posts/categories/",component:y.default,beforeEnter:(t,e,l)=>{Object(o.a)("Categories","v-5eb9e6bc").then(l)}},{path:"/posts/categories/index.html",redirect:"/posts/categories/"},{name:"v-1746ab84",path:"/posts/categories/æŠ€æœ¯æ–‡ç« .html",component:y.default,beforeEnter:(t,e,l)=>{Object(o.a)("Category","v-1746ab84").then(l)},meta:{categoryName:"æŠ€æœ¯æ–‡ç« "}},{name:"v-34e2e03f",path:"/posts/categories/å·¥å…·æ”¶é›†.html",component:y.default,beforeEnter:(t,e,l)=>{Object(o.a)("Category","v-34e2e03f").then(l)},meta:{categoryName:"å·¥å…·æ”¶é›†"}},{name:"v-6fe1551c",path:"/posts/categories/docs.html",component:y.default,beforeEnter:(t,e,l)=>{Object(o.a)("Category","v-6fe1551c").then(l)},meta:{categoryName:"docs"}},{name:"v-d262708c",path:"/posts/categories/å¿ƒæƒ…éšç¬”.html",component:y.default,beforeEnter:(t,e,l)=>{Object(o.a)("Category","v-d262708c").then(l)},meta:{categoryName:"å¿ƒæƒ…éšç¬”"}},{path:"*",component:y.default}],_={title:"",description:"This is my blog",base:"/",headTags:[],pages:[{title:"nodejså­¦ä¹ æ—¥è®°1",frontmatter:{layout:"post",title:"nodejså­¦ä¹ æ—¥è®°1",date:"2015-04-23T00:00:00.000Z",excerpt:"learn node diary","vssue-title":"nodejså­¦ä¹ æ—¥è®°1",category:"æŠ€æœ¯æ–‡ç« ",permalink:"/posts/:year/:month/:day/:slug.html"},regularPath:"/_posts/2015-04-23-learn-node.html",relativePath:"_posts/2015-04-23-learn-node.md",key:"v-05aa5a72",path:"/posts/2015/04/23/learn-node.html",headers:[{level:2,title:"REPL(äº¤äº’å¼è§£é‡Šå™¨)",slug:"repl-äº¤äº’å¼è§£é‡Šå™¨"},{level:2,title:"æ§åˆ¶å°",slug:"æ§åˆ¶å°"},{level:2,title:"ç¼“å­˜åŒºBuffer",slug:"ç¼“å­˜åŒºbuffer"},{level:2,title:"æ¨¡å—å’ŒåŒ…",slug:"æ¨¡å—å’ŒåŒ…"},{level:2,title:"å†…ç½®æ¨¡å—",slug:"å†…ç½®æ¨¡å—"},{level:2,title:"äº‹ä»¶",slug:"äº‹ä»¶"}],lastUpdated:"9/2/2020, 2:41:49 PM",lastUpdatedTimestamp:1599028909e3,type:"post",top:!1,tags:[],category:"æŠ€æœ¯æ–‡ç« ",createdAt:"2015-04-23",updatedAt:"2020-09-02"},{title:"linuxå¸¸ç”¨å‘½ä»¤",frontmatter:{layout:"post",title:"linuxå¸¸ç”¨å‘½ä»¤",date:"2015-08-22T00:00:00.000Z",excerpt:"linuxå¸¸ç”¨å‘½ä»¤","vssue-title":"linuxå¸¸ç”¨å‘½ä»¤",category:"æŠ€æœ¯æ–‡ç« ",permalink:"/posts/:year/:month/:day/:slug.html"},regularPath:"/_posts/2015-08-22-linux.html",relativePath:"_posts/2015-08-22-linux.md",key:"v-769abb97",path:"/posts/2015/08/22/linux.html",headers:[{level:2,title:"LinuxåŸºç¡€åŠæ–‡ä»¶",slug:"linuxåŸºç¡€åŠæ–‡ä»¶"},{level:2,title:"linuxå¸¸ç”¨å‘½ä»¤",slug:"linuxå¸¸ç”¨å‘½ä»¤"},{level:3,title:"1. ç›®å½•",slug:"_1-ç›®å½•"},{level:3,title:"2. shell",slug:"_2-shell"},{level:3,title:"3. viç¼–è¾‘å™¨",slug:"_3-viç¼–è¾‘å™¨"},{level:3,title:"4. ç”¨æˆ·å’Œç”¨æˆ·ç»„",slug:"_4-ç”¨æˆ·å’Œç”¨æˆ·ç»„"},{level:3,title:"5. ç”¨æˆ·å‘½ä»¤",slug:"_5-ç”¨æˆ·å‘½ä»¤"},{level:3,title:"6. é™„å½•",slug:"_6-é™„å½•"},{level:3,title:"7 è¿›ç¨‹ç®¡ç†",slug:"_7-è¿›ç¨‹ç®¡ç†"},{level:3,title:"8. ç³»ç»Ÿèµ„æºæŸ¥çœ‹",slug:"_8-ç³»ç»Ÿèµ„æºæŸ¥çœ‹"},{level:3,title:"9. ç³»ç»Ÿå®šæ—¶ä»»åŠ¡",slug:"_9-ç³»ç»Ÿå®šæ—¶ä»»åŠ¡"},{level:3,title:"10. å®æˆ˜ä»»åŠ¡",slug:"_10-å®æˆ˜ä»»åŠ¡"}],lastUpdated:"3/12/2022, 10:53:50 AM",lastUpdatedTimestamp:164705363e4,type:"post",top:!1,tags:[],category:"æŠ€æœ¯æ–‡ç« ",createdAt:"2015-08-22",updatedAt:"2022-03-12"},{title:"HTTPåè®®è¯¦è§£",frontmatter:{layout:"post",title:"HTTPåè®®è¯¦è§£",date:"2015-04-29T00:00:00.000Z",excerpt:"HTTPåè®®è¯¦è§£","vssue-title":"HTTPåè®®è¯¦è§£",category:"æŠ€æœ¯æ–‡ç« ",language:"zh-cn",permalink:"/posts/:year/:month/:day/:slug.html"},regularPath:"/_posts/2015-04-29-http.html",relativePath:"_posts/2015-04-29-http.md",key:"v-47d11919",path:"/posts/2015/04/29/http.html",headers:[{level:2,title:"HTTPåè®®è¯¦è§£",slug:"httpåè®®è¯¦è§£"},{level:3,title:"ä¸€ã€HTTPåè®®è¯¦è§£ä¹‹URL",slug:"ä¸€ã€httpåè®®è¯¦è§£ä¹‹url"},{level:3,title:"äºŒã€HTTPåè®®è¯¦è§£ä¹‹è¯·æ±‚",slug:"äºŒã€httpåè®®è¯¦è§£ä¹‹è¯·æ±‚"},{level:3,title:"ä¸‰ã€HTTPåè®®è¯¦è§£ä¹‹å“åº”",slug:"ä¸‰ã€httpåè®®è¯¦è§£ä¹‹å“åº”"},{level:3,title:"å››ã€HTTPåè®®è¯¦è§£ä¹‹æ¶ˆæ¯æŠ¥å¤´",slug:"å››ã€httpåè®®è¯¦è§£ä¹‹æ¶ˆæ¯æŠ¥å¤´"},{level:3,title:"äº”ã€åˆ©ç”¨telnetè§‚å¯Ÿhttpåè®®çš„é€šè®¯è¿‡ç¨‹",slug:"äº”ã€åˆ©ç”¨telnetè§‚å¯Ÿhttpåè®®çš„é€šè®¯è¿‡ç¨‹"},{level:3,title:"å…­ã€HTTPåè®®ç›¸å…³æŠ€æœ¯è¡¥å……",slug:"å…­ã€httpåè®®ç›¸å…³æŠ€æœ¯è¡¥å……"}],lastUpdated:"12/11/2021, 11:36:53 AM",lastUpdatedTimestamp:1639193813e3,type:"post",top:!1,tags:[],category:"æŠ€æœ¯æ–‡ç« ",createdAt:"2015-04-29",updatedAt:"2021-12-11"},{title:"promiseå‡½æ•°",frontmatter:{layout:"post",title:"promiseå‡½æ•°",date:"2016-12-12T00:00:00.000Z",excerpt:"promiseå‡½æ•°","vssue-title":"promiseå‡½æ•°",category:"æŠ€æœ¯æ–‡ç« ",permalink:"/posts/:year/:month/:day/:slug.html"},regularPath:"/_posts/2016-12-12-promise.html",relativePath:"_posts/2016-12-12-promise.md",key:"v-5ac843d2",path:"/posts/2016/12/12/promise.html",headers:[{level:2,title:"promsieåŸç†",slug:"promsieåŸç†"},{level:3,title:"promiseç®€æ˜“å®ç°",slug:"promiseç®€æ˜“å®ç°"},{level:3,title:"åŠ å…¥å‘å¸ƒè®¢é˜…æ¨¡å¼",slug:"åŠ å…¥å‘å¸ƒè®¢é˜…æ¨¡å¼"},{level:3,title:"æ·»åŠ catch",slug:"æ·»åŠ catch"},{level:3,title:"all",slug:"all"},{level:3,title:"race",slug:"race"},{level:3,title:"finally",slug:"finally"},{level:2,title:"promiseå‡½æ•°",slug:"promiseå‡½æ•°"}],lastUpdated:"10/31/2021, 2:35:47 PM",lastUpdatedTimestamp:1635662147e3,type:"post",top:!1,tags:[],category:"æŠ€æœ¯æ–‡ç« ",createdAt:"2016-12-12",updatedAt:"2021-10-31"},{title:"shellåŸºç¡€çŸ¥è¯†",frontmatter:{layout:"post",title:"shellåŸºç¡€çŸ¥è¯†",date:"2016-02-20T00:00:00.000Z",excerpt:"shellåŸºç¡€çŸ¥è¯†","vssue-title":"shellåŸºç¡€çŸ¥è¯†",category:"æŠ€æœ¯æ–‡ç« ",permalink:"/posts/:year/:month/:day/:slug.html"},regularPath:"/_posts/2016-02-20-linux-shell.html",relativePath:"_posts/2016-02-20-linux-shell.md",key:"v-659f2c17",path:"/posts/2016/02/20/linux-shell.html",headers:[{level:2,title:"shellç›¸å…³çŸ¥è¯†",slug:"shellç›¸å…³çŸ¥è¯†"},{level:3,title:"1. shellåŸºç¡€",slug:"_1-shellåŸºç¡€"},{level:3,title:"2. å˜é‡",slug:"_2-å˜é‡"},{level:3,title:"3. è¿ç®—ç¬¦",slug:"_3-è¿ç®—ç¬¦"},{level:3,title:"4. ç¯å¢ƒå˜é‡é…ç½®æ–‡ä»¶",slug:"_4-ç¯å¢ƒå˜é‡é…ç½®æ–‡ä»¶"},{level:3,title:"4.æ­£åˆ™è¡¨è¾¾å¼",slug:"_4-æ­£åˆ™è¡¨è¾¾å¼"},{level:3,title:"5. æµç¨‹æ§åˆ¶",slug:"_5-æµç¨‹æ§åˆ¶"},{level:3,title:"6. å‡½æ•°",slug:"_6-å‡½æ•°"},{level:3,title:"7.shellå®æˆ˜",slug:"_7-shellå®æˆ˜"}],lastUpdated:"7/9/2022, 6:46:23 PM",lastUpdatedTimestamp:1657363583e3,type:"post",top:!1,tags:[],category:"æŠ€æœ¯æ–‡ç« ",createdAt:"2016-02-20",updatedAt:"2022-07-09"},{title:"å‰ç«¯ä¼˜åŒ–æŒ‡å—",frontmatter:{layout:"post",title:"å‰ç«¯ä¼˜åŒ–æŒ‡å—",date:"2016-04-29T00:00:00.000Z",excerpt:"å‰ç«¯æ€§èƒ½ä¼˜åŒ–å®è·µ","vssue-title":"å‰ç«¯æ€§èƒ½ä¼˜åŒ–å®è·µ",category:"æŠ€æœ¯æ–‡ç« ",permalink:"/posts/:year/:month/:day/:slug.html"},regularPath:"/_posts/2016-04-29-fe-optimization-guid.html",relativePath:"_posts/2016-04-29-fe-optimization-guid.md",key:"v-4cf30fb5",path:"/posts/2016/04/29/fe-optimization-guid.html",headers:[{level:2,title:"å‚è€ƒæ–‡ç« ",slug:"å‚è€ƒæ–‡ç« "},{level:2,title:"ç›®å½•ï¼š",slug:"ç›®å½•"},{level:2,title:"é¡µé¢å†…å®¹",slug:"é¡µé¢å†…å®¹"},{level:2,title:"æœåŠ¡å™¨",slug:"æœåŠ¡å™¨"},{level:2,title:"Cookie",slug:"cookie"},{level:2,title:"CSS",slug:"css"},{level:2,title:"JavaScript",slug:"javascript"},{level:2,title:"å›¾ç‰‡",slug:"å›¾ç‰‡"},{level:2,title:"ç§»åŠ¨ç«¯",slug:"ç§»åŠ¨ç«¯"}],lastUpdated:"12/12/2021, 9:52:07 PM",lastUpdatedTimestamp:1639317127e3,type:"post",top:!1,tags:[],category:"æŠ€æœ¯æ–‡ç« ",createdAt:"2016-04-29",updatedAt:"2021-12-12"},{title:"cssé‡åˆ°é—®é¢˜",frontmatter:{layout:"post",title:"cssé‡åˆ°é—®é¢˜",date:"2017-06-15T00:00:00.000Z",excerpt:"å¸¸è§çš„é—®é¢˜","vssue-title":"csså¸¸è§çš„é—®é¢˜",category:"æŠ€æœ¯æ–‡ç« ",permalink:"/posts/:year/:month/:day/:slug.html"},regularPath:"/_posts/2017-06-15-css-summary.html",relativePath:"_posts/2017-06-15-css-summary.md",key:"v-4d2c21d2",path:"/posts/2017/06/15/css-summary.html",headers:[{level:2,title:"é™æ€é¡µé¢å¸¸è§é—®é¢˜æ±‡æ€»",slug:"é™æ€é¡µé¢å¸¸è§é—®é¢˜æ±‡æ€»"},{level:3,title:"æ˜¾ç¤ºçœç•¥å·(â€¦)",slug:"æ˜¾ç¤ºçœç•¥å·"},{level:3,title:"imgé‡åˆ°é—®é¢˜",slug:"imgé‡åˆ°é—®é¢˜"},{level:3,title:"csså­—ä½“æ¸å˜è‰²",slug:"csså­—ä½“æ¸å˜è‰²"},{level:3,title:"pcç«¯å¸¸è§é—®é¢˜",slug:"pcç«¯å¸¸è§é—®é¢˜"}],lastUpdated:"11/25/2021, 10:55:13 AM",lastUpdatedTimestamp:1637808913e3,type:"post",top:!1,tags:[],category:"æŠ€æœ¯æ–‡ç« ",createdAt:"2017-06-15",updatedAt:"2021-11-25"},{title:"Building a git server",frontmatter:{layout:"post",title:"Building a git server",date:"2017-12-07T00:00:00.000Z",excerpt:"Building a git server","vssue-title":"åˆ›å»ºgitæœåŠ¡å™¨",category:"å·¥å…·æ”¶é›†",permalink:"/posts/:year/:month/:day/:slug.html"},regularPath:"/_posts/2017-12-07-git-sever.html",relativePath:"_posts/2017-12-07-git-sever.md",key:"v-5406ead7",path:"/posts/2017/12/07/git-sever.html",headers:[{level:2,title:"åˆ›å»ºgitæœåŠ¡å™¨",slug:"åˆ›å»ºgitæœåŠ¡å™¨"}],lastUpdated:"6/26/2019, 9:26:03 PM",lastUpdatedTimestamp:1561555563e3,type:"post",top:!1,tags:[],category:"å·¥å…·æ”¶é›†",createdAt:"2017-12-07",updatedAt:"2019-06-26"},{title:"nodejså­¦ä¹ æ—¥è®°2",frontmatter:{layout:"post",title:"nodejså­¦ä¹ æ—¥è®°2",date:"2015-04-26T00:00:00.000Z",excerpt:"learn node diary2","vssue-title":"nodejså­¦ä¹ æ—¥è®°2",category:"æŠ€æœ¯æ–‡ç« ",permalink:"/posts/:year/:month/:day/:slug.html"},regularPath:"/_posts/2015-04-23-learn-node2.html",relativePath:"_posts/2015-04-23-learn-node2.md",key:"v-2ea06bd2",path:"/posts/2015/04/26/learn-node2.html",headers:[{level:2,title:"nextTick",slug:"nexttick"},{level:2,title:"æ¨¡å—",slug:"æ¨¡å—"},{level:2,title:"buffer å¯¹è±¡è¿›è¡ŒäºŒè¿›åˆ¶æ•°æ®å¤„ç†",slug:"buffer-å¯¹è±¡è¿›è¡ŒäºŒè¿›åˆ¶æ•°æ®å¤„ç†"},{level:2,title:"fsæ¨¡å—ä¸­å‡ ç§æµçš„è¯»å†™æ–¹æ³•çš„åŒºåˆ«",slug:"fsæ¨¡å—ä¸­å‡ ç§æµçš„è¯»å†™æ–¹æ³•çš„åŒºåˆ«"},{level:2,title:"stram",slug:"stram"},{level:2,title:"ä¸­é—´ä»¶",slug:"ä¸­é—´ä»¶"},{level:2,title:"cookie",slug:"cookie"},{level:2,title:"referer",slug:"referer"},{level:2,title:"etag",slug:"etag"},{level:2,title:"æµè§ˆå™¨å¦‚ä½•ä¸å‘è¯·æ±‚",slug:"æµè§ˆå™¨å¦‚ä½•ä¸å‘è¯·æ±‚"},{level:2,title:"authorization",slug:"authorization"}],lastUpdated:"9/2/2020, 2:41:49 PM",lastUpdatedTimestamp:1599028909e3,type:"post",top:!1,tags:[],category:"æŠ€æœ¯æ–‡ç« ",createdAt:"2015-04-26",updatedAt:"2020-09-02"},{title:"csså—å…ƒç´ å’Œè¡Œå†…å…ƒç´ ",frontmatter:{layout:"post",title:"csså—å…ƒç´ å’Œè¡Œå†…å…ƒç´ ",date:"2018-06-13T00:00:00.000Z",excerpt:"csså—å…ƒç´ å’Œè¡Œå†…å…ƒç´ ","vssue-title":"csså—å…ƒç´ å’Œè¡Œå†…å…ƒç´ ",category:"æŠ€æœ¯æ–‡ç« ",permalink:"/posts/:year/:month/:day/:slug.html"},regularPath:"/_posts/2018-06-13-css-block-inline.html",relativePath:"_posts/2018-06-13-css-block-inline.md",key:"v-479cd89b",path:"/posts/2018/06/13/css-block-inline.html",headers:[{level:2,title:"csså—å…ƒç´ å’Œè¡Œå†…å…ƒç´ ",slug:"csså—å…ƒç´ å’Œè¡Œå†…å…ƒç´ "},{level:3,title:"å—å…ƒç´ çš„ç‰¹ç‚¹",slug:"å—å…ƒç´ çš„ç‰¹ç‚¹"},{level:3,title:"è¡Œå†…å…ƒç´ çš„ç‰¹ç‚¹",slug:"è¡Œå†…å…ƒç´ çš„ç‰¹ç‚¹"},{level:3,title:"è¡Œå†…å—å…ƒç´ ï¼ˆinline-blockï¼‰",slug:"è¡Œå†…å—å…ƒç´ -inline-block"},{level:3,title:"BFCå¸ƒå±€",slug:"bfcå¸ƒå±€"},{level:3,title:"IFCå¸ƒå±€è§„åˆ™",slug:"ifcå¸ƒå±€è§„åˆ™"}],lastUpdated:"11/25/2021, 11:01:16 AM",lastUpdatedTimestamp:1637809276e3,type:"post",top:!1,tags:[],category:"æŠ€æœ¯æ–‡ç« ",createdAt:"2018-06-13",updatedAt:"2021-11-25"},{title:"gitç›¸å…³çš„ä¸€äº›åŸºç¡€æ“ä½œ",frontmatter:{layout:"post",title:"gitç›¸å…³çš„ä¸€äº›åŸºç¡€æ“ä½œ",date:"2017-12-07T00:00:00.000Z",excerpt:"gitç›¸å…³çš„ä¸€äº›åŸºç¡€æ“ä½œ","vssue-title":"gitç›¸å…³çš„ä¸€äº›åŸºç¡€æ“ä½œ",category:"æŠ€æœ¯æ–‡ç« ",permalink:"/posts/:year/:month/:day/:slug.html"},regularPath:"/_posts/2017-12-07-git-base.html",relativePath:"_posts/2017-12-07-git-base.md",key:"v-e63a3eca",path:"/posts/2017/12/07/git-base.html",headers:[{level:2,title:"gitåŸºç¡€çŸ¥è¯†",slug:"gitåŸºç¡€çŸ¥è¯†"},{level:3,title:"åˆå§‹åŒ–é…ç½®",slug:"åˆå§‹åŒ–é…ç½®"},{level:3,title:"æ–‡ä»¶æ“ä½œ",slug:"æ–‡ä»¶æ“ä½œ"},{level:3,title:"æŸ¥çœ‹æ–‡ä»¶diff",slug:"æŸ¥çœ‹æ–‡ä»¶diff"},{level:3,title:"æŸ¥çœ‹æäº¤è®°å½•",slug:"æŸ¥çœ‹æäº¤è®°å½•"},{level:3,title:"å–å¾—Gitä»“åº“",slug:"å–å¾—gitä»“åº“"},{level:3,title:"æäº¤ä½ çš„ä¿®æ”¹",slug:"æäº¤ä½ çš„ä¿®æ”¹"},{level:3,title:"åˆ†æ”¯æ“ä½œ",slug:"åˆ†æ”¯æ“ä½œ"},{level:3,title:"åˆ†æ”¯åˆå¹¶å’Œrebase",slug:"åˆ†æ”¯åˆå¹¶å’Œrebase"},{level:3,title:"Gitè¡¥ä¸ç®¡ç†(æ–¹ä¾¿åœ¨å¤šå°æœºå™¨ä¸Šå¼€å‘åŒæ­¥æ—¶ç”¨)",slug:"gitè¡¥ä¸ç®¡ç†-æ–¹ä¾¿åœ¨å¤šå°æœºå™¨ä¸Šå¼€å‘åŒæ­¥æ—¶ç”¨"},{level:3,title:"Gitè¿œç¨‹åˆ†æ”¯ç®¡ç†",slug:"gitè¿œç¨‹åˆ†æ”¯ç®¡ç†"},{level:3,title:"åŸºæœ¬çš„åˆ†æ”¯ç®¡ç†",slug:"åŸºæœ¬çš„åˆ†æ”¯ç®¡ç†"},{level:3,title:"Gitè¿œç¨‹ä»“åº“ç®¡ç†",slug:"gitè¿œç¨‹ä»“åº“ç®¡ç†"},{level:3,title:"ç¬¬ä¸€æ¬¡ä»£ç æäº¤",slug:"ç¬¬ä¸€æ¬¡ä»£ç æäº¤"},{level:3,title:"ssh key é…ç½®",slug:"ssh-key-é…ç½®"},{level:3,title:"è§£å†³gitå†²çª",slug:"è§£å†³gitå†²çª"},{level:3,title:"githubé‡åˆ°é—®é¢˜",slug:"githubé‡åˆ°é—®é¢˜"},{level:3,title:"gitæœåŠ¡å™¨ç¦æ­¢ç”¨æˆ·shellç™»å½•",slug:"gitæœåŠ¡å™¨ç¦æ­¢ç”¨æˆ·shellç™»å½•"}],lastUpdated:"9/27/2022, 5:51:47 PM",lastUpdatedTimestamp:1664272307e3,type:"post",top:!1,tags:[],category:"æŠ€æœ¯æ–‡ç« ",createdAt:"2017-12-07",updatedAt:"2022-09-27"},{title:"Nginxç›¸å…³çŸ¥è¯†",frontmatter:{layout:"post",title:"Nginxç›¸å…³çŸ¥è¯†",date:"2017-12-07T00:00:00.000Z",excerpt:"Nginx reverse proxy",content:"Nginxç›¸å…³çŸ¥è¯†","vssue-title":"nginxåå‘ä»£ç†",category:"æŠ€æœ¯æ–‡ç« ",permalink:"/posts/:year/:month/:day/:slug.html"},regularPath:"/_posts/2017-12-07-nginx-proxy.html",relativePath:"_posts/2017-12-07-nginx-proxy.md",key:"v-90b06392",path:"/posts/2017/12/07/nginx-proxy.html",headers:[{level:2,title:"nginxç›¸å…³çŸ¥è¯†",slug:"nginxç›¸å…³çŸ¥è¯†"},{level:3,title:"ç³»ç»Ÿ",slug:"ç³»ç»Ÿ"},{level:3,title:"é…ç½®æ–‡ä»¶åŠç”¨é€”",slug:"é…ç½®æ–‡ä»¶åŠç”¨é€”"},{level:3,title:"nginxå†…å®¹é…ç½®",slug:"nginxå†…å®¹é…ç½®"},{level:3,title:"æ ¸å¿ƒæ¨¡å—",slug:"æ ¸å¿ƒæ¨¡å—"},{level:3,title:"é™æ€èµ„æºWebæœåŠ¡",slug:"é™æ€èµ„æºwebæœåŠ¡"},{level:3,title:"æµè§ˆå™¨ç¼“å­˜",slug:"æµè§ˆå™¨ç¼“å­˜"},{level:3,title:"è·¨åŸŸ",slug:"è·¨åŸŸ"},{level:3,title:"é˜²ç›—é“¾",slug:"é˜²ç›—é“¾"},{level:3,title:"ä»£ç†æœåŠ¡",slug:"ä»£ç†æœåŠ¡"},{level:3,title:"è´Ÿè½½å‡è¡¡",slug:"è´Ÿè½½å‡è¡¡"},{level:3,title:"ç¼“å­˜",slug:"ç¼“å­˜"},{level:3,title:"rewrite",slug:"rewrite"}],lastUpdated:"7/9/2022, 6:46:23 PM",lastUpdatedTimestamp:1657363583e3,type:"post",top:!1,tags:[],category:"æŠ€æœ¯æ–‡ç« ",createdAt:"2017-12-07",updatedAt:"2022-07-09"},{title:"ä¸»é¢˜ä½¿ç”¨æŒ‡å—",frontmatter:{top:1,layout:"post",category:"docs",date:"2019-03-23T00:00:00.000Z",title:"ä¸»é¢˜ä½¿ç”¨æŒ‡å—",lang:"zh-CN",permalink:"/posts/:year/:month/:day/:slug.html"},regularPath:"/_posts/2019-03-23-theme-guide-zh.html",relativePath:"_posts/2019-03-23-theme-guide-zh.md",key:"v-1b2fc321",path:"/posts/2019/03/23/theme-guide-zh.html",headers:[{level:2,title:"å¼€å§‹ä½¿ç”¨",slug:"å¼€å§‹ä½¿ç”¨"},{level:3,title:"å®‰è£…ä¸»é¢˜",slug:"å®‰è£…ä¸»é¢˜"},{level:3,title:"é…ç½®ä¸»é¢˜",slug:"é…ç½®ä¸»é¢˜"},{level:3,title:"å¼€å§‹å†™åšå®¢",slug:"å¼€å§‹å†™åšå®¢"},{level:2,title:"ä¸»é¢˜è¯­è¨€",slug:"ä¸»é¢˜è¯­è¨€"},{level:3,title:"å¼•å…¥é¢„è®¾çš„è¯­è¨€åŒ…",slug:"å¼•å…¥é¢„è®¾çš„è¯­è¨€åŒ…"},{level:3,title:"ç¿»è¯‘æˆä½ è‡ªå·±çš„è¯­è¨€",slug:"ç¿»è¯‘æˆä½ è‡ªå·±çš„è¯­è¨€"},{level:3,title:"è¦†ç›–è¯­è¨€åŒ…çš„æŸäº›ç¿»è¯‘",slug:"è¦†ç›–è¯­è¨€åŒ…çš„æŸäº›ç¿»è¯‘"},{level:2,title:"é¡µé¢è¯„è®º",slug:"é¡µé¢è¯„è®º"},{level:3,title:"é…ç½®è¯„è®ºåŠŸèƒ½",slug:"é…ç½®è¯„è®ºåŠŸèƒ½"},{level:3,title:"é’ˆå¯¹æ¯ç¯‡åšæ–‡å•ç‹¬é…ç½®",slug:"é’ˆå¯¹æ¯ç¯‡åšæ–‡å•ç‹¬é…ç½®"},{level:3,title:"ç¦ç”¨è¯„è®ºåŠŸèƒ½",slug:"ç¦ç”¨è¯„è®ºåŠŸèƒ½"},{level:2,title:"é…ç½®å‚è€ƒ",slug:"é…ç½®å‚è€ƒ"},{level:3,title:"æ ·å¼å˜é‡",slug:"æ ·å¼å˜é‡"},{level:3,title:"Frontmatter",slug:"frontmatter"}],excerpt:'<p><code>vuepress-theme-glitzma</code> ä¸»é¢˜ä½¿ç”¨æŒ‡å—</p>\n<p><img src="https://img.shields.io/npm/v/vuepress-theme-glitzma/latest.svg?style=flat" alt="">\n<img src="https://img.shields.io/npm/v/vuepress-theme-glitzma/next.svg?style=flat" alt="">\n<img src="https://img.shields.io/github/license/glitzma/vuepress-theme-glitzma.svg?style=flat" alt=""></p>\n',lastUpdated:"2021/12/2 10:35:16",lastUpdatedTimestamp:1638412516e3,type:"post",top:1,tags:[],category:"docs",createdAt:"2019-03-23",updatedAt:"2021-12-02"},{title:"ç°åœ¨å‰ç«¯æŠ€æœ¯è§£æè¯»åæ„Ÿ",frontmatter:{layout:"post",title:"ç°åœ¨å‰ç«¯æŠ€æœ¯è§£æè¯»åæ„Ÿ",date:"2018-07-04T00:00:00.000Z",excerpt:"ç°åœ¨å‰ç«¯æŠ€æœ¯è§£æè¯»åæ„Ÿ","vssue-title":"ç°åœ¨å‰ç«¯æŠ€æœ¯è§£æè¯»åæ„Ÿ",category:"æŠ€æœ¯æ–‡ç« ",permalink:"/posts/:year/:month/:day/:slug.html"},regularPath:"/_posts/2018-07-04-analysis-of-modern-frontEnd-technology.html",relativePath:"_posts/2018-07-04-analysis-of-modern-frontEnd-technology.md",key:"v-59dd9667",path:"/posts/2018/07/04/analysis-of-modern-frontend-technology.html",headers:[{level:2,title:"ç®€ä»‹",slug:"ç®€ä»‹"},{level:2,title:"ç¬¬ä¸€ç« ",slug:"ç¬¬ä¸€ç« "},{level:3,title:"1.1ã€MVC",slug:"_1-1ã€mvc"},{level:3,title:"1.2 MVP",slug:"_1-2-mvp"},{level:3,title:"1.3 MVVM æ¨¡å¼",slug:"_1-3-mvvm-æ¨¡å¼"},{level:3,title:"1.3.1 æ•°æ®å˜æ›´æ£€æµ‹ç¤ºä¾‹",slug:"_1-3-1-æ•°æ®å˜æ›´æ£€æµ‹ç¤ºä¾‹"},{level:3,title:"1.3.2 è„æ£€æµ‹æœºåˆ¶",slug:"_1-3-2-è„æ£€æµ‹æœºåˆ¶"},{level:3,title:"1.3.3 å‰ç«¯æ•°æ®å¯¹è±¡åŠ«æŒ(Hijacking)",slug:"_1-3-3-å‰ç«¯æ•°æ®å¯¹è±¡åŠ«æŒ-hijacking"},{level:3,title:"1.3.4 ECMAScript 6 Proxy",slug:"_1-3-4-ecmascript-6-proxy"},{level:2,title:"1.4 Virtual DOM äº¤äº’æ¨¡å¼",slug:"_1-4-virtual-dom-äº¤äº’æ¨¡å¼"},{level:3,title:"1.4.1 Virtual DOMè®¾è®¡ç†å¿µ",slug:"_1-4-1-virtual-domè®¾è®¡ç†å¿µ"},{level:3,title:"1.4.2 Virtual DOMçš„æ ¸å¿ƒå®ç°",slug:"_1-4-2-virtual-domçš„æ ¸å¿ƒå®ç°"},{level:2,title:"1.5 MNV*æ¨¡å¼",slug:"_1-5-mnv-æ¨¡å¼"},{level:2,title:"åˆ°è¿™é‡Œç¬¬ä¸€ä¸ªè¯é¢˜ç»ˆäºè¯´å®Œäº†",slug:"åˆ°è¿™é‡Œç¬¬ä¸€ä¸ªè¯é¢˜ç»ˆäºè¯´å®Œäº†"},{level:2,title:"ä¸‹é¢è¨€å½’æ­£ä¼ ",slug:"ä¸‹é¢è¨€å½’æ­£ä¼ "},{level:2,title:"2 æµè§ˆå™¨åŸºç¡€åº”ç”¨",slug:"_2-æµè§ˆå™¨åŸºç¡€åº”ç”¨"}],lastUpdated:"6/26/2019, 9:26:03 PM",lastUpdatedTimestamp:1561555563e3,type:"post",top:!1,tags:[],category:"æŠ€æœ¯æ–‡ç« ",createdAt:"2018-07-04",updatedAt:"2019-06-26"},{title:"android studio å¿«æ·é”®",frontmatter:{layout:"post",title:"android studio å¿«æ·é”®",date:"2019-03-13T00:00:00.000Z",excerpt:"android studio å¿«æ·é”®çš„ä½¿ç”¨","vssue-title":"android studio å¿«æ·é”®çš„ä½¿ç”¨",category:"å·¥å…·æ”¶é›†",permalink:"/posts/:year/:month/:day/:slug.html"},regularPath:"/_posts/2019-03-13-andorid-studio-hot-map.html",relativePath:"_posts/2019-03-13-andorid-studio-hot-map.md",key:"v-4f2a1622",path:"/posts/2019/03/13/andorid-studio-hot-map.html",headers:[{level:3,title:'å¦‚ä½•æŸ¥çœ‹ "Tip of the Day"',slug:"å¦‚ä½•æŸ¥çœ‹-tip-of-the-day"},{level:3,title:"å¿«é€Ÿæ‰“å¼€ä»»ä½•class",slug:"å¿«é€Ÿæ‰“å¼€ä»»ä½•class"},{level:3,title:"å¦‚ä½•å¿«é€Ÿè¡¥å…¨a class name",slug:"å¦‚ä½•å¿«é€Ÿè¡¥å…¨a-class-name"},{level:3,title:"å¿«é€Ÿå®šä½",slug:"å¿«é€Ÿå®šä½"},{level:3,title:"åœ¨æ’å…¥ç¬¦å·å¤„å¿«é€ŸæŸ¥çœ‹ç±»æˆ–æ–¹æ³•",slug:"åœ¨æ’å…¥ç¬¦å·å¤„å¿«é€ŸæŸ¥çœ‹ç±»æˆ–æ–¹æ³•"},{level:3,title:"è·³è½¬åˆ°å£°æ˜ç±»",slug:"è·³è½¬åˆ°å£°æ˜ç±»"},{level:3,title:"æ–¹ä¾¿çš„åœ¨åˆ—è¡¨ä¸­æ‰¾åˆ°é¡¹ç›®",slug:"æ–¹ä¾¿çš„åœ¨åˆ—è¡¨ä¸­æ‰¾åˆ°é¡¹ç›®"},{level:3,title:"å¿«é€Ÿé‡å‘½åç±»ã€æ–¹æ³•ã€å˜é‡ï¼Œå¹¶è‡ªåŠ¨æ›´æ­£æ‰€æœ‰ä½¿ç”¨å®ƒçš„ä½ç½®",slug:"å¿«é€Ÿé‡å‘½åç±»ã€æ–¹æ³•ã€å˜é‡-å¹¶è‡ªåŠ¨æ›´æ­£æ‰€æœ‰ä½¿ç”¨å®ƒçš„ä½ç½®"},{level:3,title:"è½»æ¾é‡å†™åŸºç±»çš„æ–¹æ³•",slug:"è½»æ¾é‡å†™åŸºç±»çš„æ–¹æ³•"},{level:3,title:"æŸ¥æ‰¾é€‚åˆä¸Šä¸‹æ–‡çš„æ–¹æ³•å’Œå˜é‡",slug:"æŸ¥æ‰¾é€‚åˆä¸Šä¸‹æ–‡çš„æ–¹æ³•å’Œå˜é‡"},{level:3,title:"é€‰æ‹©æç¤ºå˜é‡åå¹¶æ›¿æ¢æ‰",slug:"é€‰æ‹©æç¤ºå˜é‡åå¹¶æ›¿æ¢æ‰"},{level:3,title:"å…³é—­ç¼–è¾‘å™¨å’Œå·¥å…·çª—å£ä¸­é€‰é¡¹å¡",slug:"å…³é—­ç¼–è¾‘å™¨å’Œå·¥å…·çª—å£ä¸­é€‰é¡¹å¡"},{level:3,title:"ä¸ºç±»æ·»åŠ getterå’Œsetteræ–¹æ³•",slug:"ä¸ºç±»æ·»åŠ getterå’Œsetteræ–¹æ³•"},{level:3,title:"å¿«é€Ÿé€‰æ‹©å½“å‰ç¼–è¾‘å…ƒç´ ï¼ˆclass,file,method or fieldï¼‰",slug:"å¿«é€Ÿé€‰æ‹©å½“å‰ç¼–è¾‘å…ƒç´ -class-file-method-or-field"},{level:3,title:"å°†ç„¦ç‚¹å®šä½åˆ°ç¼–è¾‘å™¨",slug:"å°†ç„¦ç‚¹å®šä½åˆ°ç¼–è¾‘å™¨"},{level:3,title:"è‡ªåŠ¨ç”Ÿæˆä»£ç ç¯ç»•",slug:"è‡ªåŠ¨ç”Ÿæˆä»£ç ç¯ç»•"},{level:3,title:"newå…³é”®å­—æç¤º å®ç°",slug:"newå…³é”®å­—æç¤º-å®ç°"},{level:3,title:"å¯¼èˆªåˆ°æŠ½è±¡æ–¹æ³•çš„å®ç°å¤„",slug:"å¯¼èˆªåˆ°æŠ½è±¡æ–¹æ³•çš„å®ç°å¤„"},{level:3,title:"åœ¨ç¼–è¾‘å™¨é€šè¿‡å•è¯é€‰ä¸­æ‰©å±•åŒºåŸŸ",slug:"åœ¨ç¼–è¾‘å™¨é€šè¿‡å•è¯é€‰ä¸­æ‰©å±•åŒºåŸŸ"},{level:3,title:"é€‰ä¸­ä»£ç ä¸­çš„è¡¨è¾¾å¼",slug:"é€‰ä¸­ä»£ç ä¸­çš„è¡¨è¾¾å¼"},{level:3,title:"æ³¨é‡Šçš„å¿«æ·é”®",slug:"æ³¨é‡Šçš„å¿«æ·é”®"},{level:3,title:"åœ¨ç¼–è¾‘å™¨ä¸­æ‰“å¼€æ–‡æ¡£ä¸­çš„å¤–éƒ¨å…ƒç´ ",slug:"åœ¨ç¼–è¾‘å™¨ä¸­æ‰“å¼€æ–‡æ¡£ä¸­çš„å¤–éƒ¨å…ƒç´ "},{level:3,title:"å¤åˆ¶å½“å‰è¡Œ",slug:"å¤åˆ¶å½“å‰è¡Œ"},{level:3,title:"å®æ—¶æ¨¡æ¿",slug:"å®æ—¶æ¨¡æ¿"},{level:3,title:"è‡ªåŠ¨è¡¥å…¨ä»£ç çš„ï¼ˆä»£ç æ¨¡æ¿ï¼‰",slug:"è‡ªåŠ¨è¡¥å…¨ä»£ç çš„-ä»£ç æ¨¡æ¿"},{level:3,title:"æŸ¥çœ‹æœ‰æ•ˆå‚æ•°æ¸…å•",slug:"æŸ¥çœ‹æœ‰æ•ˆå‚æ•°æ¸…å•"},{level:3,title:"å¯¼èˆªåˆ°æœ€åä¸€æ¬¡ç¼–è¾‘ä½ç½®",slug:"å¯¼èˆªåˆ°æœ€åä¸€æ¬¡ç¼–è¾‘ä½ç½®"},{level:3,title:"æŸ¥æ‰¾ ä¸ å–æ¶ˆæŸ¥æ‰¾",slug:"æŸ¥æ‰¾-ä¸-å–æ¶ˆæŸ¥æ‰¾"},{level:3,title:"æ ¼å¼åŒ–ä»£ç ",slug:"æ ¼å¼åŒ–ä»£ç "},{level:3,title:"æŸ¥çœ‹å†å²è®°å½•æ¢å¤ä»£ç ",slug:"æŸ¥çœ‹å†å²è®°å½•æ¢å¤ä»£ç "},{level:3,title:"æŸ¥çœ‹æ–¹æ³•çš„å£°æ˜ä¸æ»šåŠ¨åˆ°è¯¥æ–¹æ³•",slug:"æŸ¥çœ‹æ–¹æ³•çš„å£°æ˜ä¸æ»šåŠ¨åˆ°è¯¥æ–¹æ³•"},{level:3,title:"æŸ¥çœ‹æœ€è¿‘æ‰“å¼€è¿‡çš„æ–‡ä»¶ å’Œ æœç´¢",slug:"æŸ¥çœ‹æœ€è¿‘æ‰“å¼€è¿‡çš„æ–‡ä»¶-å’Œ-æœç´¢"},{level:3,title:"é«˜äº®é”™è¯¯æ˜¾ç¤ºéƒ¨åˆ†è·³è½¬",slug:"é«˜äº®é”™è¯¯æ˜¾ç¤ºéƒ¨åˆ†è·³è½¬"},{level:3,title:"æŸ¥çœ‹ç¼©å†™",slug:"æŸ¥çœ‹ç¼©å†™"},{level:3,title:"æ˜¾ç¤ºæ–¹æ³•ä¹‹é—´çš„åˆ†éš”çº¿",slug:"æ˜¾ç¤ºæ–¹æ³•ä¹‹é—´çš„åˆ†éš”çº¿"},{level:3,title:"é€‰ä¸­æç¤ºå†…å®¹",slug:"é€‰ä¸­æç¤ºå†…å®¹"},{level:3,title:"å¿«é€Ÿåœ¨methodsé—´ç§»åŠ¨",slug:"å¿«é€Ÿåœ¨methodsé—´ç§»åŠ¨"},{level:3,title:"å»æ‰éå¿…è¦ç©ºæ ¼",slug:"å»æ‰éå¿…è¦ç©ºæ ¼"},{level:3,title:"å°†æœ€è¿‘çš„å‰ªè´´æ¿å†…å®¹æ’å…¥",slug:"å°†æœ€è¿‘çš„å‰ªè´´æ¿å†…å®¹æ’å…¥"},{level:3,title:"åˆ›å»ºè‡ªå·±çš„è¯å…¸",slug:"åˆ›å»ºè‡ªå·±çš„è¯å…¸"},{level:3,title:"å¿«é€Ÿè¾“å…¥è·¯å¾„",slug:"å¿«é€Ÿè¾“å…¥è·¯å¾„"},{level:3,title:"æŸ¥çœ‹ç±»çš„ç»§æ‰¿å±‚æ¬¡ç»“æ„",slug:"æŸ¥çœ‹ç±»çš„ç»§æ‰¿å±‚æ¬¡ç»“æ„"},{level:3,title:"è°ƒåº¦è¿‡ç¨‹ä¸­æŸ¥çœ‹å€¼",slug:"è°ƒåº¦è¿‡ç¨‹ä¸­æŸ¥çœ‹å€¼"},{level:3,title:"è°ƒåº¦è¿‡ç¨‹ä¸­æŸ¥çœ‹è¡¨è¾¾å¼çš„å€¼",slug:"è°ƒåº¦è¿‡ç¨‹ä¸­æŸ¥çœ‹è¡¨è¾¾å¼çš„å€¼"},{level:3,title:"å¿«æ·æŸ¥çœ‹",slug:"å¿«æ·æŸ¥çœ‹"},{level:3,title:"å°†ç±»æ”¹ä¸ºé¡¶çº§ç±»æˆ–ç§»åŠ¨åˆ°å¦ä¸€ä¸ªç±»",slug:"å°†ç±»æ”¹ä¸ºé¡¶çº§ç±»æˆ–ç§»åŠ¨åˆ°å¦ä¸€ä¸ªç±»"},{level:3,title:"æå–å˜é‡",slug:"æå–å˜é‡"},{level:3,title:"å¿«é€Ÿæ‰“å¼€æ–‡ä»¶",slug:"å¿«é€Ÿæ‰“å¼€æ–‡ä»¶"},{level:3,title:"æŸ¥çœ‹æœ€è¿‘æ›´æ”¹",slug:"æŸ¥çœ‹æœ€è¿‘æ›´æ”¹"},{level:3,title:"å¿«é€Ÿåˆ‡æ¢å„ç§æ–¹æ¡ˆ",slug:"å¿«é€Ÿåˆ‡æ¢å„ç§æ–¹æ¡ˆ"},{level:3,title:"å®Œæˆå½“å‰è¯­å¥",slug:"å®Œæˆå½“å‰è¯­å¥"},{level:3,title:"å¿«é€ŸæŸ¥çœ‹å®šä¹‰ï¼Œæ— éœ€å¼€æ–°é€‰é¡¹å¡",slug:"å¿«é€ŸæŸ¥çœ‹å®šä¹‰-æ— éœ€å¼€æ–°é€‰é¡¹å¡"},{level:3,title:"å°†æŸå­—æ®µã€æ–¹æ³•ã€ç±»ã€æ–‡ä»¶ å¼•å…¥æ–‡æ¡£ä¸­æŸä½ç½®",slug:"å°†æŸå­—æ®µã€æ–¹æ³•ã€ç±»ã€æ–‡ä»¶-å¼•å…¥æ–‡æ¡£ä¸­æŸä½ç½®"},{level:3,title:"ç§»åŠ¨ä»£ç ",slug:"ç§»åŠ¨ä»£ç "},{level:3,title:"å¯åŠ¨å’Œè°ƒè¯•ä»£ç å¿«æ·é”®",slug:"å¯åŠ¨å’Œè°ƒè¯•ä»£ç å¿«æ·é”®"},{level:3,title:"æ˜¾ç¤ºå¯¼èˆªæ ",slug:"æ˜¾ç¤ºå¯¼èˆªæ "},{level:3,title:"æŸ¥æ‰¾",slug:"æŸ¥æ‰¾"},{level:3,title:"æ£€æŸ¥",slug:"æ£€æŸ¥"},{level:3,title:"æŸ¥çœ‹å®ç°æ¥å£",slug:"æŸ¥çœ‹å®ç°æ¥å£"},{level:3,title:"æ¯”è¾ƒä¸¤æ–‡ä»¶å¤¹æˆ–æ–‡ä»¶",slug:"æ¯”è¾ƒä¸¤æ–‡ä»¶å¤¹æˆ–æ–‡ä»¶"},{level:3,title:"æŸ¥æ‰¾ æ›¿æ¢",slug:"æŸ¥æ‰¾-æ›¿æ¢"},{level:3,title:"æŸ¥çœ‹ç»ˆç«¯è¿è¡Œæƒ…å†µ",slug:"æŸ¥çœ‹ç»ˆç«¯è¿è¡Œæƒ…å†µ"},{level:3,title:"æŸ¥çœ‹æ–‡æ¡£",slug:"æŸ¥çœ‹æ–‡æ¡£"},{level:3,title:"åˆ é™¤è¡Œ",slug:"åˆ é™¤è¡Œ"},{level:3,title:"å¤–é¢åŠ ä¸€å±‚åµŒå¥—",slug:"å¤–é¢åŠ ä¸€å±‚åµŒå¥—"},{level:3,title:"åˆ é™¤æœªä½¿ç”¨çš„import",slug:"åˆ é™¤æœªä½¿ç”¨çš„import"}],lastUpdated:"6/26/2019, 9:17:23 PM",lastUpdatedTimestamp:1561555043e3,type:"post",top:!1,tags:[],category:"å·¥å…·æ”¶é›†",createdAt:"2019-03-13",updatedAt:"2019-06-26"},{title:"å¼‚å¸¸ç›‘æ§",frontmatter:{layout:"post",title:"å¼‚å¸¸ç›‘æ§",date:"2019-05-01T00:00:00.000Z",excerpt:"å¼‚å¸¸ç›‘æ§",category:"å¿ƒæƒ…éšç¬”",permalink:"/posts/:year/:month/:day/:slug.html"},regularPath:"/_posts/2019-05-01-error-log.html",relativePath:"_posts/2019-05-01-error-log.md",key:"v-451d4ef7",path:"/posts/2019/05/01/error-log.html",headers:[{level:2,title:"å‰ç«¯é”™è¯¯ç›‘æ§",slug:"å‰ç«¯é”™è¯¯ç›‘æ§"},{level:3,title:"ä¸ºä»€ä¹ˆåšå‰ç«¯ç›‘æ§",slug:"ä¸ºä»€ä¹ˆåšå‰ç«¯ç›‘æ§"},{level:3,title:"å¸¸è§çš„åŸ‹ç‚¹æ–¹æ¡ˆ",slug:"å¸¸è§çš„åŸ‹ç‚¹æ–¹æ¡ˆ"},{level:3,title:"è¿è¡Œæ—¶é”™è¯¯",slug:"è¿è¡Œæ—¶é”™è¯¯"},{level:3,title:"æ€§èƒ½ç›‘æ§",slug:"æ€§èƒ½ç›‘æ§"},{level:3,title:"ç™½å±ä¸ŠæŠ¥",slug:"ç™½å±ä¸ŠæŠ¥"},{level:3,title:"è·¨åŸŸçš„jsè¿è¡Œé”™è¯¯æ•è·",slug:"è·¨åŸŸçš„jsè¿è¡Œé”™è¯¯æ•è·"},{level:3,title:"é”™è¯¯ä¸ŠæŠ¥",slug:"é”™è¯¯ä¸ŠæŠ¥"},{level:3,title:"ä¼˜åŒ–",slug:"ä¼˜åŒ–"}],lastUpdated:"7/9/2022, 6:46:23 PM",lastUpdatedTimestamp:1657363583e3,type:"post",top:!1,tags:[],category:"å¿ƒæƒ…éšç¬”",createdAt:"2019-05-01",updatedAt:"2022-07-09"},{title:"å­¦ä¹ æ­£åˆ™çš„ä½¿ç”¨",frontmatter:{layout:"post",title:"å­¦ä¹ æ­£åˆ™çš„ä½¿ç”¨",date:"2019-08-26T00:00:00.000Z",excerpt:"æ­£åˆ™çš„ä½¿ç”¨å¿ƒå¾—","vssue-title":"ä½¿ç”¨å¿ƒå¾—",category:"å¿ƒæƒ…éšç¬”",permalink:"/posts/:year/:month/:day/:slug.html"},regularPath:"/_posts/2019-08-26-regexp-learn.html",relativePath:"_posts/2019-08-26-regexp-learn.md",key:"v-c20a3d3a",path:"/posts/2019/08/26/regexp-learn.html",headers:[{level:2,title:"æ­£åˆ™åŸºæœ¬è¯­æ³•",slug:"æ­£åˆ™åŸºæœ¬è¯­æ³•"},{level:2,title:"åº”ç”¨æ€»ç»“",slug:"åº”ç”¨æ€»ç»“"},{level:3,title:"éªŒè¯è¿ç»­æ•°å­—æ˜¯å¦æœ‰é‡å¤",slug:"éªŒè¯è¿ç»­æ•°å­—æ˜¯å¦æœ‰é‡å¤"},{level:3,title:"éªŒè¯æ˜¯å¦æœ‰é‡å¤å­—ç¬¦",slug:"éªŒè¯æ˜¯å¦æœ‰é‡å¤å­—ç¬¦"},{level:3,title:"ipåœ°å€çš„æ­£åˆ™",slug:"ipåœ°å€çš„æ­£åˆ™"},{level:3,title:"12ä½æ•°å­—ï¼Œå…¶ä¸­ä¸èƒ½å‡ºç°6ä½è¿ç»­ç›¸åŒæ•°å­—",slug:"_12ä½æ•°å­—-å…¶ä¸­ä¸èƒ½å‡ºç°6ä½è¿ç»­ç›¸åŒæ•°å­—"},{level:3,title:"A-Zä»¥å†…ä¸é‡å¤çš„10ä¸ªå­—æ¯",slug:"a-zä»¥å†…ä¸é‡å¤çš„10ä¸ªå­—æ¯"},{level:3,title:"åƒä½åˆ†éš”ç¬¦(js å®ç°)",slug:"åƒä½åˆ†éš”ç¬¦-js-å®ç°"}],lastUpdated:"4/21/2023, 11:58:53 AM",lastUpdatedTimestamp:1682049533e3,type:"post",top:!1,tags:[],category:"å¿ƒæƒ…éšç¬”",createdAt:"2019-08-26",updatedAt:"2023-04-21"},{title:"ä»Šå¤©æ€»ç»“ä¸€ä¸‹ç”¨åˆ°çš„csså§",frontmatter:{layout:"post",title:"ä»Šå¤©æ€»ç»“ä¸€ä¸‹ç”¨åˆ°çš„csså§",date:"2020-04-28",excerpt:"å¥½ä¹…æ²¡å†™è®°å½•äº†ï¼Œä»Šå¤©é—²ä¸‹æ¥å°±æ€»ç»“ä¸€ä¸‹","vssue-title":" cssæ€»ç»“",category:"å¿ƒæƒ…éšç¬”",permalink:"/posts/:year/:month/:day/:slug.html"},regularPath:"/_posts/2020-04-28-learn-css.html",relativePath:"_posts/2020-04-28-learn-css.md",key:"v-6c901c52",path:"/posts/2020/04/28/learn-css.html",headers:[{level:2,title:"æ¦‚è¦",slug:"æ¦‚è¦"},{level:3,title:"è¡Œå’Œåˆ—",slug:"è¡Œå’Œåˆ—"},{level:3,title:"ç½‘æ ¼çº¿",slug:"ç½‘æ ¼çº¿"},{level:2,title:"å®¹å™¨çš„å±æ€§",slug:"å®¹å™¨çš„å±æ€§"},{level:2,title:"css æ€§èƒ½ä¼˜åŒ–",slug:"css-æ€§èƒ½ä¼˜åŒ–"},{level:2,title:"css3åŠ¨ç”»åŠ é€Ÿ",slug:"css3åŠ¨ç”»åŠ é€Ÿ"},{level:2,title:"csså±‚å ",slug:"csså±‚å "},{level:2,title:"divå±…ä¸­æ€»ç»“",slug:"divå±…ä¸­æ€»ç»“"},{level:3,title:"æµ®åŠ¨",slug:"æµ®åŠ¨"},{level:3,title:"linkå’Œ@importçš„åŒºåˆ«",slug:"linkå’Œ-importçš„åŒºåˆ«"},{level:3,title:"csså¸¸è§çš„é€‰æ‹©å™¨",slug:"csså¸¸è§çš„é€‰æ‹©å™¨"}],lastUpdated:"4/25/2021, 10:47:41 AM",lastUpdatedTimestamp:1619318861e3,type:"post",top:!1,tags:[],category:"å¿ƒæƒ…éšç¬”",createdAt:"2020-04-28",updatedAt:"2021-04-25"},{title:"macå¿«æ·é”®",frontmatter:{layout:"post",title:"macå¿«æ·é”®",date:"2019-12-24",excerpt:"macå¿«æ·é”®","vssue-title":"macå¿«æ·é”®",category:"å·¥å…·æ”¶é›†",permalink:"/posts/:year/:month/:day/:slug.html"},regularPath:"/_posts/2019-12-24-use-mac.html",relativePath:"_posts/2019-12-24-use-mac.md",key:"v-727bdcd7",path:"/posts/2019/12/24/use-mac.html",headers:[{level:2,title:"macå¿«æ·é”®",slug:"macå¿«æ·é”®"},{level:3,title:"å‰ªåˆ‡ã€æ‹·è´ã€ç²˜è´´å’Œå…¶ä»–å¸¸ç”¨å¿«æ·é”®",slug:"å‰ªåˆ‡ã€æ‹·è´ã€ç²˜è´´å’Œå…¶ä»–å¸¸ç”¨å¿«æ·é”®"},{level:3,title:"ç¡çœ ã€é€€å‡ºç™»å½•å’Œå…³æœºå¿«æ·é”®",slug:"ç¡çœ ã€é€€å‡ºç™»å½•å’Œå…³æœºå¿«æ·é”®"},{level:3,title:"è®¿è¾¾å’Œç³»ç»Ÿå¿«æ·é”®",slug:"è®¿è¾¾å’Œç³»ç»Ÿå¿«æ·é”®"},{level:3,title:"æ–‡ç¨¿å¿«æ·é”®",slug:"æ–‡ç¨¿å¿«æ·é”®"},{level:3,title:"å±å¹•æˆªå›¾å¿«æ·é”®è®°å½•",slug:"å±å¹•æˆªå›¾å¿«æ·é”®è®°å½•"},{level:3,title:"å…¶ä»–å¿«æ·é”®",slug:"å…¶ä»–å¿«æ·é”®"}],lastUpdated:"12/1/2021, 7:02:16 PM",lastUpdatedTimestamp:1638356536e3,type:"post",top:!1,tags:[],category:"å·¥å…·æ”¶é›†",createdAt:"2019-12-24",updatedAt:"2021-12-01"},{title:"å‰ç«¯å¾®æœåŠ¡æ€»ç»“",frontmatter:{layout:"post",title:"å‰ç«¯å¾®æœåŠ¡æ€»ç»“",date:"2020-08-12",excerpt:"å‰ç«¯å¾®æœåŠ¡æ€»ç»“","vssue-title":"å‰ç«¯å¾®æœåŠ¡æ€»ç»“",category:"å¿ƒæƒ…éšç¬”",permalink:"/posts/:year/:month/:day/:slug.html"},regularPath:"/_posts/2020-08-12-fe-microservices.html",relativePath:"_posts/2020-08-12-fe-microservices.md",key:"v-3b2e133e",path:"/posts/2020/08/12/fe-microservices.html",headers:[{level:2,title:"å‰ç«¯å¾®æœåŠ¡æ€»ç»“",slug:"å‰ç«¯å¾®æœåŠ¡æ€»ç»“"},{level:3,title:"å¦‚ä½•æ ·å¼éš”ç¦»",slug:"å¦‚ä½•æ ·å¼éš”ç¦»"},{level:3,title:"å¦‚ä½•é€šè®¯",slug:"å¦‚ä½•é€šè®¯"},{level:3,title:"ä»‹ç»",slug:"ä»‹ç»"},{level:2,title:"ä»€ä¹ˆæ˜¯å¾®å‰ç«¯",slug:"ä»€ä¹ˆæ˜¯å¾®å‰ç«¯"},{level:2,title:"qiankun çš„æ ¸å¿ƒè®¾è®¡ç†å¿µ",slug:"qiankun-çš„æ ¸å¿ƒè®¾è®¡ç†å¿µ"},{level:2,title:"ç‰¹æ€§",slug:"ç‰¹æ€§"},{level:2,title:"qiankunä½¿ç”¨",slug:"qiankunä½¿ç”¨"},{level:3,title:"single-spaä½¿ç”¨",slug:"single-spaä½¿ç”¨"},{level:3,title:"qiankunä½¿ç”¨ï¼ˆå¿«é€Ÿä¸Šæ‰‹ï¼‰",slug:"qiankunä½¿ç”¨-å¿«é€Ÿä¸Šæ‰‹"}],lastUpdated:"12/3/2021, 8:15:07 PM",lastUpdatedTimestamp:1638533707e3,type:"post",top:!1,tags:[],category:"å¿ƒæƒ…éšç¬”",createdAt:"2020-08-12",updatedAt:"2021-12-03"},{title:"ä¸²çš„æ¨¡å¼åŒ¹é…",frontmatter:{layout:"post",title:"ä¸²çš„æ¨¡å¼åŒ¹é…",date:"2020-10-09",excerpt:"ä¸²çš„æ¨¡å¼åŒ¹é…","vssue-title":"ä¸²çš„æ¨¡å¼åŒ¹é…",category:"å¿ƒæƒ…éšç¬”",permalink:"/posts/:year/:month/:day/:slug.html"},regularPath:"/_posts/2020-10-09-string.html",relativePath:"_posts/2020-10-09-string.md",key:"v-02b9bb49",path:"/posts/2020/10/09/string.html",headers:[{level:2,title:"ğŸ”°æ¨¡å¼åŒ¹é…",slug:"æ¨¡å¼åŒ¹é…"},{level:2,title:"1ï¸âƒ£æ¨¡å¼åŒ¹é…â€”BFç®—æ³•",slug:"æ¨¡å¼åŒ¹é…-bfç®—æ³•"},{level:2,title:"2ï¸âƒ£æ¨¡å¼åŒ¹é…â€”KMPç®—æ³•",slug:"æ¨¡å¼åŒ¹é…-kmpç®—æ³•"}],lastUpdated:"4/23/2021, 3:43:32 PM",lastUpdatedTimestamp:1619163812e3,type:"post",top:!1,tags:[],category:"å¿ƒæƒ…éšç¬”",createdAt:"2020-10-09",updatedAt:"2021-04-23"},{title:"åœ°å›¾æ ‡ç»˜--å°„çº¿æ³•æ¥è®¡ç®—ç‚¹åœ¨å¤šè¾¹å½¢å†…",frontmatter:{layout:"post",title:"åœ°å›¾æ ‡ç»˜--å°„çº¿æ³•æ¥è®¡ç®—ç‚¹åœ¨å¤šè¾¹å½¢å†…",date:"2020-02-22",excerpt:"å°„çº¿æ³•æ¥è®¡ç®—ç‚¹åœ¨å¤šè¾¹å½¢å†…","vssue-title":"å°„çº¿æ³•æ¥è®¡ç®—ç‚¹å†å¤šè¾¹å½¢å†…",category:"å¿ƒæƒ…éšç¬”",permalink:"/posts/:year/:month/:day/:slug.html"},regularPath:"/_posts/2020-02-22-ray-method-polygon.html",relativePath:"_posts/2020-02-22-ray-method-polygon.md",key:"v-82ef379e",path:"/posts/2020/02/22/ray-method-polygon.html",headers:[{level:2,title:"å°„çº¿æ³•ä»‹ç»",slug:"å°„çº¿æ³•ä»‹ç»"}],lastUpdated:"3/16/2021, 3:17:41 PM",lastUpdatedTimestamp:1615879061e3,type:"post",top:!1,tags:[],category:"å¿ƒæƒ…éšç¬”",createdAt:"2020-02-22",updatedAt:"2021-03-16"},{title:"å›¾çš„å®šä¹‰åŠåº”ç”¨",frontmatter:{layout:"post",title:"å›¾çš„å®šä¹‰åŠåº”ç”¨",date:"2020-10-10",excerpt:"å›¾çš„å®šä¹‰åŠåº”ç”¨","vssue-title":"å›¾çš„å®šä¹‰åŠåº”ç”¨",category:"å¿ƒæƒ…éšç¬”",permalink:"/posts/:year/:month/:day/:slug.html"},regularPath:"/_posts/2020-10-10-chart.html",relativePath:"_posts/2020-10-10-chart.md",key:"v-5859a1d2",path:"/posts/2020/10/10/chart.html",headers:[{level:2,title:"å›¾çš„å®šä¹‰",slug:"å›¾çš„å®šä¹‰"},{level:2,title:"åŸºæœ¬æœ¯è¯­",slug:"åŸºæœ¬æœ¯è¯­"},{level:2,title:"å›¾çš„å­˜å‚¨",slug:"å›¾çš„å­˜å‚¨"},{level:2,title:"å›¾çš„éå†",slug:"å›¾çš„éå†"},{level:2,title:"å›¾çš„åº”ç”¨ï¼ˆå››å¤§åº”ç”¨ï¼‰",slug:"å›¾çš„åº”ç”¨-å››å¤§åº”ç”¨"},{level:3,title:"å…³äºå›¾çš„å‡ ä¸ªæ¦‚å¿µå®šä¹‰ï¼š",slug:"å…³äºå›¾çš„å‡ ä¸ªæ¦‚å¿µå®šä¹‰"},{level:3,title:"ğŸ‘‰åº”ç”¨1ï¸âƒ£:ç”Ÿæˆæ ‘",slug:"åº”ç”¨-ç”Ÿæˆæ ‘"},{level:3,title:"ğŸ‘‰åº”ç”¨2ï¸âƒ£:æœ€å°ç”Ÿæˆæ ‘",slug:"åº”ç”¨-æœ€å°ç”Ÿæˆæ ‘"},{level:3,title:"ğŸ‘‰åº”ç”¨3ï¸âƒ£:æœ€çŸ­è·¯å¾„",slug:"åº”ç”¨-æœ€çŸ­è·¯å¾„"},{level:3,title:"ğŸ‘‰åº”ç”¨4ï¸âƒ£:æ‹“æ‰‘æ’åº",slug:"åº”ç”¨-æ‹“æ‰‘æ’åº"},{level:3,title:"ğŸ‘‰åº”ç”¨5ï¸âƒ£:å…³é”®è·¯å¾„",slug:"åº”ç”¨-å…³é”®è·¯å¾„"},{level:3,title:"æ€»ç»“",slug:"æ€»ç»“"}],lastUpdated:"10/26/2021, 11:39:12 AM",lastUpdatedTimestamp:1635219552e3,type:"post",top:!1,tags:[],category:"å¿ƒæƒ…éšç¬”",createdAt:"2020-10-10",updatedAt:"2021-10-26"},{title:"æ’åº",frontmatter:{layout:"post",title:"æ’åº",date:"2020-10-11",excerpt:"æ’åº","vssue-title":"æ’åº",category:"å¿ƒæƒ…éšç¬”",permalink:"/posts/:year/:month/:day/:slug.html"},regularPath:"/_posts/2020-10-11-sort.html",relativePath:"_posts/2020-10-11-sort.md",key:"v-6a2fdcdd",path:"/posts/2020/10/11/sort.html",headers:[{level:2,title:"æ’åºç®—æ³•åˆ†ç±»",slug:"æ’åºç®—æ³•åˆ†ç±»"},{level:3,title:"æ’å…¥æ’åº",slug:"æ’å…¥æ’åº"},{level:3,title:"äº¤æ¢æ’åº",slug:"äº¤æ¢æ’åº"},{level:3,title:"é€‰æ‹©æ’åº",slug:"é€‰æ‹©æ’åº"},{level:3,title:"å †æ’åº",slug:"å †æ’åº"},{level:3,title:"å½’å¹¶æ’åº ï¼ˆäºŒè·¯å½’å¹¶ï¼‰",slug:"å½’å¹¶æ’åº-äºŒè·¯å½’å¹¶"},{level:3,title:"åŸºæ•°æ’åº",slug:"åŸºæ•°æ’åº"}],lastUpdated:"3/18/2021, 10:28:27 AM",lastUpdatedTimestamp:1616034507e3,type:"post",top:!1,tags:[],category:"å¿ƒæƒ…éšç¬”",createdAt:"2020-10-11",updatedAt:"2021-03-18"},{title:"æŸ¥æ‰¾",frontmatter:{layout:"post",title:"æŸ¥æ‰¾",date:"2020-10-13",excerpt:"æŸ¥æ‰¾","vssue-title":"æŸ¥æ‰¾",category:"å¿ƒæƒ…éšç¬”",permalink:"/posts/:year/:month/:day/:slug.html"},regularPath:"/_posts/2020-10-13-seek.html",relativePath:"_posts/2020-10-13-seek.md",key:"v-5c8c14ad",path:"/posts/2020/10/13/seek.html",headers:[{level:2,title:"æŸ¥æ‰¾çš„åŸºæœ¬æ¦‚å¿µ",slug:"æŸ¥æ‰¾çš„åŸºæœ¬æ¦‚å¿µ"},{level:3,title:"æ–¹æ³•1ï¸âƒ£ é¡ºåºæŸ¥æ‰¾",slug:"æ–¹æ³•-é¡ºåºæŸ¥æ‰¾"},{level:3,title:"æ–¹æ³•2ï¸âƒ£:äºŒåˆ†æŸ¥æ‰¾",slug:"æ–¹æ³•-äºŒåˆ†æŸ¥æ‰¾"},{level:3,title:"æ–¹æ³•3ï¸âƒ£:åˆ†å—æŸ¥æ‰¾",slug:"æ–¹æ³•-åˆ†å—æŸ¥æ‰¾"},{level:3,title:"æ–¹æ³•4ï¸âƒ£:æ ‘è¡¨çš„æŸ¥æ‰¾",slug:"æ–¹æ³•-æ ‘è¡¨çš„æŸ¥æ‰¾"},{level:3,title:"æ•£åˆ—æŸ¥æ‰¾",slug:"æ•£åˆ—æŸ¥æ‰¾"}],lastUpdated:"12/12/2021, 5:43:54 PM",lastUpdatedTimestamp:1639302234e3,type:"post",top:!1,tags:[],category:"å¿ƒæƒ…éšç¬”",createdAt:"2020-10-13",updatedAt:"2021-12-12"},{title:"reacté«˜çº§ç‰¹æ€§",frontmatter:{layout:"post",title:"reacté«˜çº§ç‰¹æ€§",date:"2021-02-29",excerpt:"æŸ¥æ‰¾","vssue-title":"reacté«˜çº§ç‰¹æ€§",category:"å¿ƒæƒ…éšç¬”",permalink:"/posts/:year/:month/:day/:slug.html"},regularPath:"/_posts/2021-02-29-react-senior.html",relativePath:"_posts/2021-02-29-react-senior.md",key:"v-4f270427",path:"/posts/2021/03/01/react-senior.html",headers:[{level:2,title:"ç‰¹æ€§",slug:"ç‰¹æ€§"},{level:3,title:"å‡½æ•°ç»„ä»¶",slug:"å‡½æ•°ç»„ä»¶"},{level:3,title:"éå—æ§ç»„ä»¶",slug:"éå—æ§ç»„ä»¶"},{level:3,title:"portals",slug:"portals"},{level:3,title:"context",slug:"context"},{level:3,title:"å¼‚æ­¥ç»„ä»¶",slug:"å¼‚æ­¥ç»„ä»¶"},{level:3,title:"shouldComponentUpdate",slug:"shouldcomponentupdate"},{level:3,title:"pureComponent",slug:"purecomponent"},{level:3,title:"immutable.js",slug:"immutable-js"},{level:3,title:"é«˜é˜¶ç»„ä»¶HOC",slug:"é«˜é˜¶ç»„ä»¶hoc"},{level:3,title:"render Props",slug:"render-props"},{level:3,title:"reduxè¿‡ç¨‹æè¿°",slug:"reduxè¿‡ç¨‹æè¿°"},{level:2,title:"reactæœ¬è´¨",slug:"reactæœ¬è´¨"},{level:3,title:"vdomå’Œdiff",slug:"vdomå’Œdiff"},{level:3,title:"jsx",slug:"jsx"},{level:3,title:"åˆæˆäº‹ä»¶",slug:"åˆæˆäº‹ä»¶"},{level:3,title:"setState",slug:"setstate"},{level:3,title:"ç»„ä»¶æ¸²æŸ“ã€æ›´æ–°è¿‡ç¨‹",slug:"ç»„ä»¶æ¸²æŸ“ã€æ›´æ–°è¿‡ç¨‹"}],lastUpdated:"12/1/2021, 7:02:16 PM",lastUpdatedTimestamp:1638356536e3,type:"post",top:!1,tags:[],category:"å¿ƒæƒ…éšç¬”",createdAt:"2021-03-01",updatedAt:"2021-12-01"},{title:"chromeæ’ä»¶",frontmatter:{layout:"post",title:"chromeæ’ä»¶",date:"2021-02-02",excerpt:"chromeæ’ä»¶å¼€å‘","vssue-title":"chromeæ’ä»¶å¼€å‘",category:"å¿ƒæƒ…éšç¬”",permalink:"/posts/:year/:month/:day/:slug.html"},regularPath:"/_posts/2021-02-02-chrome-plugin.html",relativePath:"_posts/2021-02-02-chrome-plugin.md",key:"v-67bd99b7",path:"/posts/2021/02/02/chrome-plugin.html",headers:[{level:2,title:"è¯´æ˜",slug:"è¯´æ˜"},{level:2,title:"æ‰‹æŠŠæ‰‹æ•™æ­å»ºè¿‡ç¨‹",slug:"æ‰‹æŠŠæ‰‹æ•™æ­å»ºè¿‡ç¨‹"},{level:2,title:"wokoo-scriptsç¼–å†™",slug:"wokoo-scriptsç¼–å†™"},{level:2,title:"wokoo-templateç¼–å†™",slug:"wokoo-templateç¼–å†™"},{level:2,title:"å‘å¸ƒwokoo",slug:"å‘å¸ƒwokoo"},{level:2,title:"wokooä½¿ç”¨",slug:"wokooä½¿ç”¨"},{level:3,title:"1.1 é¡¹ç›®å®‰è£… & åˆå§‹åŒ–é…ç½®",slug:"_1-1-é¡¹ç›®å®‰è£…-åˆå§‹åŒ–é…ç½®"},{level:3,title:"1.2 å¼€å‘åŸºæœ¬åŠŸèƒ½",slug:"_1-2-å¼€å‘åŸºæœ¬åŠŸèƒ½"},{level:2,title:"ä¸‰ã€éƒ¨ç½²æ’ä»¶åˆ°æ²¹çŒ´å•†åº—",slug:"ä¸‰ã€éƒ¨ç½²æ’ä»¶åˆ°æ²¹çŒ´å•†åº—"}],lastUpdated:"11/15/2021, 10:13:14 AM",lastUpdatedTimestamp:1636942394e3,type:"post",top:!1,tags:[],category:"å¿ƒæƒ…éšç¬”",createdAt:"2021-02-02",updatedAt:"2021-11-15"},{title:"vueåŸºç¡€çŸ¥è¯†",frontmatter:{layout:"post",title:"vueåŸºç¡€çŸ¥è¯†",date:"2021-03-02",excerpt:"æŸ¥æ‰¾","vssue-title":"vueåŸºç¡€çŸ¥è¯†",category:"å¿ƒæƒ…éšç¬”",permalink:"/posts/:year/:month/:day/:slug.html"},regularPath:"/_posts/2021-03-02-vue-basics.html",relativePath:"_posts/2021-03-02-vue-basics.md",key:"v-a5140402",path:"/posts/2021/03/02/vue-basics.html",headers:[{level:2,title:"åŸºç¡€çŸ¥è¯†",slug:"åŸºç¡€çŸ¥è¯†"},{level:3,title:"æ¨¡æ¿",slug:"æ¨¡æ¿"},{level:3,title:"æŒ‡ä»¤",slug:"æŒ‡ä»¤"},{level:3,title:"computed å’Œwatch",slug:"computed-å’Œwatch"},{level:3,title:"v-forå¾ªç¯",slug:"v-forå¾ªç¯"},{level:3,title:"ç”Ÿå‘½å‘¨æœŸ",slug:"ç”Ÿå‘½å‘¨æœŸ"},{level:3,title:"ç»„ä»¶é€šä¿¡",slug:"ç»„ä»¶é€šä¿¡"},{level:3,title:"è‡ªå®šä¹‰ç»„ä»¶v-model",slug:"è‡ªå®šä¹‰ç»„ä»¶v-model"},{level:3,title:"nextTick",slug:"nexttick"},{level:3,title:"åŠ¨æ€ç»„ä»¶&å¼‚æ­¥ç»„ä»¶",slug:"åŠ¨æ€ç»„ä»¶-å¼‚æ­¥ç»„ä»¶"},{level:3,title:"keep-alive",slug:"keep-alive"},{level:3,title:"mixin",slug:"mixin"},{level:3,title:"vue-router",slug:"vue-router"}],lastUpdated:"11/11/2021, 10:01:46 AM",lastUpdatedTimestamp:1636596106e3,type:"post",top:!1,tags:[],category:"å¿ƒæƒ…éšç¬”",createdAt:"2021-03-02",updatedAt:"2021-11-11"},{title:"reactåŸºç¡€çŸ¥è¯†",frontmatter:{layout:"post",title:"reactåŸºç¡€çŸ¥è¯†",date:"2021-02-26",excerpt:"æŸ¥æ‰¾","vssue-title":"reactåŸºç¡€çŸ¥è¯†",category:"å¿ƒæƒ…éšç¬”",permalink:"/posts/:year/:month/:day/:slug.html"},regularPath:"/_posts/2021-02-26-react-basics.html",relativePath:"_posts/2021-02-26-react-basics.md",key:"v-40322b92",path:"/posts/2021/02/26/react-basics.html",headers:[{level:2,title:"reactåŸºç¡€çŸ¥è¯†",slug:"reactåŸºç¡€çŸ¥è¯†"},{level:3,title:"hooks",slug:"hooks"},{level:3,title:"jsxåŸºæœ¬ä½¿ç”¨",slug:"jsxåŸºæœ¬ä½¿ç”¨"},{level:3,title:"reactç”Ÿå‘½å‘¨æœŸ",slug:"reactç”Ÿå‘½å‘¨æœŸ"},{level:3,title:"react-router",slug:"react-router"}],lastUpdated:"11/15/2021, 10:13:14 AM",lastUpdatedTimestamp:1636942394e3,type:"post",top:!1,tags:[],category:"å¿ƒæƒ…éšç¬”",createdAt:"2021-02-26",updatedAt:"2021-11-15"},{title:"vueä¸€äº›æ€è€ƒ",frontmatter:{layout:"post",title:"vueä¸€äº›æ€è€ƒ",date:"2021-03-04",excerpt:"æŸ¥æ‰¾","vssue-title":"vueä¸€äº›æ€è€ƒ",category:"å¿ƒæƒ…éšç¬”",permalink:"/posts/:year/:month/:day/:slug.html"},regularPath:"/_posts/2021-03-04-vue-principle.html",relativePath:"_posts/2021-03-04-vue-principle.md",key:"v-3c1a57b7",path:"/posts/2021/03/04/vue-principle.html",headers:[{level:2,title:"vueå¸¸è§åŸç†",slug:"vueå¸¸è§åŸç†"},{level:3,title:"æ¨¡æ¿ç¼–è¯‘è¿‡ç¨‹æ¦‚è¿°",slug:"æ¨¡æ¿ç¼–è¯‘è¿‡ç¨‹æ¦‚è¿°"},{level:3,title:"å“åº”å¼",slug:"å“åº”å¼"},{level:3,title:"vdom",slug:"vdom"},{level:3,title:"diffç®—æ³•æ¦‚è¿°",slug:"diffç®—æ³•æ¦‚è¿°"},{level:3,title:"ç»„ä»¶çš„æ¸²æŸ“æ›´æ–°è¿‡ç¨‹",slug:"ç»„ä»¶çš„æ¸²æŸ“æ›´æ–°è¿‡ç¨‹"},{level:3,title:"å°†propsä¼ é€’å­ç»„ä»¶",slug:"å°†propsä¼ é€’å­ç»„ä»¶"},{level:3,title:"hashæ¨¡å¼",slug:"hashæ¨¡å¼"},{level:3,title:"hisotryæ¨¡å¼",slug:"hisotryæ¨¡å¼"}],lastUpdated:"12/2/2021, 10:35:16 AM",lastUpdatedTimestamp:1638412516e3,type:"post",top:!1,tags:[],category:"å¿ƒæƒ…éšç¬”",createdAt:"2021-03-04",updatedAt:"2021-12-02"},{title:"webpackåº”ç”¨æ€»ç»“äºŒ",frontmatter:{layout:"post",title:"webpackåº”ç”¨æ€»ç»“äºŒ",date:"2021-03-10",excerpt:"æŸ¥æ‰¾","vssue-title":"webpackåº”ç”¨æ€»ç»“äºŒ",category:"å¿ƒæƒ…éšç¬”",permalink:"/posts/:year/:month/:day/:slug.html"},regularPath:"/_posts/2021-03-10-webpack-senior.html",relativePath:"_posts/2021-03-10-webpack-senior.md",key:"v-67baae1e",path:"/posts/2021/03/10/webpack-senior.html",headers:[{level:2,title:"webpackåº”ç”¨æ€»ç»“äºŒ",slug:"webpackåº”ç”¨æ€»ç»“äºŒ"},{level:3,title:"moduleã€chunkã€bundleåŒºåˆ«",slug:"moduleã€chunkã€bundleåŒºåˆ«"},{level:3,title:"loaderå’Œpluginsçš„åŒºåˆ«",slug:"loaderå’Œpluginsçš„åŒºåˆ«"},{level:3,title:"ä¼˜åŒ–babel-loader",slug:"ä¼˜åŒ–babel-loader"},{level:3,title:"ignorePluginå’ŒnoParse",slug:"ignorepluginå’Œnoparse"},{level:3,title:"happyPack",slug:"happypack"},{level:3,title:"ParallelUglifyPlugin",slug:"paralleluglifyplugin"},{level:3,title:"å…³äºå¼€å¯å¤šè¿›ç¨‹",slug:"å…³äºå¼€å¯å¤šè¿›ç¨‹"},{level:3,title:"è‡ªåŠ¨åˆ·æ–°",slug:"è‡ªåŠ¨åˆ·æ–°"},{level:3,title:"çƒ­æ›´æ–°",slug:"çƒ­æ›´æ–°"},{level:3,title:"DllPluginåŠ¨æ€é“¾æ¥åº“",slug:"dllpluginåŠ¨æ€é“¾æ¥åº“"},{level:3,title:"webpack ä¼˜åŒ–æ„å»ºé€Ÿåº¦",slug:"webpack-ä¼˜åŒ–æ„å»ºé€Ÿåº¦"},{level:3,title:"webpack æ€§èƒ½ä¼˜åŒ–",slug:"webpack-æ€§èƒ½ä¼˜åŒ–"},{level:3,title:"es6 moduleå’Œcommonjsçš„åŒºåˆ«",slug:"es6-moduleå’Œcommonjsçš„åŒºåˆ«"},{level:3,title:"tree shaking",slug:"tree-shaking"},{level:3,title:"scope Hosting",slug:"scope-hosting"},{level:3,title:"ä¸ºä»€ä¹ˆè¦è¿›è¡Œæ‰“åŒ…å’Œæ„å»º",slug:"ä¸ºä»€ä¹ˆè¦è¿›è¡Œæ‰“åŒ…å’Œæ„å»º"}],lastUpdated:"12/9/2021, 11:07:41 AM",lastUpdatedTimestamp:1639019261e3,type:"post",top:!1,tags:[],category:"å¿ƒæƒ…éšç¬”",createdAt:"2021-03-10",updatedAt:"2021-12-09"},{title:"webpackåº”ç”¨æ€»ç»“ä¸€",frontmatter:{layout:"post",title:"webpackåº”ç”¨æ€»ç»“ä¸€",date:"2021-03-09",excerpt:"æŸ¥æ‰¾","vssue-title":"webpackåº”ç”¨æ€»ç»“ä¸€",category:"å¿ƒæƒ…éšç¬”",permalink:"/posts/:year/:month/:day/:slug.html"},regularPath:"/_posts/2021-03-09-webpack.html",relativePath:"_posts/2021-03-09-webpack.md",key:"v-66101e52",path:"/posts/2021/03/09/webpack.html",headers:[{level:2,title:"webpackåº”ç”¨æ€»ç»“",slug:"webpackåº”ç”¨æ€»ç»“"},{level:3,title:"æ‹†åˆ†é…ç½®",slug:"æ‹†åˆ†é…ç½®"},{level:3,title:"å¯åŠ¨æœ¬åœ°æœåŠ¡",slug:"å¯åŠ¨æœ¬åœ°æœåŠ¡"},{level:3,title:"es6å¤„ç†",slug:"es6å¤„ç†"},{level:3,title:"å¤„ç†æ ·å¼",slug:"å¤„ç†æ ·å¼"},{level:3,title:"å¤„ç†å›¾ç‰‡",slug:"å¤„ç†å›¾ç‰‡"},{level:3,title:"å¤šå…¥å£",slug:"å¤šå…¥å£"},{level:3,title:"æŠ½ç¦»CSSæ–‡ä»¶",slug:"æŠ½ç¦»cssæ–‡ä»¶"},{level:3,title:"æŠ½ç¦»å…¬å…±ä»£ç ",slug:"æŠ½ç¦»å…¬å…±ä»£ç "},{level:3,title:"æ‡’åŠ è½½",slug:"æ‡’åŠ è½½"},{level:3,title:"loader",slug:"loader"},{level:3,title:"å¤„ç†jsxä¸vue",slug:"å¤„ç†jsxä¸vue"}],lastUpdated:"4/26/2021, 12:43:46 PM",lastUpdatedTimestamp:1619412226e3,type:"post",top:!1,tags:[],category:"å¿ƒæƒ…éšç¬”",createdAt:"2021-03-09",updatedAt:"2021-04-26"},{title:"font-weightç›¸å…³å†…å®¹",frontmatter:{layout:"post",title:"font-weightç›¸å…³å†…å®¹",date:"2021-07-13T00:00:00.000Z",excerpt:"font-weightçš„çœŸç›¸","vssue-title":"font-weightçš„çœŸç›¸",category:"å¿ƒæƒ…éšç¬”",permalink:"/posts/:year/:month/:day/:slug.html"},regularPath:"/_posts/2021-07-13-font-weight.html",relativePath:"_posts/2021-07-13-font-weight.md",key:"v-652145d2",path:"/posts/2021/07/13/font-weight.html",headers:[{level:2,title:"font-weightåŸºæœ¬ä¿¡æ¯",slug:"font-weightåŸºæœ¬ä¿¡æ¯"},{level:3,title:"è¯­æ³•",slug:"è¯­æ³•"},{level:3,title:"font-weightçš„è½¬åŒ–è§„å¾‹",slug:"font-weightçš„è½¬åŒ–è§„å¾‹"},{level:3,title:"å­—ä½“åŒ¹é…ç®—æ³•",slug:"å­—ä½“åŒ¹é…ç®—æ³•"},{level:3,title:"æ€»ç»“",slug:"æ€»ç»“"}],lastUpdated:"12/12/2021, 5:43:54 PM",lastUpdatedTimestamp:1639302234e3,type:"post",top:!1,tags:[],category:"å¿ƒæƒ…éšç¬”",createdAt:"2021-07-13",updatedAt:"2021-12-12"},{title:"webpackä¼˜åŒ–å®è·µ",frontmatter:{layout:"post",title:"webpackä¼˜åŒ–å®è·µ",date:"2021-03-27",excerpt:"webpackä¼˜åŒ–å®è·µ","vssue-title":"webpackä¼˜åŒ–å®è·µ",category:"å¿ƒæƒ…éšç¬”",permalink:"/posts/:year/:month/:day/:slug.html"},regularPath:"/_posts/2021-03-27-webpack-share.html",relativePath:"_posts/2021-03-27-webpack-share.md",key:"v-483c3f97",path:"/posts/2021/03/27/webpack-share.html",headers:[{level:2,title:"webpackä¼˜åŒ–æ‰“åŒ…é€Ÿåº¦",slug:"webpackä¼˜åŒ–æ‰“åŒ…é€Ÿåº¦"},{level:3,title:"webpackæ‰“åŒ…æµç¨‹",slug:"webpackæ‰“åŒ…æµç¨‹"},{level:3,title:"ç¼©çŸ­è§£ææ—¶é—´",slug:"ç¼©çŸ­è§£ææ—¶é—´"},{level:3,title:"ç¼©çŸ­æœç´¢æ—¶é—´",slug:"ç¼©çŸ­æœç´¢æ—¶é—´"},{level:3,title:"ç¼©çŸ­æ‰“åŒ…æ—¶é—´",slug:"ç¼©çŸ­æ‰“åŒ…æ—¶é—´"},{level:3,title:"å…¶ä»–",slug:"å…¶ä»–"},{level:2,title:"webpackç¼–è¯‘ä½“ç§¯ä¼˜åŒ–",slug:"webpackç¼–è¯‘ä½“ç§¯ä¼˜åŒ–"}],lastUpdated:"12/31/2021, 4:28:57 PM",lastUpdatedTimestamp:1640939337e3,type:"post",top:!1,tags:[],category:"å¿ƒæƒ…éšç¬”",createdAt:"2021-03-27",updatedAt:"2021-12-31"},{title:"Enjoy life:)",frontmatter:{layout:"CustomLayout",title:"Enjoy life:)",aside:!1},regularPath:"/custom-pages/",relativePath:"custom-pages/index.md",key:"v-6f067db4",path:"/custom-pages/",headers:[{level:2,title:"About",slug:"about"},{level:2,title:"How to reach me",slug:"how-to-reach-me"}],lastUpdated:"11/25/2021, 11:01:16 AM",lastUpdatedTimestamp:1637809276e3,type:"page"},{title:"å¸¸è§çš„leetCodeé¢˜ç›®ä¸è§£é¢˜æ€è·¯",frontmatter:{layout:"post",title:"å¸¸è§çš„leetCodeé¢˜ç›®ä¸è§£é¢˜æ€è·¯",date:"2022-03-10T00:00:00.000Z",excerpt:"å¸¸è§çš„leetCodeé¢˜ç›®ä¸è§£é¢˜æ€è·¯","vssue-title":"å¸¸è§çš„leetCodeé¢˜ç›®ä¸è§£é¢˜æ€è·¯",category:"å¿ƒæƒ…éšç¬”",permalink:"/posts/:year/:month/:day/:slug.html"},regularPath:"/_posts/2022-03-10-leetcode-thinking.html",relativePath:"_posts/2022-03-10-leetcode-thinking.md",key:"v-448645d2",path:"/posts/2022/03/10/leetcode-thinking.html",headers:[{level:2,title:"å¸¸è§çš„ç®—æ³•æ€è·¯",slug:"å¸¸è§çš„ç®—æ³•æ€è·¯"},{level:3,title:"P1. å›æ–‡å­—ç¬¦ä¸²åˆ¤æ–­",slug:"p1-å›æ–‡å­—ç¬¦ä¸²åˆ¤æ–­"},{level:3,title:"P2. æ±‚å’Œä¸ºç»™å®šå€¼çš„ä¸¤ä¸ªæ•°",slug:"p2-æ±‚å’Œä¸ºç»™å®šå€¼çš„ä¸¤ä¸ªæ•°"},{level:3,title:"P3. æœ‰åºæ•°ç»„ä¸­æ±‚å’Œä¸ºç»™å®šå€¼çš„ä¸¤ä¸ªæ•°",slug:"p3-æœ‰åºæ•°ç»„ä¸­æ±‚å’Œä¸ºç»™å®šå€¼çš„ä¸¤ä¸ªæ•°"},{level:3,title:"P4. åˆ¤æ–­äºŒå‰æ ‘æ˜¯å¦å¯¹ç§°",slug:"p4-åˆ¤æ–­äºŒå‰æ ‘æ˜¯å¦å¯¹ç§°"},{level:3,title:"P5. ä¸ç”¨+/-æ±‚ä¸¤æ•°ä¹‹å’Œ",slug:"p5-ä¸ç”¨-æ±‚ä¸¤æ•°ä¹‹å’Œ"},{level:3,title:"P6. å•èº«æ•°å­—",slug:"p6-å•èº«æ•°å­—"},{level:3,title:"P7. è¡Œåˆ—é€’å¢çš„äºŒç»´æ•°ç»„æœç´¢",slug:"p7-è¡Œåˆ—é€’å¢çš„äºŒç»´æ•°ç»„æœç´¢"},{level:3,title:"P8. åˆ¤æ–­äºŒå‰æ ‘æ˜¯å¦ç›¸åŒ",slug:"p8-åˆ¤æ–­äºŒå‰æ ‘æ˜¯å¦ç›¸åŒ"},{level:3,title:"P9. åè½¬å•é“¾è¡¨",slug:"p9-åè½¬å•é“¾è¡¨"},{level:3,title:"P10. æ•°å€¼çš„ n æ¬¡æ–¹",slug:"p10-æ•°å€¼çš„-n-æ¬¡æ–¹"},{level:3,title:"P11. æ•°ç»„çš„å…¨æ’åˆ—",slug:"p11-æ•°ç»„çš„å…¨æ’åˆ—"},{level:3,title:"P12. å›æ–‡å­ä¸²ä¸ªæ•°",slug:"p12-å›æ–‡å­ä¸²ä¸ªæ•°"},{level:3,title:"P13. å›æ–‡æ•°å­—åˆ¤æ–­",slug:"p13-å›æ–‡æ•°å­—åˆ¤æ–­"},{level:3,title:"P14. åˆ¤æ–­å•é“¾è¡¨æ˜¯å¦ä¸ºå›æ–‡é“¾è¡¨",slug:"p14-åˆ¤æ–­å•é“¾è¡¨æ˜¯å¦ä¸ºå›æ–‡é“¾è¡¨"},{level:3,title:"P15. ç¼ºå¤±çš„æ•°å­—",slug:"p15-ç¼ºå¤±çš„æ•°å­—"},{level:3,title:"P16. äºŒå‰æ ‘çš„æœ€å°æ·±åº¦",slug:"p16-äºŒå‰æ ‘çš„æœ€å°æ·±åº¦"},{level:3,title:"P17. å¸¦æœ‰ min å‡½æ•°çš„æ ˆ",slug:"p17-å¸¦æœ‰-min-å‡½æ•°çš„æ ˆ"},{level:3,title:"P18. åˆå¹¶ä¸¤ä¸ªæœ‰åºé“¾è¡¨",slug:"p18-åˆå¹¶ä¸¤ä¸ªæœ‰åºé“¾è¡¨"},{level:3,title:"P19. åˆå¹¶ä¸¤ä¸ªæœ‰åºæ•°ç»„",slug:"p19-åˆå¹¶ä¸¤ä¸ªæœ‰åºæ•°ç»„"},{level:3,title:"P20. æ±‚ä¸¤ä¸ªæœ‰åºæ•°ç»„çš„ä¸­ä½æ•°",slug:"p20-æ±‚ä¸¤ä¸ªæœ‰åºæ•°ç»„çš„ä¸­ä½æ•°"},{level:3,title:"P21. è¿ç»­å­åºåˆ—çš„æœ€å¤§å’Œ",slug:"p21-è¿ç»­å­åºåˆ—çš„æœ€å¤§å’Œ"},{level:3,title:"P22. äºŒå‰æ ‘çš„æœ€å¤§æ·±åº¦",slug:"p22-äºŒå‰æ ‘çš„æœ€å¤§æ·±åº¦"},{level:3,title:"P23. æ•°ç»„ä¸­è¶…è¿‡ä¸€åŠçš„æ•°å­—",slug:"p23-æ•°ç»„ä¸­è¶…è¿‡ä¸€åŠçš„æ•°å­—"},{level:3,title:"P24. å®ç° LRU ç¼“å­˜",slug:"p24-å®ç°-lru-ç¼“å­˜"},{level:3,title:"P25. æ²¡æœ‰é‡å¤å­—ç¬¦çš„æœ€é•¿å­ä¸²é•¿åº¦",slug:"p25-æ²¡æœ‰é‡å¤å­—ç¬¦çš„æœ€é•¿å­ä¸²é•¿åº¦"},{level:3,title:"P26. æœ€é•¿å›æ–‡å­ä¸²",slug:"p26-æœ€é•¿å›æ–‡å­ä¸²"},{level:3,title:"P27. åˆ¤æ–­å•é“¾è¡¨æ˜¯å¦æœ‰ç¯",slug:"p27-åˆ¤æ–­å•é“¾è¡¨æ˜¯å¦æœ‰ç¯"},{level:3,title:"P28. é“¾è¡¨çš„ç›¸äº¤èŠ‚ç‚¹",slug:"p28-é“¾è¡¨çš„ç›¸äº¤èŠ‚ç‚¹"},{level:3,title:"P29. æ‹¬å·çš„åˆæ³•æ’åˆ—",slug:"p29-æ‹¬å·çš„åˆæ³•æ’åˆ—"},{level:3,title:"P30. ç¼–è¾‘è·ç¦»",slug:"p30-ç¼–è¾‘è·ç¦»"},{level:3,title:"P31. å®¹çº³æœ€å¤šæ°´çš„å‡¹æ§½å®¹é‡",slug:"p31-å®¹çº³æœ€å¤šæ°´çš„å‡¹æ§½å®¹é‡"},{level:3,title:"P32. çˆ¬æ¥¼æ¢¯æ–¹æ³•æ•°",slug:"p32-çˆ¬æ¥¼æ¢¯æ–¹æ³•æ•°"},{level:3,title:"P33. äºŒå‰æ ‘çš„å±‚åºéå†",slug:"p33-äºŒå‰æ ‘çš„å±‚åºéå†"},{level:3,title:"P34. äºŒå‰æ ‘çš„é€†å±‚åºéå†",slug:"p34-äºŒå‰æ ‘çš„é€†å±‚åºéå†"},{level:3,title:"P35. äºŒå‰æ ‘ä¸­åºéå†",slug:"p35-äºŒå‰æ ‘ä¸­åºéå†"},{level:3,title:"P36. äºŒåˆ†æœç´¢",slug:"p36-äºŒåˆ†æœç´¢"},{level:3,title:"P37. äºŒåˆ†æœç´¢æ’å…¥ä½ç½®",slug:"p37-äºŒåˆ†æœç´¢æ’å…¥ä½ç½®"},{level:3,title:"P38. äºŒç»´æ•°ç»„çš„äºŒåˆ†æœç´¢",slug:"p38-äºŒç»´æ•°ç»„çš„äºŒåˆ†æœç´¢"},{level:3,title:"P39. åˆ¤æ–­äºŒå‰æ ‘æ˜¯å¦å¹³è¡¡",slug:"p39-åˆ¤æ–­äºŒå‰æ ‘æ˜¯å¦å¹³è¡¡"},{level:3,title:"P40. æ±‚ä¸¤ä¸ªå•é“¾è¡¨ä¹‹å’Œ",slug:"p40-æ±‚ä¸¤ä¸ªå•é“¾è¡¨ä¹‹å’Œ"},{level:3,title:"P41. ä¸‘æ•°",slug:"p41-ä¸‘æ•°"},{level:3,title:"P42. å­—ç¬¦ä¸²è½¬æ•´æ•°",slug:"p42-å­—ç¬¦ä¸²è½¬æ•´æ•°"},{level:3,title:"P43. å®ç° strstr",slug:"p43-å®ç°-strstr"},{level:3,title:"P44. æ£€éªŒäºŒå‰æœç´¢æ ‘",slug:"p44-æ£€éªŒäºŒå‰æœç´¢æ ‘"},{level:3,title:"P45. æœ‰æ•ˆçš„æ‹¬å·åºåˆ—",slug:"p45-æœ‰æ•ˆçš„æ‹¬å·åºåˆ—"},{level:3,title:"P46. ä¹°å–è‚¡ç¥¨çš„æœ€å¤§åˆ©æ¶¦",slug:"p46-ä¹°å–è‚¡ç¥¨çš„æœ€å¤§åˆ©æ¶¦"},{level:3,title:"P47. ç¿»è½¬äºŒå‰æ ‘",slug:"p47-ç¿»è½¬äºŒå‰æ ‘"},{level:3,title:"P48. å•é“¾è¡¨åˆ é™¤æ•°å­—",slug:"p48-å•é“¾è¡¨åˆ é™¤æ•°å­—"},{level:3,title:"P49. äºŒè¿›åˆ¶ä¸­ 1 çš„ä¸ªæ•°",slug:"p49-äºŒè¿›åˆ¶ä¸­-1-çš„ä¸ªæ•°"},{level:3,title:"P50. çŸ©é˜µç½®é›¶",slug:"p50-çŸ©é˜µç½®é›¶"}],lastUpdated:"7/9/2022, 6:46:23 PM",lastUpdatedTimestamp:1657363583e3,type:"post",top:!1,tags:[],category:"å¿ƒæƒ…éšç¬”",createdAt:"2022-03-10",updatedAt:"2022-07-09"},{title:"ä¸Šä¼ ä¸‹è½½æ–‡ä»¶æ–¹å¼æ€»ç»“",frontmatter:{layout:"post",title:"ä¸Šä¼ ä¸‹è½½æ–‡ä»¶æ–¹å¼æ€»ç»“",date:"2023-03-23",excerpt:"ä¸Šä¼ ä¸‹è½½æ–‡ä»¶æ–¹å¼æ€»ç»“","vssue-title":"ä¸Šä¼ ä¸‹è½½æ–‡ä»¶æ–¹å¼æ€»ç»“",category:"å¿ƒæƒ…éšç¬”",permalink:"/posts/:year/:month/:day/:slug.html"},regularPath:"/_posts/2023-03-23-upload-file.html",relativePath:"_posts/2023-03-23-upload-file.md",key:"v-fb815392",path:"/posts/2023/03/23/upload-file.html",headers:[{level:2,title:"ä¸‹è½½çš„æ–¹å¼",slug:"ä¸‹è½½çš„æ–¹å¼"},{level:3,title:"ç›´æ¥ä¸‹è½½çš„æ–¹å¼",slug:"ç›´æ¥ä¸‹è½½çš„æ–¹å¼"},{level:3,title:"æ–‡ä»¶æµè½¬blobå¯¹è±¡ä¸‹è½½",slug:"æ–‡ä»¶æµè½¬blobå¯¹è±¡ä¸‹è½½"},{level:2,title:"ä¸Šä¼ æ–‡ä»¶çš„æ–¹å¼",slug:"ä¸Šä¼ æ–‡ä»¶çš„æ–¹å¼"},{level:3,title:"1. ä¼ ç»Ÿä¸Šä¼ æ–¹å¼",slug:"_1-ä¼ ç»Ÿä¸Šä¼ æ–¹å¼"},{level:3,title:"2. formDataä¸Šä¼ ",slug:"_2-formdataä¸Šä¼ "},{level:3,title:"3. æ‹–æ‹½ä¸Šä¼ ",slug:"_3-æ‹–æ‹½ä¸Šä¼ "}],lastUpdated:"3/29/2023, 5:12:36 PM",lastUpdatedTimestamp:1680081156e3,type:"post",top:!1,tags:[],category:"å¿ƒæƒ…éšç¬”",createdAt:"2023-03-23",updatedAt:"2023-03-29"},{title:"typescriptæ€»ç»“",frontmatter:{layout:"post",title:"typescriptæ€»ç»“",date:"2021-04-03",excerpt:"typescriptæ€»ç»“","vssue-title":"typescriptæ€»ç»“",category:"å¿ƒæƒ…éšç¬”",permalink:"/posts/:year/:month/:day/:slug.html"},regularPath:"/_posts/2021-04-03-typescript.html",relativePath:"_posts/2021-04-03-typescript.md",key:"v-53b0f14d",path:"/posts/2021/04/03/typescript.html",headers:[{level:2,title:"typesciptæ€»ç»“",slug:"typesciptæ€»ç»“"},{level:3,title:"1. typescriptæ˜¯ä»€ä¹ˆ",slug:"_1-typescriptæ˜¯ä»€ä¹ˆ"},{level:3,title:"2. TypeScriptå®‰è£…å’Œç¼–è¯‘",slug:"_2-typescriptå®‰è£…å’Œç¼–è¯‘"},{level:3,title:"3. æ•°æ®ç±»å‹",slug:"_3-æ•°æ®ç±»å‹"},{level:3,title:"4. å‡½æ•°",slug:"_4-å‡½æ•°"},{level:3,title:"5. ç±»",slug:"_5-ç±»"},{level:3,title:"6. æ¥å£",slug:"_6-æ¥å£"},{level:3,title:"7. æ³›å‹",slug:"_7-æ³›å‹"},{level:3,title:"8.ç»“æ„ç±»å‹ç³»ç»Ÿ",slug:"_8-ç»“æ„ç±»å‹ç³»ç»Ÿ"},{level:3,title:"9.ç±»å‹ä¿æŠ¤",slug:"_9-ç±»å‹ä¿æŠ¤"},{level:3,title:"10. ç±»å‹å˜æ¢",slug:"_10-ç±»å‹å˜æ¢"},{level:3,title:"11. æ¨¡å—VSå‘½åç©ºé—´",slug:"_11-æ¨¡å—vså‘½åç©ºé—´"},{level:3,title:"12.ç±»å‹å£°æ˜",slug:"_12-ç±»å‹å£°æ˜"}],lastUpdated:"4/1/2023, 1:38:16 PM",lastUpdatedTimestamp:1680327496e3,type:"post",top:!1,tags:[],category:"å¿ƒæƒ…éšç¬”",createdAt:"2021-04-03",updatedAt:"2023-04-01"},{frontmatter:{title:"Hello World...",layout:"Home"},regularPath:"/",key:"v-b2754d56",path:"/",type:"page"},{frontmatter:{title:"Enjoy coding",layout:"Posts"},regularPath:"/posts/",key:"v-1f814451",path:"/posts/",type:"page"},{frontmatter:{title:"æ ‡ç­¾",layout:"Tags"},regularPath:"/posts/tags/",key:"v-03721585",path:"/posts/tags/"},{frontmatter:{title:"åˆ†ç±»",layout:"Categories"},regularPath:"/posts/categories/",key:"v-5eb9e6bc",path:"/posts/categories/"},{frontmatter:{title:"æŠ€æœ¯æ–‡ç«  | åˆ†ç±»",layout:"Category"},regularPath:"/posts/categories/%E6%8A%80%E6%9C%AF%E6%96%87%E7%AB%A0.html",key:"v-1746ab84",path:"/posts/categories/æŠ€æœ¯æ–‡ç« .html"},{frontmatter:{title:"å·¥å…·æ”¶é›† | åˆ†ç±»",layout:"Category"},regularPath:"/posts/categories/%E5%B7%A5%E5%85%B7%E6%94%B6%E9%9B%86.html",key:"v-34e2e03f",path:"/posts/categories/å·¥å…·æ”¶é›†.html"},{frontmatter:{title:"docs | åˆ†ç±»",layout:"Category"},regularPath:"/posts/categories/docs.html",key:"v-6fe1551c",path:"/posts/categories/docs.html"},{frontmatter:{title:"å¿ƒæƒ…éšç¬” | åˆ†ç±»",layout:"Category"},regularPath:"/posts/categories/%E5%BF%83%E6%83%85%E9%9A%8F%E7%AC%94.html",key:"v-d262708c",path:"/posts/categories/å¿ƒæƒ…éšç¬”.html"}],themeConfig:{lang:{home:"Hello World...",posts:"Enjoy coding",category:"åˆ†ç±»",categories:"åˆ†ç±»",tag:"æ ‡ç­¾",tags:"æ ‡ç­¾",allCategories:"å…¨éƒ¨",search:"æŸ¥æ‰¾",searchHint:"æŸ¥æ‰¾æ ‡é¢˜å’Œæ‘˜è¦",noRelatedPosts:"æ²¡æœ‰ç›¸å…³æ–‡ç« ",top:"ç½®é¡¶",createdAt:"å‘å¸ƒäº",updatedAt:"ä¿®æ”¹äº",prevPost:"ä¸Šä¸€ç¯‡",nextPost:"ä¸‹ä¸€ç¯‡",toc:"æ–‡ç« ç›®å½•",comments:"è¯„è®º",notFound:"å“å‘€ï¼ä½ è¦æ‰¾çš„é¡µé¢ä¸åœ¨è¿™é‡Œ"},personalInfo:{nickname:"Glitr",description:"Enjoy coding,<br/>Enjoy life:)",copyrightYear:2023,email:"glitteringma@gmail.com",location:"Beijing City, China",organization:"Secrecy",avatar:"https://www.mamingjuan.cn/assets/img/avatar.jpeg",sns:{github:{account:"glitzma",link:"https://github.com/happy760690"}}},header:{background:{url:["/assets/img/header-image-01.jpg","/assets/img/header-image-02.jpg","/assets/img/header-image-03.jpg","/assets/img/header-image-04.jpg","/assets/img/header-image-05.jpg"],useGeo:!1},showTitle:!1},lastUpdated:!0,nav:[{text:"Home",link:"/",exact:!0},{text:"Search",link:"/posts/",exact:!1},{text:"About",link:"/custom-pages/",exact:!1}],comments:{platform:"github",owner:"glitzma",repo:"glitzma.github.io",clientId:"8a8132b8a43c18b5ab7b",clientSecret:"7984b0e1448a95648328f74140d6354108aadf4b",autoCreateIssue:!0},pagination:{perPage:20},defaultPages:{},plugins:{}},locales:{"/":{title:"é©¬æ˜å¨Ÿ",path:"/"}}};var P=l(32);l(308);s.a.component("CustomLayout",()=>l.e(11).then(l.bind(null,394)));var w=l(120),x=l(122),$=l(24),T=l.n($),A={name:"BackToTop",props:{threshold:{type:Number,default:300}},data:()=>({scrollTop:null}),computed:{show(){return this.scrollTop>this.threshold}},mounted(){this.scrollTop=this.getScrollTop(),window.addEventListener("scroll",T()(()=>{this.scrollTop=this.getScrollTop()},100))},methods:{getScrollTop:()=>window.pageYOffset||document.documentElement.scrollTop||document.body.scrollTop||0,scrollToTop(){window.scrollTo({top:0,behavior:"smooth"}),this.scrollTop=0}}},j=(l(310),l(3)),U=Object(j.a)(A,(function(){var t=this._self._c;return t("transition",{attrs:{name:"fade"}},[this.show?t("svg",{staticClass:"go-to-top",attrs:{xmlns:"http://www.w3.org/2000/svg",viewBox:"0 0 49.484 28.284"},on:{click:this.scrollToTop}},[t("g",{attrs:{transform:"translate(-229 -126.358)"}},[t("rect",{attrs:{fill:"currentColor",width:"35",height:"5",rx:"2",transform:"translate(229 151.107) rotate(-45)"}}),this._v(" "),t("rect",{attrs:{fill:"currentColor",width:"35",height:"5",rx:"2",transform:"translate(274.949 154.642) rotate(-135)"}})])]):this._e()])}),[],!1,null,"5fd4ef0c",null).exports,E=l(124),O=l(146),C=l(145),M=l.n(C),S=l(6);function z(t){return{username:t.login,avatar:t.avatar_url,homepage:t.html_url}}function L(t){return{id:t.number,title:t.title,content:t.body,link:t.html_url}}function I(t){return{like:t["+1"],unlike:t[-1],heart:t.heart}}function R(t){return{id:t.id,content:t.body_html,contentRaw:t.body,author:z(t.user),createdAt:t.created_at,updatedAt:t.updated_at,reactions:I(t.reactions)}}function B(t){return"like"===t?"+1":"unlike"===t?"-1":t}class H{constructor({baseURL:t="https://github.com",owner:e,repo:l,labels:s,clientId:a,clientSecret:o,state:i,proxy:r}){if(void 0===o||void 0===r)throw new Error("clientSecret and proxy is required for GitHub V3");this.baseURL=t,this.owner=e,this.repo=l,this.labels=s,this.clientId=a,this.clientSecret=o,this.state=i,this.proxy=r,this.$http=M.a.create({baseURL:"https://github.com"===t?"https://api.github.com":Object(S.b)(t,"api/v3"),headers:{Accept:"application/vnd.github.v3+json"}}),this.$http.interceptors.response.use(t=>t.data&&t.data.error?Promise.reject(new Error(t.data.error_description)):t,t=>(void 0===t.response&&"Network Error"===t.message&&(t.response={status:403}),Promise.reject(t)))}get platform(){return{name:"GitHub",link:this.baseURL,version:"v3",meta:{reactable:!0,sortable:!1}}}redirectAuth(){window.location.href=Object(S.a)(Object(S.b)(this.baseURL,"login/oauth/authorize"),{client_id:this.clientId,redirect_uri:window.location.href,scope:"public_repo",state:this.state})}async handleAuth(){const t=Object(S.e)(window.location.search);if(t.code){if(t.state!==this.state)return null;const e=t.code;delete t.code,delete t.state;const l=Object(S.a)(Object(S.d)(window.location.href),t)+window.location.hash;window.history.replaceState(null,"",l);return await this.getAccessToken({code:e})}return null}async getAccessToken({code:t}){const e=Object(S.b)(this.baseURL,"login/oauth/access_token"),l="function"==typeof this.proxy?this.proxy(e):this.proxy,{data:s}=await this.$http.post(l,{client_id:this.clientId,client_secret:this.clientSecret,code:t},{headers:{Accept:"application/json"}});return s.access_token}async getUser({accessToken:t}){const{data:e}=await this.$http.get("user",{headers:{Authorization:"token "+t}});return z(e)}async getIssue({accessToken:t,issueId:e,issueTitle:l}){const s={};if(t&&(s.headers={Authorization:"token "+t}),!e){s.params={q:[`"${l}"`,"is:issue","in:title",`repo:${this.owner}/${this.repo}`,"is:public",...this.labels.map(t=>"label:"+t)].join(" "),timestamp:Date.now()};const{data:t}=await this.$http.get("search/issues",s);return t.items.map(L).find(t=>t.title===l)||null}try{s.params={timestamp:Date.now()};const{data:t}=await this.$http.get(`repos/${this.owner}/${this.repo}/issues/${e}`,s);return L(t)}catch(t){if(t.response&&404===t.response.status)return null;throw t}}async postIssue({accessToken:t,title:e,content:l}){const{data:s}=await this.$http.post(`repos/${this.owner}/${this.repo}/issues`,{title:e,body:l,labels:this.labels},{headers:{Authorization:"token "+t}});return L(s)}async getComments({accessToken:t,issueId:e,query:{page:l=1,perPage:s=10}={}}){const a={params:{timestamp:Date.now()}},o={params:{page:l,per_page:s,timestamp:Date.now()},headers:{Accept:["application/vnd.github.v3.raw+json","application/vnd.github.v3.html+json","application/vnd.github.squirrel-girl-preview"]}};t&&(a.headers={Authorization:"token "+t},o.headers.Authorization="token "+t);const[i,r]=await Promise.all([this.$http.get(`repos/${this.owner}/${this.repo}/issues/${e}`,a),this.$http.get(`repos/${this.owner}/${this.repo}/issues/${e}/comments`,o)]),n=r.headers.link||null,p=/rel="next"/.test(n)?Number(n.replace(/^.*[^_]page=(\d*).*rel="next".*$/,"$1"))-1:/rel="prev"/.test(n)?Number(n.replace(/^.*[^_]page=(\d*).*rel="prev".*$/,"$1"))+1:1,u=n?Number(n.replace(/^.*per_page=(\d*).*$/,"$1")):s;return{count:Number(i.data.comments),page:p,perPage:u,data:r.data.map(R)}}async postComment({accessToken:t,issueId:e,content:l}){const{data:s}=await this.$http.post(`repos/${this.owner}/${this.repo}/issues/${e}/comments`,{body:l},{headers:{Authorization:"token "+t,Accept:["application/vnd.github.v3.raw+json","application/vnd.github.v3.html+json","application/vnd.github.squirrel-girl-preview"]}});return R(s)}async putComment({accessToken:t,commentId:e,content:l}){const{data:s}=await this.$http.patch(`repos/${this.owner}/${this.repo}/issues/comments/${e}`,{body:l},{headers:{Authorization:"token "+t,Accept:["application/vnd.github.v3.raw+json","application/vnd.github.v3.html+json","application/vnd.github.squirrel-girl-preview"]}});return R(s)}async deleteComment({accessToken:t,commentId:e}){const{status:l}=await this.$http.delete(`repos/${this.owner}/${this.repo}/issues/comments/${e}`,{headers:{Authorization:"token "+t}});return 204===l}async getCommentReactions({accessToken:t,commentId:e}){const{data:l}=await this.$http.get(`repos/${this.owner}/${this.repo}/issues/comments/${e}`,{params:{timestamp:Date.now()},headers:{Authorization:"token "+t,Accept:"application/vnd.github.squirrel-girl-preview"}});return I(l.reactions)}async postCommentReaction({accessToken:t,commentId:e,reaction:l}){const s=await this.$http.post(`repos/${this.owner}/${this.repo}/issues/comments/${e}/reactions`,{content:B(l)},{headers:{Authorization:"token "+t,Accept:"application/vnd.github.squirrel-girl-preview"}});return 200===s.status?this.deleteCommentReaction({accessToken:t,commentId:e,reactionId:s.data.id}):201===s.status}async deleteCommentReaction({accessToken:t,commentId:e,reactionId:l}){return 204===(await this.$http.delete(`repos/${this.owner}/${this.repo}/issues/comments/${e}/reactions/${l}`,{headers:{Authorization:"token "+t,Accept:"application/vnd.github.squirrel-girl-preview"}})).status}}l(353);var N=[P.a,{},({Vue:t})=>{t.mixin({computed:{$dataBlock(){return this.$options.__data__block__}}})},{},P.a,w.a,x.a,({Vue:t})=>{t.component("BackToTop",U)},E.a,({Vue:t})=>t.component("TOC",()=>l.e(52).then(l.bind(null,384))),({Vue:t})=>{const e=JSON.parse('{"owner":"glitzma","repo":"glitzma.github.io","clientId":"8a8132b8a43c18b5ab7b","clientSecret":"7984b0e1448a95648328f74140d6354108aadf4b","autoCreateIssue":true}');t.use(O.a,Object.assign({},e,{api:H}));const l=t.component("Vssue");t.component("Vssue",{functional:!0,render(t,{parent:s,data:a}){if(e.locale||(a.attrs||(a.attrs={}),a.attrs.options||(a.attrs.options={}),a.attrs.options.locale||(a.attrs.options=Object.assign({locale:s.$lang||"en"},a.attrs.options))),s._isMounted)return t(l,a);s.$once("hook:mounted",()=>{s.$forceUpdate()})}})}],V=["Iconfont","BackToTop"];class Z extends class{constructor(){this.store=new s.a({data:{state:{}}})}$get(t){return this.store.state[t]}$set(t,e){s.a.set(this.store.state,t,e)}$emit(...t){this.store.$emit(...t)}$on(...t){this.store.$on(...t)}}{}Object.assign(Z.prototype,{getPageAsyncComponent:o.e,getLayoutAsyncComponent:o.d,getAsyncComponent:o.c,getVueComponent:o.f});var D={install(t){const e=new Z;t.$vuepress=e,t.prototype.$vuepress=e}};function q(t,e){const l=e.toLowerCase();return t.options.routes.some(t=>t.path.toLowerCase()===l)}var K={props:{pageKey:String,slotKey:{type:String,default:"default"}},render(t){const e=this.pageKey||this.$parent.$page.key;return Object(o.h)("pageKey",e),s.a.component(e)||s.a.component(e,Object(o.e)(e)),s.a.component(e)?t(e):t("")}},F={functional:!0,props:{slotKey:String,required:!0},render:(t,{props:e,slots:l})=>t("div",{class:["content__"+e.slotKey]},l()[e.slotKey])},G={computed:{openInNewWindowTitle(){return this.$themeLocaleConfig.openNewWindowText||"(opens new window)"}}},W=(l(354),l(355),Object(j.a)(G,(function(){var t=this._self._c;return t("span",[t("svg",{staticClass:"icon outbound",attrs:{xmlns:"http://www.w3.org/2000/svg","aria-hidden":"true",focusable:"false",x:"0px",y:"0px",viewBox:"0 0 100 100",width:"15",height:"15"}},[t("path",{attrs:{fill:"currentColor",d:"M18.8,85.1h56l0,0c2.2,0,4-1.8,4-4v-32h-8v28h-48v-48h28v-8h-32l0,0c-2.2,0-4,1.8-4,4v56C14.8,83.3,16.6,85.1,18.8,85.1z"}}),this._v(" "),t("polygon",{attrs:{fill:"currentColor",points:"45.7,48.7 51.3,54.3 77.2,28.5 77.2,37.2 85.2,37.2 85.2,14.9 62.8,14.9 62.8,22.9 71.5,22.9"}})]),this._v(" "),t("span",{staticClass:"sr-only"},[this._v(this._s(this.openInNewWindowTitle))])])}),[],!1,null,null,null).exports),Y={functional:!0,render(t,{parent:e,children:l}){if(e._isMounted)return l;e.$once("hook:mounted",()=>{e.$forceUpdate()})}};s.a.config.productionTip=!1,s.a.use(a.a),s.a.use(D),s.a.mixin(function(t,e,l=s.a){!function(t){t.locales&&Object.keys(t.locales).forEach(e=>{t.locales[e].path=e});Object.freeze(t)}(e),l.$vuepress.$set("siteData",e);const a=new(t(l.$vuepress.$get("siteData"))),o=Object.getOwnPropertyDescriptors(Object.getPrototypeOf(a)),i={};return Object.keys(o).reduce((t,e)=>(e.startsWith("$")&&(t[e]=o[e].get),t),i),{computed:i}}(t=>class{setPage(t){this.__page=t}get $site(){return t}get $themeConfig(){return this.$site.themeConfig}get $frontmatter(){return this.$page.frontmatter}get $localeConfig(){const{locales:t={}}=this.$site;let e,l;for(const s in t)"/"===s?l=t[s]:0===this.$page.path.indexOf(s)&&(e=t[s]);return e||l||{}}get $siteTitle(){return this.$localeConfig.title||this.$site.title||""}get $canonicalUrl(){const{canonicalUrl:t}=this.$page.frontmatter;return"string"==typeof t&&t}get $title(){const t=this.$page,{metaTitle:e}=this.$page.frontmatter;if("string"==typeof e)return e;const l=this.$siteTitle,s=t.frontmatter.home?null:t.frontmatter.title||t.title;return l?s?s+" | "+l:l:s||"VuePress"}get $description(){const t=function(t){if(t){const e=t.filter(t=>"description"===t.name)[0];if(e)return e.content}}(this.$page.frontmatter.meta);return t||(this.$page.frontmatter.description||this.$localeConfig.description||this.$site.description||"")}get $lang(){return this.$page.frontmatter.lang||this.$localeConfig.lang||"en-US"}get $localePath(){return this.$localeConfig.path||"/"}get $themeLocaleConfig(){return(this.$site.themeConfig.locales||{})[this.$localePath]||{}}get $page(){return this.__page?this.__page:function(t,e){for(let l=0;l<t.length;l++){const s=t[l];if(s.path.toLowerCase()===e.toLowerCase())return s}return{path:"",frontmatter:{}}}(this.$site.pages,this.$route.path)}},_)),s.a.component("Content",K),s.a.component("ContentSlotsDistributor",F),s.a.component("OutboundLink",W),s.a.component("ClientOnly",Y),s.a.component("Layout",Object(o.d)("Layout")),s.a.component("NotFound",Object(o.d)("NotFound")),s.a.prototype.$withBase=function(t){const e=this.$site.base;return"/"===t.charAt(0)?e+t.slice(1):t},window.__VUEPRESS__={version:"1.9.9",hash:"1390722"},async function(t){const e="undefined"!=typeof window&&window.__VUEPRESS_ROUTER_BASE__?window.__VUEPRESS_ROUTER_BASE__:_.routerBase||_.base,l=new a.a({base:e,mode:"history",fallback:!1,routes:k,scrollBehavior:(t,e,l)=>l||(t.hash?!s.a.$vuepress.$get("disableScrollBehavior")&&{selector:decodeURIComponent(t.hash)}:{x:0,y:0})});!function(t){t.beforeEach((e,l,s)=>{if(q(t,e.path))s();else if(/(\/|\.html)$/.test(e.path))if(/\/$/.test(e.path)){const l=e.path.replace(/\/$/,"")+".html";q(t,l)?s(l):s()}else s();else{const l=e.path+"/",a=e.path+".html";q(t,a)?s(a):q(t,l)?s(l):s()}})}(l);const o={};try{await Promise.all(N.filter(t=>"function"==typeof t).map(e=>e({Vue:s.a,options:o,router:l,siteData:_,isServer:t})))}catch(t){console.error(t)}return{app:new s.a(Object.assign(o,{router:l,render:t=>t("div",{attrs:{id:"app"}},[t("RouterView",{ref:"layout"}),t("div",{class:"global-ui"},V.map(e=>t(e)))])})),router:l}}(!1).then(({app:t,router:e})=>{e.onReady(()=>{t.$mount("#app")})})},357:function(t,e,l){t.exports=l(356)},6:function(t,e,l){"use strict";l.d(e,"a",(function(){return a})),l.d(e,"b",(function(){return o})),l.d(e,"c",(function(){return n})),l.d(e,"d",(function(){return p})),l.d(e,"e",(function(){return u}));var s=l(19);const a=(t,e)=>`${t}${Object(s.stringify)(e,{addQueryPrefix:!0})}`,o=(t,e)=>`${t.replace(/\/$/,"")}/${e.replace(/^\//,"")}`;var i=l(144),r=l.n(i);const n=t=>r()(t,"YYYY-MM-DD HH:mm:ss"),p=t=>(t.split("#")[0]||"").split("?")[0]||"",u=t=>Object(s.parse)(t,{ignoreQueryPrefix:!0})}}]);